validators.csv
Validator,Vote Account,Stake (SOL),VL,LLV,CV,VO
Helius,he1iusunGwqrNtafDtLdhsUQDFvo13z9sUa36PauBtk,12927922.41011,1.520,90.84%,98.92%,N
Galaxy,CvSb7wdQAFpHuSpTYTJnX5SYH4hCfQ9VuGnqrKaKwycB,12921836.00198,1.601,87.59%,96.03%,N
Ledger by Figment,26pV97Ce83ZQ6Kz9XT4td8tdoUFPTng8Fb8gPyc53dJx,9368048.03425,1.649,86.87%,94.93%,N
Figment,CcaHc2L43ZWjwCHART3oZoJvHLAe9hzT2DJNUpBzoTN1,8684346.33734,1.657,87.59%,94.10%,N
P2P.org,FKsC411dik9ktS6xPADxs4Fk2SCENvAiuccQHLAPndvk,7501448.02386,1.562,88.21%,95.91%,N
Everstake,9QU2QSxhb24FUX3Tu2FpczXjpK3VYrvRudywSZaM29mF,6201903.85361,1.613,87.16%,94.76%,N
,55L7AV93xRmx5F7rX1GCfsHxfYWNu4bKsG6f8tG6dFRo,5745244.74358,1.657,86.85%,92.74%,N
,H74qox1GASBWd94FWMyy6GVAbRVLf9SAMgbJ1tzSUAst,5416256.65656,1.616,87.53%,94.74%,N
,G9x1mqewTeVnXLmv3FamYD5tq1AdS395RHH3MLQPj6TY,5410141.07998,1.520,90.39%,96.49%,N
Staking Facilities | MEV 🔥,DumiCKHVqoCQKD8roLApzR5Fit8qGV5fVQsJV9sTZk4a,5390105.07089,1.581,90.09%,96.87%,N
,XzMLju7T6BSSngmsPogeuryd6uswiimkPU87gB2chho,5159799.23523,1.489,93.79%,98.96%,N
Twinstake,Ak5BJzQe2R8qFuyYmaAFPjXuD7XPux3ZNTv52D7rfiqR,5095560.73810,1.301,95.57%,99.93%,N
,3ZYJxzCeweSoh2Jj7oCgencFs9y27iKmXJeqYapje1cj,5038902.52724,1.633,87.22%,94.66%,N
,AZoCYB4VgoM9DR9f1ZFcBn8xPSbtbqoxZnKJR7tkvEoX,5030433.90279,1.471,91.82%,98.03%,N
Jito2,J1to2NAwajc8hD6E6kujdQiPn1Bbt2mGKKZLY9kSQKdB,4918291.87672,1.373,94.25%,98.67%,N
Jito1,J1to1yufRnoWn81KYg1XkTWzmKjnYSnmE2VY8DGUJ9Qv,4393997.04188,1.744,84.14%,99.31%,N
Jupiter Validator [0% Commission + 100% MEV Kickback],CatzoSMUkTRidT5DwBxAC2pEtnwMBTpkCepHkFgZDiqb,4208445.31214,2.130,73.47%,97.37%,N
Kraken,KRAKEnMdmT4EfM8ykTFH6yLoCd5vNLcQvJwF66Y2dag,4045700.25336,1.561,90.58%,97.41%,N
,6x9uLhegx488uA3dPoq8DWHS488K4FsEqeeMXeW7kQPx,3875215.42252,1.315,95.24%,99.50%,N
Kiln,DdCNGDpP7qMgoAy6paFzhhak2EeyCZcgjH7ak5u5v28m,3781863.52684,1.414,94.12%,99.33%,N
,iZADA4YKVRJZJaDUV3j79DzyK4VJkK3DGTfvvqvbC1K,3598006.05266,2.271,71.44%,82.45%,N
0% Fee >> #1 🥇 | melea One,GvZEwtCHZ7YtCkQCaLRVEXsyVvQkRDhJhQgB6akPme1e,3470548.31135,1.658,87.89%,96.73%,N
,6jzDwKeR21EFHwaRgZMefMxJ9D2vnQRqfYxkpUuJppPh,3310680.57311,1.337,95.23%,99.69%,N
SOL Community,3Ty8DYNBkK237zPvACti83EJYGxDcMcoDMCou5r3eV5Q,3162000.02663,1.810,83.59%,98.68%,N
Asymmetric Research,CertusDeBmqN8ZawdkxK5kFGMwBXdudvWHYwtNgNhvLu,2987276.97177,1.343,94.79%,98.61%,N
Luganodes,6aow5rTURdbhbeMDrFrbP2GR5vZjMEhktEy87iH1VGPs,2964953.65262,2.234,73.25%,86.09%,N
,7xENfwKCajMB5aVTgmTB6h7d7Su91wTcnfMjoAQCMvKq,2916667.65538,1.891,81.95%,90.92%,N
Upbit Staking,GHViLgbrJdZDPb6sphRbeuPNM9cmjsFuGWzrTF1sKF5n,2834987.99110,1.949,81.23%,92.75%,N
,BkSS8kGUNcQkTgEKMmBhHxGVLdzw43EAzDYpZqyyxFrT,2798058.28433,1.982,77.62%,98.25%,N
Shinobi Systems 🚀 stakeview.app,BLADE1qNA1uNjRgER6DtUFf7FU3c1TWLLdpPeEcKatZ2,2771189.74760,1.374,91.05%,99.46%,N
Solflare,EXhYxF25PJEHb3v5G1HY8Jn8Jm7bRjJtaxEghGrUuhQw,2623208.76691,1.317,95.20%,99.41%,N
Coinbase,beefKGBWeSpHzYBHZXwp5So7wdQGX6mu4ZHCsH3uTar,2622303.58169,1.688,86.59%,95.19%,N
,At2rZHk554qWrjcmdNkCQGp8i4hdKLf52EXMrDmng5ab,2502415.68759,1.714,86.60%,94.09%,N
,72LbWsZFEyB7xrB9ggeoPUrSw2vzPEnsPJJHZo1svkM7,2502415.68049,1.899,81.83%,90.86%,N
,oixpqSNX7CKWHw93ViA8u1CcLzZXDmacKJjV4AvxMZE,2502395.55270,2.286,71.92%,85.40%,N
,2uXzxR2EZVaHE3CuaDaUJ8C9Qr54LMfwkY5BtRPAzbPE,2502391.13772,1.922,81.20%,89.39%,N
,8mHUDJjzPo2AwJp8SHKmG9rk9ftWTp7UysqYz36cMpJe,2502383.45450,1.359,95.31%,99.53%,N
,HDc84gs3CtqhebHycmoDpc5n2y3CFfd5GqYZkr2XiBMR,2500000.93738,2.089,76.76%,82.94%,N
,BhREyEsP3YAtQbTCrKcXgTNTeaq9gdjWji3Nz4d8Q1P2,2500000.93738,1.459,92.86%,98.19%,N
,JDMq8hxZnad2smKLGkFbfg8zVMZHKQcMugD4tMR9u2da,2499999.99217,2.138,73.18%,97.67%,N
,33hurzEz6aEnzfESL6pnNyR6DCgcKzssT1pwSzDCBTRQ,2499999.93967,1.542,90.10%,97.55%,N
,BU3ZgGBXFJwNTrN6VUJ88k9SJ71SyWfBJTabYqRErm4F,2499999.93967,2.126,73.37%,97.99%,N
,E9W5kU2fnha9yp4RmFZgNNsRUvy6oKnB9ZyR9LC81WaE,2409417.93738,1.887,82.09%,89.28%,N
,HxYHGzR58gyf6c4JAX85eK8GVuaZU2zne4be82Lq9SBQ,2322628.99412,1.335,95.42%,99.88%,N
,A9V5e8ZLwQ2ArKZnCcrmz9Q92pDCkUXE5tqJmJDZkCMo,2252534.52151,1.583,89.80%,95.90%,N
,CxFH1pqJnEmyaE4wEwqdqMKpQMpkmdaMxhS7SzpHokA8,2182665.92163,2.037,76.25%,97.44%,N
HashKey Cloud,Cat8oWQiFfrR3c7BcceTYcpnYCzSWfCPjMXT7mfHXvEP,2120705.92694,1.940,79.09%,97.70%,N
AG 0% fee + ALL MEV profit share,F5b1wSUtpaYDnpjLQonCZC7iyFvizLcNqTactZbwSEXK,2107195.21004,1.510,92.01%,98.59%,N
,FjkSLYmi6BJAJQn1iSLUGrPrBQjMaD4y1DVdnv3yaTsX,2083334.28044,1.837,83.54%,90.94%,N
,Ezp1xiZC2mcenHjFB4nAfb8HW9YuGEBFit49yGG7XdAu,2064958.81416,1.990,77.36%,98.36%,N
,HZKopZYvv8v6un2H6KUNVQCnK5zM9emKKezvqhTBSpEc,2000000.48717,1.283,96.11%,99.98%,N
,ERut3CwqVeoa616QBaoHc5jL52RpkXjZZZ7MeaMaCtLi,1985437.56427,1.578,88.40%,95.59%,N
,8BMMDVM8Tb88a2Hx1VSZ1TKmH1rMHbVU7xVafMk9JrEW,1875000.95347,1.852,83.05%,92.34%,N
,HhYEE3dAShc3772wEiy73XDYnLjVxyBL8eAWKyRcF14y,1835664.80073,1.357,95.03%,99.58%,N
Hanabi Staking 🎆 | Staking Champions,mintrNtxN3PhAB45Pt41XqyKghTTpqcoBkQTZqh96iR,1674762.98215,1.615,88.84%,95.53%,N
Laine ❤️ stakewiz.com,GE6atKoWiQ2pt3zL7N13pjNHjdLVys8LinG8qeJLcAiL,1652499.43690,1.501,91.28%,98.44%,N
RockawayX Infra,RBFvvcGPBpgkBYmJGsphoDQJD8sszSuorM7TorWm12Y,1631345.16418,1.379,93.81%,99.71%,N
Staked,51JBzSTU5rAM8gLAVQKgp4WoZerQcSqWC7BitBzgUNAm,1591118.47194,1.647,88.67%,95.55%,N
,74pfDmYto6aAqCzFH1mNJ8NxF7A4LQ4cXkipGwgjY39u,1566399.78284,1.364,94.61%,99.71%,N
StakeWolf,DQ7D6ZRtKbBSxCcAunEkoTzQhCBKLPdzTjPRRnM6wo1f,1521261.31518,1.938,81.26%,92.54%,N
,2LrSZWeyvFovnzVFpFPQE7Lxt64xs3s3Re9HLxMJtGwf,1514670.27979,1.816,84.21%,92.41%,N
,7jPqpHuN5v59dtBom2tjmYEfi6WaM4sFtJeTD6fzhcdS,1494427.59810,2.135,73.23%,97.36%,N
Block Logic +MEV +Triton,9GJmEHGom9eWo4np4L5vC6b6ri1Df2xN8KFoWixvD1Bs,1445768.25466,1.338,95.12%,99.65%,N
Solana Compass 🧭 Solana For The People,EARNynHRWg6GfyJCmrrizcZxARB3HVzcaasvNa8kBS72,1409505.99958,1.328,95.14%,99.93%,N
,FuvD3qqrVjuh355sBs1u8bUS3aU8NgknymLskPvtAc6N,1293070.46402,1.474,92.51%,98.78%,N
Lion3d | 0% Forever,DMSuZcavta8L1w1tSiH8bALWjz6Q6KSryGG6m6Az4Qt5,1234269.89442,1.336,96.00%,99.84%,N
,AzbQjKoLepbDS8C6hgkRY7UCRwbwZZ9HqdtnWyef9WjX,1207979.32490,1.785,84.84%,92.30%,N
Chorus One,Chorus6Kis8tFHA7AowrPMcRJk3LbApHTYpgSNXzY5KE,1196360.24906,1.297,95.91%,99.89%,N
Overclock,AS3nKBQfKs8fJ8ncyHrdvo4FDT6S8HMRhD75JjCcyr1t,1133830.55011,1.381,91.04%,97.94%,N
mrgn3,mrgn6ETrBDM8mjjYN8rbVwFqVwF8z6rtmvGLbdGuVUU,1106024.64175,1.278,95.06%,98.63%,N
,A3ahHFBFkPkuLMhxLGEnKVVZu2J6Qy8Z7z2zozyXGhw2,1103880.40200,1.775,93.72%,98.72%,N
,FsT844wGgZg7MLR9Uc9T9qHQxmSoFVanhfgAEQvS966r,1039752.20339,1.674,86.87%,93.89%,N
Allnodes⚡️ 0% fee,6F5xdRXh2W3B2vhte12VG79JVUkUSLYrHydGX1SAadfZ,1035607.01425,1.441,93.11%,99.85%,N
mrgn4,mrgn4t2JabSgvGnrCaHXMvz8ocr4F52scsxJnkQMQsQ,1023872.86947,1.340,93.29%,98.53%,N
,Bkskrv38Kn7zJR5mvmbCDGn2M4Jyhzt2ZqwQXV6rYnXa,1020933.35395,1.775,85.64%,94.22%,N
Pumpkin's Pool 🐈 Supports Animal Welfare ❤️,DsiG71AvUHUEo9rMMHqM9NAWQ6ptguRAHyot6wGzLJjx,1000117.22425,1.700,86.17%,96.73%,N
,7KVnUL45FH4N8Z7x1dnvJ7GzMx12cs81mS26mHzNjQPN,983914.52527,2.116,80.47%,92.64%,N
validator.com,Va1idkzkB6LEmVFmxWbWU8Ao9qehC62Tjmf68L3uYKj,980332.17539,1.973,78.78%,95.72%,N
Blockdaemon 🧱👿 Validator,FQwewNXahV7MiZcLpY6p1xhUs2acVGQ3U5Xxc7FzV571,979188.12161,1.653,88.02%,95.51%,N
,J21SMPFJEY9ExCDPiSJQXN23PVSeoQe3LnKD7QcP3bgP,935757.06096,1.918,81.51%,94.21%,N
GREED Academy - funding education,GREEDkpTvpKzcGvBu9qd36yk6BfjTWPShB67gLWuixMv,889090.07988,1.680,88.08%,99.32%,N
Stakeconomy 🚀 Jito MEV + Triton.One,GNZ1PAAS33davY4Q1BMEpZEpVBtRtGvSpcTH5wYVkkVt,886145.36523,1.558,89.69%,97.86%,N
Leapfrog 🐸 topvalidators.app,Pond1QyT1sQtiru3fi9G5LGaLRGeUpJKR1a2gdbq2u4,857187.73770,1.498,90.86%,97.85%,N
Juicy Stake,juicQdAnksqZ5Yb8NQwCLjLWhykvXGktxnQCDvMe6Nx,854280.82454,1.798,85.09%,95.59%,N
DimAn,voteRnv6PBzmiGP8NicWtQiqEJTwKKq2SxtqtdLUJjd,852679.91613,1.759,83.03%,96.30%,N
,ALiQdX94fYbGUt8ar6chuAN1nj8g8bKSgJ7qV3W7bPsS,850530.26176,1.531,94.35%,99.21%,N
Rocket,7S9dHgoeMYvtShTjEC3x5D3THRDQz123WVGPseZsm3hm,846177.75909,1.815,84.28%,94.00%,N
Alpha,5sMmkL4BXjU6vZXQxE3RquH2CR8v8Zbfi1EAAFxLfxMx,825470.29186,1.540,90.83%,98.31%,N
Quatro,5orRi4tMEGneZ9U2y381JnBEnsqFJDBSNQLhBn98Bkcv,824664.09102,1.611,89.19%,96.62%,N
Flash,3tUZu4CkwMLwYdosoGc85n48VgDMyxZVkL1VUJc7DrxW,822411.04487,1.581,89.99%,97.72%,N
Hamsa,8uEgdseqbUrDLfmHbUpTHoH1LLRxeViYDk7K6NdXKRYM,801923.04487,2.038,78.40%,85.86%,N
Bella2.0,8zHJtME22tiY3UsSHtDJXo2J8hUfwikBxXNbVqQzA92r,775594.34886,1.611,89.23%,96.73%,N
Quantum Crypto | 0% Fees,QUANT7qKUEW4PS4eP9jq4K35rDHpgWkWcgjbW1CwnGJ,752719.81420,1.535,90.63%,97.17%,N
Alpha Pro | High APY🚀 100% Reliable ⭐ VIP Services,7opSZGmevWhRDyLt5Wu38FZFjUyredGmMki4DNmxDnjd,735782.77337,1.630,90.33%,97.24%,N
Cogent Crypto ⚙️ CogentCrypto.io,CogentC52e7kktFfWHwsqSmr8LiS1yAtfqhHcftCPcBJ,696503.93991,1.501,87.18%,98.50%,N
,8tjRQLzor4dP4qd1e7pVDdQmsdwdVv4kSeCVEHwWEiQW,687210.92914,1.576,89.52%,95.86%,N
LowFeeValidation + MEV TOP PERFORMANCE,edu1fZt5i82cFm6ujUoyXLMdujWxZyWYC8fkydWHRNT,658773.30021,1.366,94.75%,99.56%,N
mrgn,7emL18Bnve7wbYE9Az7vYJjikxN6YPU81igf6rVU5FN8,651980.81729,1.198,96.49%,98.78%,N
Chainode Tech & MEV(0% Fee),BxFf75Vtzro2Hy3coFHKxFMZo5au8W7J8BmLC3gCMotU,632749.61848,1.408,93.30%,99.76%,N
Stake.su | 0% fee +MEV,2PEyBgsPYBQ8pMdXQtEaPGNqWQHE9GCnmV2tTVN4GMru,607032.34625,1.547,90.19%,97.67%,N
SolanaHub,7K8DVxtNJGnMtUY1CQJT5jcs8sFGSZTDiG7kowvFpECh,585989.89274,1.392,93.87%,98.83%,N
Unit 410,EwsDhgfbT6H4FRC7AHdhXNBxfBSbWCbDfknrw6g5Dph6,538000.29091,1.507,91.81%,98.58%,N
BONK - Powered by Jito,J1to3PQfXidUUhprQWgdKkQAMWPJAEqSJ7amkBDE9qhF,509834.21570,1.779,83.05%,99.35%,N
Orangefin Ventures,oRAnGeU5h8h2UkvbfnE5cjXnnAa4rBoaxmS4kbFymSe,498231.22737,1.355,91.55%,99.03%,N
Blocksmith,SmithX2hngQMZXVN36C6TsyjthTU3YnsALAs1MaDghV,485643.90668,1.827,82.97%,95.36%,N
Mad Validator,B6nDYYLc2iwYqY3zdmavMmU9GjUL2hf79MkufviM2bXv,484422.60401,1.765,84.28%,97.18%,N
Limitless Systems,8yPiZWMNYMhEqTmPSRc6LsWLFC8pewYEzmgc5kRCLTrZ,476310.66007,2.167,72.08%,96.76%,N
Lifinity Protocol,2ayMCC4aizr8RGg5ptXYqu8uoxW1whNek1hE1zaAd58z,463098.89855,1.433,93.00%,99.49%,N
mrgn2,mrgn2vsZ5EJ8YEfAMNPXmRux7th9cNfBasQ1JJvVwPn,439901.51836,1.209,96.16%,98.74%,N
Chainflow,CAf8jfgqhia5VNrEF4A7Y9VLD3numMq9DVSceq7cPhNY,430637.32329,2.250,73.61%,83.56%,N
,46mwXQRqWwj8Jp4ZR2tL1Yr3Snm99xDfKUs5jz7hLmEK,414465.19653,1.337,95.04%,99.78%,N
Stakin,4PsiLMyoUQ7QRn1FFiFCvej4hsUTFzfvJnyN4bj1tmSN,409950.70266,1.777,86.17%,94.20%,N
The Gods Themselves,RNXpSdqrJL6eoLrbW69Q9qsFviEwRpfFfk3HiRRRohq,406562.69159,1.433,92.93%,99.48%,N
,AqCAXRpWJBpaJxEDyv7ruP2wi6fef6DBTaAHSxdTf7hA,391665.42172,2.203,71.18%,89.88%,N
Phantom Validator,J2nUHEAgZFRyuJbFjdqPrAa9gyWDuc7hErtDQHPhsYRp,391113.25929,1.777,84.27%,94.33%,N
,71nnaeTyVeA4pTozAPjRuQyMydQTZCrFUkz7Pzy5tiDJ,373530.65851,1.346,94.87%,99.97%,N
Bitcoin Suisse,EcLPNfLFgCkbcTuvdeQ85pnQMgAfBDqi2dkoNVPrSyr5,365406.90984,1.689,87.23%,95.69%,N
BlockStake Labs | 0% Fee,696fkFqwiLxsDG8Jr5MvU9kvGm9uuMuTPh3rn3ybRNQm,363699.38109,1.566,89.43%,99.53%,N
,J9pfW4dJM8fkoCLQazymPcbNrUV3DzDo9qqokYiTHLZ,354425.97917,1.600,88.91%,98.54%,N
Xandeum Labs 0% fee +🔥APY %,6hZL2FZim27WkQccMfygvvXH2eow5u3wR6XUJHbMoeWP,352069.90050,1.757,83.99%,98.67%,N
"Ubik Capital - 0% Fee, MEV",9sWYTuuR4s12Q4SuSfo5CfWaFggQwA6Z8pf8dWowN5rk,346382.18613,1.389,94.33%,99.65%,N
pico🙄.sol💎200% MEV & Fee kickback🚀,3xjfK9C9YNcta8MvK1US4sQ3bc6DEjoJoR3qLExGf9xE,344332.97275,2.231,73.75%,81.73%,N
Solana Beach Validator,BeachiopjxQxL7CaHNSZsynApiZCKx9QFVtcWNz3jDBo,322557.06886,1.750,86.37%,93.95%,N
Forbole,76nwV8zz8tLz97SBRXH6uwHvgHXtqJDLQfF66jZhQ857,318458.19889,1.544,90.92%,97.49%,N
Edgevana,EdGevanAjM8a6Gg9KxBVrmVdZAUGAZ9xaVd7t9R4H2x,305810.75383,1.744,85.36%,93.14%,N
,6tgtejPHUHR1pECzXqQT8EHZqnKCWZFSqdZXDyBaKe3b,298521.08426,1.396,94.07%,99.69%,N
Superfast,R1vAoSPFQdCc6wsAEMtxWXjqptSeN1YUiq2Zni1of21,293817.61918,1.973,80.03%,94.23%,N
Rustiq Technology,GB44NXtM7zGm6QnzQjzHZcRKSswkJbox8aJsKiXGbFJr,291694.19110,1.588,89.22%,96.78%,N
MARGUS.ONE 💎 0% fee +MEV!,CzmqDuqEpfnkptuLAcikmJrhCnhFXo8aUBj6Rto1SPAc,284864.83567,2.077,74.46%,98.15%,N
Vault X | 0% fee +MEV,FahWJg2PkphJaMUUCzdYhXkD5NngUuuFRFD3YCE3BSwb,281704.37640,1.441,92.68%,99.71%,N
SerGo,BWkvytz3MAiLkUbMuYK5yV1VYThbBYYQYG3gdef8NLw5,278914.88929,2.192,73.10%,87.99%,N
Legends,6W8yrMwtDU5G6ErazhZHfLjqZV8cMvajpSRGYgrZ3d4v,274409.25913,1.834,84.73%,94.21%,N
Stardust Staking - 0% fee forever,5iJDEVRi1nMLwKAWhYbEokZnvBAe15rgFaHGkggVEP9z,272687.06989,1.636,88.22%,96.23%,N
Nordic Staking 0% fee top APY +MEV,B1w6SZcyvjyp6zEyStcc8u9AxXAh2AbYvNzMmP9rRKE9,271261.56673,1.676,88.09%,96.07%,N
Syncnode,7PmWxxiTneGteGxEYvzj5pGDVMQ4nuN9DfUypEXmaA8o,266254.97028,1.654,87.09%,99.33%,N
Spectrum Staking +MEV,6JfBwvcz5QUKQJ37BMKTLrf968DDJBtwoZLw19aHwFtQ,262609.23620,1.443,92.71%,99.64%,N
1000X.sh,1KXz4xKV2viJCGpxqnQqdf2J45vQr5USdmtcJLTaHkm,261408.69679,1.407,93.33%,99.17%,N
Solend,SLNDoinxE7cCgE5ga6FJZ19F4FiUaEmtzSatbY6cjWy,258636.03956,1.595,88.87%,96.59%,N
Stronghold 3% Fee + MEV,Ac1beBKixfNdrTAac7GRaTsJTxLyvgGvJjvy4qQfvyfc,258299.08475,1.627,89.26%,97.16%,N
Luna Labs,Luna8BkZNpZ9DKmszrZYPvFpTr4eJJfxxTnGDwTrYkv,257756.31509,1.289,96.26%,99.92%,N
Solana Community Administrator Node,5K8qgC9nHzKHSSyo9fKLsMfYmavYdMgEaYx86cMmVKVv,257311.91720,2.152,75.66%,86.98%,N
,HQbdXrLm3EuFyu66mCpDS4ir9zRkhNHJVnck4vxG7jEo,257090.84465,1.316,92.63%,98.48%,N
Lucky Stake,Luck3DN3HhkV6oc7rPQ1hYGgU3b5AhdKW9o1ob6AyU9,255161.94210,1.605,89.04%,96.47%,N
Vnode,3r5ZXC1yFqMmk8VwDdUJbEdPmZ8KZvEkzd5ThEYRetTk,251877.12534,1.705,86.59%,97.29%,N
InfStones,37BPVW1Ne1XHrzK15xguAS2BTdobVfThDzTE2mv8SsnJ,250983.30782,1.831,82.04%,99.25%,N
Drift,DriFTm3wM9ugxhCA1K3wVQMSdC4Dv4LNmyZMmZiuHRpp,250695.73058,1.470,92.60%,98.95%,N
nordstar ⭐ reliable staking +MEV,NoRDTy8jpkpjPR7yxahVdoEUPngbojPhFU5jb8TtY4m,247856.14690,1.878,82.92%,93.43%,N
Aronogarago,DySC6eaUthvVVzu4s8GFupm4PzYLNvq372AYnNrKP4xP,247604.77380,2.153,76.90%,83.50%,N
polkachu.com,voEskim7SFWrPx1tV2PVisqyrJejxmDEARX11mtZ5vo,246034.71862,2.022,78.31%,87.21%,N
MCF,2het6nBRLq9LLZER8fqUEk7j5pbLxq2mVGqSse2nS3tf,245689.59577,2.439,83.10%,90.82%,N
0% Fee 🐱 Theta,CV7uvPY1Hk5Avb2NvkGJoUzGnipZrEZK27j5rQJoUae9,245569.51602,2.171,73.78%,88.05%,N
Dependable Solana Validator +MEV,EKUh585fWD7LeDRHgmYd9EXpQnY6KNbNAhyBi3FuVw6Y,244644.19611,1.545,90.57%,98.98%,N
L0vd 0% fee +MEV,A7uqmajxP3NdzbYDXiGQRGTL8d3dZ5pjS4kR9NTZcxtg,244051.18942,2.120,73.63%,96.17%,N
SGTstake - 0% Fee,GuxBSrv5jnSwwPepkqnmkM7YCBSakKanbnw4BKMdda4j,242157.29440,1.488,91.70%,99.20%,N
Aurora Validator,34yvUa2fxfm2tUqxFEj9PHrVNwCcdzd51eo9hntWpZRs,241710.09527,1.675,86.25%,99.64%,N
ARCHER 0% commission + MEV,DUCKsGEPEdNv9QeskPNwoJdWgAXjxUFrkNDEKjAnLWyY,240601.01211,1.521,90.85%,99.06%,N
OHara Nodes,3zEbnWKibg574DaGC1EA3zLNwBK6MGQxEySUgQWKBaYV,239873.02482,1.699,90.86%,98.48%,N
GRASSETS-TECH 🚀 - 0% commission,2g2QU1NDRax6i2mKzRwgRfdBFoDkMC6bj7Zp5Q3i8sCq,239822.36335,1.429,92.96%,99.63%,N
GateOmega MEV+ | SolCircl Mobile App,9Gko8QZBbV5SrEvHKtQHcMrGGSfgFP3KJUozEGifu25x,239589.40742,2.117,73.60%,95.36%,N
Solana Ukraine 🇺🇦,HcbE5huUVDgsf7SURsRfQqnFMp3Zz3i49eXMddugPyAP,237733.47026,1.472,91.96%,99.42%,N
StakeITeasy🚀High APY + 0% fee✅ + MEV🔥,vahVByZszdHguLa7U7GLz8UdUFN85mcwdkefiqVjtGt,235483.50173,1.684,87.94%,96.51%,N
alex_s1,Cc7UtVq4G25VbC3w6Ccs2XL2xikjc926q1sHp8zfddoL,234438.02952,1.689,87.95%,95.77%,N
Fitsu,GNajgJGjkdnmZTRGZzsQ4P4eL54gHRMfDDLyZpnZYmUy,233987.36708,1.559,90.43%,98.33%,N
LuminaNodes,7X7oVv6K6wawMNzVriczSAEk18GzqyrYrvqyJbwLAY3s,233634.80098,1.589,90.77%,98.46%,N
Green House Crypto⚡️0% fee +MEV,BSRRvjdKd8SHApi3KtTGbzrdhUojitiwAt4xt4nAxbFh,233614.49267,1.631,90.53%,96.05%,N
SolDev,9jYFwBfbjYmvasFbJyES9apLJDTkwtbgSDRWanHEvcRw,232872.44774,1.562,91.11%,97.82%,N
Kotofix 0%,8EfUy8zz6DF2iTMQCUe4QAnoq4jVUzfU1yvZMCr2yJ7m,232530.67531,2.047,79.84%,88.47%,N
Not a potato + MEV,9KCBBdzx4cGZg14YaqBuZd1tGUvo9ohYnW7KEqQes1E1,232306.27965,1.441,92.96%,99.75%,N
Stake.org,StakeyJXE1yJbEApBVswHN4JdZXcj7V5MHbzffa4dFp,231889.76058,1.531,91.06%,97.77%,N
Latitude.sh,AuBB9st3RqhHBkzZgBSm6SVnHZNJQSHeBWCSkik4bzdA,231721.92636,1.542,89.91%,99.86%,N
lelika,9w3YAf77BSGLQXahTpwAe9U9mNdCXkqmxH17uCyN1wyH,231203.08365,1.607,88.50%,96.39%,N
Ereborus ⚔️  MEV,9xEFsHZt2mbuGQjtVGABxpeQiNeDvj54pfsJrrrUUev6,231084.27094,1.576,90.28%,98.09%,N
JM,Eajfs6oXGGkvjYsxkQZZJcDCLLkUajaHizfgg2xTsqyd,230386.13357,2.176,75.91%,81.82%,N
StakeBowl,Bwkz1ddKoGE8hgiSV6HZLXi9RBLqfBi3HZb2QujzVGgz,230007.98408,1.383,94.09%,99.65%,N
0% Fee + MEV 🧮 Yonta Labs,BeSov1og3sEYyH9JY3ap7QcQDvVX8f4sugfNPf9YLkcV,229091.48471,1.968,79.15%,87.41%,N
Easytoken.me,21wUViiyG1g47VZ39ZZsSkFX9nu6bkyfy6jryHGD2TUB,228756.03588,1.963,81.82%,89.38%,N
Staker Space,49DJjUX3cwFvaZD5rCAwubiz7qdRWDez9xmB381XdHru,225970.65747,1.445,93.18%,98.76%,N
Stakerrash,Rash24BXgUyy65JJ5KBzpYLrj3pyCqEMEixLVimTcDp,225366.77580,1.418,93.29%,99.84%,N
0% Fee🔥 | + MEV | Bizuno.net,DnHUCbu4unnxGukqp5hJWZL6a1P5Msb491f6iybbRCF5,224472.15640,1.690,87.91%,95.67%,N
Nam-dok-mai 🤑 stake-earn-repeat,5XGMWvqZSBk1fktPtxbwaMF5dhkbrtchpwd4xiXG9q8u,223262.65423,1.555,90.52%,99.06%,N
Sergiololpro,BTquv7QcKQU48GyQEspnpseM7dKjMiXSb2XF1TF8BnfZ,221436.94353,1.601,89.20%,98.99%,N
,7nwBKRcUZ4A6Ni1VSoKKSacgLCraqdyQxR8SdVUZmiPN,221090.98830,1.568,89.73%,95.88%,N
Anti 🔥 0%+JitoMEV,Fy6zNoZ1eCPpQX3JXeQ9Yd1HW1BFL8rrFmDvYYDnuxjT,220171.18838,1.288,96.47%,99.90%,N
Trust Nodes,FiijvR2ibXEHaFqB127CxrL3vSj19K2Kx1jf2RbK4BWS,218207.20768,1.452,93.18%,99.31%,N
Cross Stitch Staking,4DcSke272vfn4QQK49RNzPPj9pYasbyjoiY1a5UxLDH1,217648.36338,1.434,92.90%,99.58%,N
kerak69 💥0% fee + Jito MEV💥,39xF5qkfK5HBaG4Hkq6bjumUB2k4B5ozEAmfZoobhUVw,217053.71590,2.316,81.63%,89.74%,N
Consensus 🤝,HFLsfstZkJeWDgVEA5fmXeea876Ad9f1VxrbXk386bBY,215841.22739,1.467,92.11%,99.66%,N
LIKE Pool,HG574XwiowrjLx8h91KhHUhPeMfmUPBLfC9XrXynj9x,215167.52727,1.420,93.12%,99.79%,N
NuFi,3Xn3K5zeTzs4sURj1PCRaF6rvFg2hPgT49B4SiM998f7,213973.37334,1.482,91.86%,99.04%,N
😻 TarKat 😻 +MEV,3r84fqQnrSLrEDA8p5TStbHB8QFRHB9Frcdmq1AGVDYG,212964.77245,1.553,90.66%,99.04%,N
,AAhcGqPdM9WdjhVH6T4vAQLvoDFrYQqirkxCdvxoKhgp,210948.55584,1.639,89.91%,97.86%,N
hodl.global,5nkSzU4oVSDdxZvorYwxz6BQab2VfmHbdA9AnpYVkAL7,210034.96843,1.574,90.30%,97.54%,N
Bernardo,7Eg46UwGgsufXdd9C9kF27UAyD2t4VdmCdVTtPFoqxCy,209956.16436,1.451,92.68%,99.24%,N
,2EWi8L6xp62VgTqFo3LnhoSP5sL9CWqYxvK7UA63qK9x,209931.62344,2.260,76.31%,82.39%,N
✨ lux8.net ✨,48oxpSHQkM4sdXUY9NQ8KnEtebzZbyk8uUT7JRdVQNuf,209744.94821,1.642,88.44%,97.11%,N
Wen | 0% fee +MEV,WENuuMXGi8adKogNbQj33Vxgia9oA2erkWAPF4szWN1,209282.79856,1.880,86.94%,97.90%,N
Green Labs | Nordic Waves,Atw2Wond9H3DHfgg5NGqi4dxMwF3Nrgdhm39x2oK8MCW,206069.66304,2.070,78.12%,85.49%,N
StakeHero,DSRnpPkLWLA5V2TZo3AJwe2eGfkZ4ZaCwRf2v7e4aXg7,204927.94528,2.144,74.34%,84.18%,N
,3uvqr8aX2fS3W9XHdud5avRGbUtY9uswBGmr9S2N7uF2,204691.76493,1.663,89.82%,97.93%,N
VovaZero,BXNW9ysAB9ksEDidcNWraaFkMeA88q6xzFRSyNnGvQYC,204446.71936,1.575,93.21%,99.41%,N
Empyrial - 0% fee and high performance,5frYQSynysBe1akCVK9tNBJ5j8jgBgUsjAXAgqHxvykJ,204080.39011,1.521,91.56%,99.01%,N
SergPorto,9PzBVUpbEGcGxnjxq4WvJMnScwvQTY2wFrfMZv8FEPjC,204013.49620,1.852,84.29%,91.90%,N
Irinkor,6tajb2FFdjiRJLrdwfKQsijHGmeVFcTcXJn6NH3BEoLW,201136.39060,1.713,87.19%,95.02%,N
☀️ Turquoise ✅ 0% Fee + Jito MEV,2ZuVhyBsUbTh27LBCQH3BkenjPp86gUZiNBKmhPsTRpT,199816.49308,1.596,89.70%,98.76%,N
Dreik-Steak 0% fee + MEV,GQ8DSRSNCFGEdCEwc6em1ma18qSPc5cXCSDnSPSznWBP,199690.25529,2.219,72.42%,85.67%,N
Majestysol | 🔥 0% Fee + ⚡ MEV,5AC692spnjbegP7ttCXJEzUe8S81sLYsqJd8Ae6Zv1xU,198643.84722,1.601,89.41%,98.77%,N
Zeta Node,FnAPJkzf19s87sm24Qhv6bHZMZvZ43gjNUBRgjwXpD4v,198170.64145,2.074,74.29%,97.73%,N
Spear | best rewards!,7XTz9RDt9gbckonUUYvzQ8q3Pfdo36oiQsreXsHhNFzj,197407.86113,1.622,88.96%,98.39%,N
,Ebm1XKkMzaFg2L5rzLPBnFHMtpDPa6SWJ7nVUzZUmXmR,197347.60312,1.577,87.85%,94.61%,N
,BCRg6hEiLbrdgaTUbUbuz8deDcbyCgP37fCBMGqNhhq7,197296.72372,1.612,90.30%,98.05%,N
The Lode (Sentries),LodezVTbz3v5GK6oULfWNFfcs7D4rtMZQkmRjnh65gq,196880.43376,1.604,89.86%,98.56%,N
Rare Stake 0% FAT,MNDE6ueF5uMvyk3ohq7wWZ8H749pbpj1yHj2MvMRCJM,196782.17428,2.081,78.38%,85.51%,N
StakeShip 🛳  Additional rewards,HAK7iPgQTFwqEzPfVrRDbG5epFdk1dsA9qQexytsDoes,196521.68151,1.567,90.06%,98.43%,N
EONpool,eondcw2upjH14EuvBzmn6HfGEGo8t9hG9JbXtPj6cym,196484.93822,1.645,87.99%,95.88%,N
hukutu4.sol 0% FEE +MEV,CrLn7zEBytbmRBUGhkDyyUbGCa6H7bMCnw94Dip8QbcJ,196436.66610,1.922,82.39%,90.17%,N
,HVuzQEZtxQycpfJsLNAeykrqT2vLzKtUyKaAnNsnKy1A,194933.12773,1.567,90.84%,98.54%,N
,H1ScoL1TosVSRvJgARRnMs9extCdXZRWdKRqY4H7k3ik,193661.22039,1.676,89.39%,97.40%,N
"Trillium: Stake, Earn, and Fuel Solana!",tri1cHBy47fPyhCvrCf6FnR7Mz6XdSoSBah2FsZVQeT,192576.42426,1.523,86.75%,98.64%,N
,b3d74rXdGgdw9XeqRWgAnm7bsZgg9mf5J5hjZMqKxRD,192429.58890,1.585,90.72%,98.39%,N
Meyerbro +MEV,5iZ5PQPy5Z9XDnkfoWPi6nvUgtxWnRFwZ36WaftPuaVM,191543.44829,1.528,90.37%,97.74%,N
HanoiHilton,CqSMzh8DWZeqYVa5M1V1rHU825T19NCjYipM3pkdHncm,191027.10595,1.574,89.92%,97.52%,N
SolBrothers,GA2t11gJcmuZ4y7pShTzgYDkxVaJaVQJqkVUqojhPPsT,190735.46736,1.416,93.65%,99.68%,N
Spread Networks,HjQugFHAUm7XbaZhmjnGioNUccdMUnFmwFTJgepm5q3n,190687.58352,2.210,73.54%,89.49%,N
JStaking: 0% fee · top returns,DPmsofVJ1UMRZADgwYAHotJnazMwohHzRHSoomL6Qcao,189596.01402,2.231,72.15%,85.62%,N
AD 0% fee + ALL MEV profit share ✨,3zxkHtntSzfW2rukRFqhN9SDPzqicvF6WwN6yDwdSvxQ,188894.97329,1.882,84.54%,91.90%,N
StakeSquid,27MtjMSAQ2BGkXNuJEJkxFyCJT8dugGAaHJ9T7Gc6x4x,188155.98859,1.687,86.76%,96.10%,N
GrandpaStake,6SmEcnuXJ3ZYqJWTqCoPQMhfvey6PfWb1LebLzoH3f7m,186719.43206,1.479,91.95%,99.64%,N
STEALTH,8D8XL6ovqx15RKwC1XtFyTz6H8JYF2fUsxTnsY4b123P,185442.70839,1.414,93.57%,99.74%,N
Marco Polo 0% Fee +MEV,EUiPhYZ8NoWX5ZzDh2cRR1fAS4su9jjV3YE7veyactzd,183656.56138,1.629,88.62%,98.72%,N
MARVEL+MEV!,i6PZjkPHGYmPfPE8LsJuLn5huZyusXhmysiDiHGPjxb,182765.98204,1.449,92.88%,98.79%,N
,9jVU1ET9Xxqnrsqjw8FGxmHgcXs6Hbj1HECckWqn2LUD,181610.42411,1.918,84.00%,93.86%,N
,EBVj3uwSKZpqEb1K267JaPxDQhULVqCy6hYeQqjsPh81,180952.13583,1.339,91.81%,95.92%,N
nodtech,H9p8zGs56CnL4b7RrbwQ6htc6V4K8PUtKvqH2m7hYAtL,180560.19551,1.942,84.93%,92.68%,N
H2O Nodes,FCvNkHa4U3yh7AXWGGL2jWLWiSRouR8EtzY5WVTHKTHa,180319.08645,1.342,95.19%,99.52%,N
Solar Station,GiXx1mwSR44Tz96CaDqoadzAhZgZv7e3yZshqUwiEwwh,179801.96820,1.593,91.62%,99.07%,N
4BLOCK 0% Fee + All MEV + Bonus profit share,6anBvYWGwkkZPAaPF6BmzF6LUPfP2HFVhQUAWckKH9LZ,179400.50195,2.204,73.37%,87.77%,N
,AjdEzodq5LpRA63AtQaiHyTLDfjTkr6csrtYWiSDPjaK,178630.87158,2.152,83.50%,92.70%,N
,G8hvpQDLe7hGgYtWYt4TJJEbGbgLFCBJYiMi9pMD9Kk2,178519.99304,1.235,95.50%,98.66%,N
ElagabalX 🔥 Zero Fees + MEV Boost🔥,8gJCfKzr55gM6DtAaFqoWjBGAmsJ71mpHem6qJAASBU4,177640.63138,1.609,88.10%,98.04%,N
Rei Ayanami,AWmcz3z2p3NRhB1A47MxjGx1VXGHAyM9Kvf9qD5ogzkP,177153.29480,1.626,92.03%,98.72%,N
r3Dub,EsEtxoyhFTgfvudcy2VwwQJ1qA6BScLUW39PKpYczuxF,176433.93496,1.798,84.51%,91.98%,N
Piranha,1eufsJbqNgMProke17FLSw7JrD97fYhGggrnH9zyWnG,176023.48508,1.804,83.68%,96.58%,N
Viking: Top-Ranking Validator with Additional Rewards | Stake with Us,8F4e1nbeC6hn9jkojtboERZGaafxUUtsqUy3MKJLohkh,175581.63267,1.462,92.48%,99.80%,N
1Dad 🚀 0% Fee + MEV,1Dadio3JRvpEjY6iSmXmhbGy9RiU8Nxh2GmoVbNusbE,175131.07315,1.949,80.90%,91.13%,N
Blockscope.net,7wqiBhRVEkbV3A8LbR9W1eNb5s27CBwoRCVro1okB6ew,174010.87790,1.629,88.40%,98.33%,N
Legiojuve,8ge8UzG9FyW4NDZ6zzZiUypnbcNQ3nUfTBKndxsmWqSB,173572.05691,1.867,89.31%,97.44%,N
Stand With Ukraine,2ZiMfQaT59j86HVWCvspuMtBotnVBeTc3BKk3kKpwgKP,173120.03797,1.562,90.12%,99.51%,N
Perfect Stake 🥩,83c5NZebvsUQsL3e9xb37nHiYchLCudDYtQ5Z3gLnLxv,171686.25137,1.462,93.81%,98.99%,N
LunaNova,LunaFpQkZsZVJL2P2BUqNDJqyVYqrw9buQnjQtMLXdK,170196.25694,1.528,91.58%,98.25%,N
rossi-mainnet,GdVBPczdFaPf1GXvx8ByHeA1ZHAHwwmdQEPihH74SXm9,169372.90875,1.747,86.35%,93.66%,N
Terra,Ac8zL56RqrEwZcJa2HL7ZVCBW8py1ehVYj5qmfJXcdFQ,169198.30403,1.635,89.75%,99.19%,N
☀️ SolaraZ ☀️ +MEV,A2MtELFxn9wAiUrobrZ6vsypQtGHdH3ZesEnvAogvuFZ,169162.50595,2.156,74.94%,90.68%,N
Accountant Validator,G3zgPda4Pr8hspBGYbVQmvQBqpep4zU9ngf9qbP71XMn,168830.76384,1.685,85.94%,99.45%,N
Solstice,Ck2rHWiP22YzrMgwVSe9ngyRW81JXLRot2CUo1Bf5RFh,168768.43606,1.726,84.98%,98.81%,N
Antzfund.com,BHZCk3XnebkC7QKk6az18LBPrqgrL6HRp8bUKX9Mg46v,168167.21221,1.631,91.19%,98.17%,N
SOLGirl + MEV,4tuMshQNpAFpy1YtEHnSsE5EPN1mAT8FevWvn2UPJHNM,168089.14075,2.094,76.27%,84.86%,N
CryptoVik,Fhks5gukimP6vxKYbRY4V1aw888EgHhpdDSscD9V6bub,166784.47206,1.604,89.18%,97.30%,N
,FGRz29GorTc2T6MARp1XF9ZMJzVVNfdfNS4rHUXJPgVa,166725.93411,1.358,94.63%,99.94%,N
Freewheeling,C9YVc5dBPRbmyi8tPJKnrBuVwXeULby1eGXWvUVv866a,166170.42441,1.491,91.71%,99.76%,N
Gersia,GZgVV7MMweKm11hh8z8Nui9kRo3VxUVr2qgmkDdtJesa,165804.47445,1.464,94.48%,99.53%,N
Artemida (@Dazedrez) 0% fee,3NXnw51gHc2rDWTCWU4eVpP1yHyKKbJa1p6JDgMkmiDa,165055.76848,2.050,80.94%,89.03%,N
Paradigm 🧿,6xwWwNVXJLGhgPfBpew7UDcSjQr73McXSRK2EhdhcL1u,164717.56881,1.762,86.48%,95.73%,N
MV 🔥0%fee+MEV🔥,FJ7sKbuXR28w4K5EChBbi9tXYfCfrdpF4EaKnRvLPzL8,164027.25590,1.392,94.21%,99.77%,N
,8oS362Q9oat7QVNKJvMm91SXJjc5vBPwW7gaEHZ9wCDd,163616.99559,1.728,91.55%,98.52%,N
Shmagr,q1phrX11VjA2XEPqsTFMYRfrTZiwUeG7HCVz3d6V5Ua,160351.39413,1.583,92.09%,98.99%,N
Sandy Validator @sandytoken,sandyGeU5cX65Hn1dqjxrtmtGFTUgCtxuYzyrghTPYB,159854.15049,1.822,84.39%,94.08%,N
🍀PADDY - 💰GOLD JITO,Dcoj98wWiKhA4iqxcSg7NtuR2miA7tZqtycMdkPo8XDw,159730.52750,1.432,92.96%,99.68%,N
johndoe,EcjtYtuxBuupjeyXNdttATwoQoNL5Ck7bmrqDCj3ALT4,159197.11883,1.569,89.76%,97.45%,N
Jade Validator,Azc2uttGtHsRLorfQzd7tsMNtfaEg7LyvVEMVtckPCNN,158627.60496,1.679,87.48%,94.70%,N
Green,6ZUCygEHeA1MRgdxZ4V6e6gcAsJz1e2uDA3e3jv1bY7M,158230.50600,1.631,88.50%,96.54%,N
Ketchup,HkqCfZFY5Hh8UDSGH6AJqtxpS6CFC2aqqFgqiDYtSPZw,158114.31556,1.580,89.87%,97.23%,N
maxfillipov,GptPXjYUBUjxpRmueH6F5JcqizvjPTRDShTJQ8Vp6uN1,157870.43504,1.726,90.21%,97.61%,N
BlueLotus 👩‍💻 0% +MEV,1234LB7uvDC23rdCQoK8C3jNwnovUNyeKxz8wC3dghJ5,155917.91655,1.693,87.40%,95.17%,N
NeverBackDown,FQ5Hc8CgnBBFT87QYt72SVVYGEk677fZHDKH1wX2TeQ5,154747.42282,1.474,91.95%,99.52%,N
fransBIG,5kYPCTLoF2y7cynJEuv5LVaTPpLoPbcxiCYKk3KKcB1C,154633.03210,1.689,87.35%,97.68%,N
Yuliya Solana Validator,8c15zdteBtxxcffHsegtppNK9eG9JPye9gL4kCppZmKr,154499.99896,1.477,91.86%,99.53%,N
stake.systems,9tedbEYypEKXAMkHcg42rn3fXY1B8hB6cdE3ZTFouXLL,154278.01156,1.600,89.52%,97.11%,N
OranG3club,AY271jdvcyo5VzBiWsMGLEjpZFFrarq8FDydJHLmYgCG,153820.09064,2.017,79.98%,91.27%,N
Nodes24.io 💎Jito 0% MEV💥,ASfKFAKz6fH4eip1jdLGt5Ym954kU9KYnwq2Csn9ogSz,153679.83795,1.570,90.13%,98.92%,N
Moonlet,GMpKrAwQ9oa4sJqEYQezLr8Z2TUAU72tXD4iMyfoJjbh,151532.91213,1.611,89.34%,96.77%,N
GlobalStake,FdGcvmbpebUwYA3vSywnagsaC3Tq3pAVmcR6VoxVcdV9,151070.66354,1.753,84.70%,96.34%,N
JokeyKitty,J6XZBDuUpuBzgcVGmY8NgHQYKbGZegoYmbpadAKo1qRw,148986.91749,1.720,87.17%,95.00%,N
DICS - Degen Infrastructure Core Services,4qvFxnUXYjBdcviCwVV7gKcGJMCENEBfS82hSLJUhyvu,146908.73876,1.468,92.82%,98.84%,N
lesya,MENFRm8PpkP2QwFV3iubwiqG6GyJ4LZQ7f9k8DUE9Xy,145806.15733,1.945,82.17%,91.56%,N
Tarot,4gGhS4PaKHsg5GWEpo4tHhMibdHMeRa5567NVubMEBiB,145409.22046,1.967,80.31%,89.81%,N
Stake City +MEV,CiTYUYPAPHdcri5yEfsmqVcs54J6j8X1QaiFLgYqMVe,144627.43740,1.879,83.90%,94.47%,N
Cybersol - Secure & Fun!,8N4nic4yCUbHf82FCJfM51XjRDhhFA6C2ghiPfZLjAkL,143985.70698,1.655,87.78%,97.92%,N
StakeService 🔥 0% + MEV,EXrWdDxFaE3Sfsbh3TV5ToGhMqu53xrmeoVdvn467jUH,143039.97796,1.633,89.32%,99.07%,N
FRA 0% Validator | No commission + Jito/MEV,7F6Q6C9sthb4DPaM3gnncwopgJmuFFTu1jYjhBUdvqhj,143034.32772,1.356,94.73%,99.83%,N
Magpie,mnde2ZW5LdekuDB9ywYsKeZvpNUqRXACnGks8d6TShC,142951.63484,2.123,78.96%,87.09%,N
,7DCb5VuNx9XFqsaEgERyb5mwwRunDNtLRudCEoqhcz6N,142934.34815,2.030,81.42%,90.74%,N
SuperteamDE x Staking Facilities | Public Goods Validator,Ehdn9LdjTAURQSMoDPERXLehtvzy7QD762wwPkzGT7RS,141521.64582,1.860,83.76%,91.59%,N
algo|stake,abc1zP7ihWsgQW8z5YmfQNqMckJE5Dfx8fwUNMNVNkY,139719.68245,1.616,91.37%,97.72%,N
,7x7jzvQgZ5PHdkZKrzUy2sXgpb3YxY8XjLqrZgd6nbGy,137321.24051,2.186,72.00%,89.98%,N
,NipDoZC37aMQvv2fFq2moUyyiApQxszc7X4mvWHP2pZ,137058.29413,1.473,92.75%,99.62%,N
Astraeus,NDf9Pv6TAxTDPR6ud3djsd2Ux1WS2m2YfTw4qEmSnQH,134859.88805,1.366,94.40%,99.83%,N
,H3GhqPMwvGLdxWg3QJGjXDSkFSJCsFk3Wx9XBTdYZykc,134854.90816,1.663,87.99%,98.03%,N
North Wind,EBGfQMkRqBZ6mj2AJ1UxwKD7MbiuMGJamzKZe2UZrG6B,131395.99510,1.924,81.41%,88.03%,N
Athena,CJ1GZixWD1WzozqZMm3v9dY2xboRYZfQuuEHzawAthen,128679.72094,1.754,86.48%,94.06%,N
AutoStake ⚡️ 0% fee,D4mLBafAJjpRABT5Tyj6UhuwJ8DLRk74JzyuTMUdU9Fz,128446.99513,1.523,91.06%,97.24%,N
anvel,4aFj9VyXDrqU4TnKWnMVuPaAVTaF4GZLLKZN2iZivW29,128145.17044,1.489,92.03%,99.43%,N
Coverlet +MEV,cover89z945JotsCRGdbjakJm4rnL5XspFSPgN1mVZj,128002.94040,1.980,79.72%,89.04%,N
Phase Labs,phz34EcgWRCT9otPzRS2JtSzVHxQJk4SovqJvV1TQk8,126794.04463,1.664,86.65%,98.09%,N
StakeCraft,BDn3HiXMTym7ZQofWFxDb7ZGQX6GomQzJYKfytTAqd5g,126722.10504,1.515,92.13%,99.08%,N
StakeQuest 🌴 Gamified Staking Launching Soon,11BPTRia5mJKh9JfS6fRwL7VKQNViqrbvZ8XrEQsB5n,126216.71257,1.922,83.03%,89.72%,N
akexkuz,g4MMQmzT7182jBvyUebMvsgvNM3RVrVFFJd9tRjWXhf,123735.29706,1.706,87.21%,94.84%,N
TeeNode,G5rpFxdBqmZGg9Dm7QZwqatKa1YRPE5HDxZqohw7zbz8,123558.28114,1.622,93.60%,99.57%,N
Puerta del Sol,8inoRcYLtHdDL1qHWvGph7pkJKuJdrE2kNkFpjcYaYHf,123250.29725,1.607,90.99%,99.08%,N
Easy 2 Stake | 0% Fees | MEV Rewards,D3DfFvmLBKkX9JJNEpJRXpM1pYTVPQ5dpPQRc9F49xk4,121285.44430,2.406,75.54%,78.95%,N
SolShield,4dmBLJcchyfucSxkVmrymmsnVpZm3rBkp7kbF7qHTTYW,120446.11044,1.672,91.32%,98.40%,N
elgreen,3ZHY9PQtp7MyznRcHRAkFYrTWinQzidYAQxNjBeyzyr9,119712.16835,1.484,92.06%,99.30%,N
Swiss validator,BXf5pMTSWJdfwaiRYpwJjkTUuUe2sdvcJx7X7UNbyGe1,119695.55982,1.433,93.00%,99.51%,N
Lantern,FACqsS19VScz8oo2YhdMg35EsAy6xsCZ9Y58eJXGv8QJ,119597.00297,1.900,85.16%,92.02%,N
k8stake.com,9BkYZz8t6u1VcE26pdRhWhYGuAwDUzXFnfGvLoZTh6Bm,119178.10434,1.839,81.70%,99.41%,N
Bandito Stake,CwSZ17woioM2bqEbaswZJYvx5pemN6t3shBcU6zqPHyG,117093.61476,1.823,82.04%,99.04%,N
bloXroute EU,bXr9MyoUAaGusQZ4gaUPmSZByHAV7RRGr1FhCW5tFh8,116678.20771,1.741,86.80%,92.99%,N
StarPaw.wtf,9V3mbi8z9MHicFQN9n9CGEMfuX4yKaBjJNuzyTUxaWXi,116595.88654,1.799,84.11%,91.33%,N
T-STAKE Systems,H4QVPxS7napq3NEYxqLhxbKi9nJ8s56dD2EQZGsyZ3sb,115548.05431,1.409,93.47%,99.86%,N
Wanderer Staking,7kge23FTbCXc6dZxMPQfAWLnVFTgGzio5wpXUo9si2mV,115125.37281,1.423,93.35%,99.39%,N
Bukovka,B1UaJwhZ9rmB6rUwCikMCkYEPVgpGYgmmrKqfAHCZanw,114117.27012,1.724,87.12%,94.87%,N
ex1arey 💫 0% fee + MEV!,5HScvYkTWL9iojhPv26xK7GqB7oBsj9A2qHCeNRFmdyG,113953.18104,1.689,87.60%,95.53%,N
Cyberili,BohPTSY4vvjGd9ARFqDJjRaHZKP4bde7ewBq65WgRGmA,113949.26302,1.584,90.68%,98.42%,N
Maslenok,HC1NSDR9cbBeQ8V1XJ62VNceUAbjGdnCcH7f5wVFVZw3,113788.47067,1.525,91.19%,98.62%,N
,ATRFbtnsDd9ka3eZooTPixm3AjicHxod1BAhNYBMsj8K,112154.64355,2.365,81.49%,90.73%,N
,7ikNtivRm2EDHQtnheqSnxkbNvRxMgtmthEAG84V8AEf,111906.37230,1.976,78.38%,93.93%,N
Bukashka,FGj3nQTn2Lwe9KkaKnFGm4HcxLSh8B8TjpvP4CinP4iX,110278.04872,1.562,90.26%,97.82%,N
cotikon,EHhxJpoAZXSSmUBhUXUMNd29verm4WdmaHQ2eZtU7fWR,109606.48019,1.848,83.73%,93.85%,N
Arynka,HE1zd4TpbDuKzg6cqbk91XjSZELL7F33eqDinxj5hLfG,109526.90861,1.790,91.45%,98.08%,N
Schenok validator,5akpkYincAbsTBXVbf2GDCg4KatMnc8BKkXZCh7MWGPK,108188.45900,2.047,78.54%,86.25%,N
Solana State,VoTEJDVw84uZvDWcMXYgfNAVcLETHsPyPEc2nTpwZPa,107282.18314,1.559,91.62%,98.62%,N
WS4m,77hUX7gpQov27qQTBDyJKJXNwm7apatfhEdsStC3YUb8,107018.35291,2.235,83.90%,91.41%,N
Indigirka,indVHvxmQVkK4VsdHiK8kXjLDSjHfHRfP3yvZ947Gn3,106728.86759,1.795,86.05%,94.40%,N
NFS 🏆 0% fee +MEV,8vT4MgBeZQmYN44DXwHd2BLM7Z6io186nJk3FQEwy58f,106365.17119,1.553,90.35%,99.29%,N
Let's Node,HQuUQmerqwvBRFo1moWgNPpcc43EJxGUQZmgrrmqA9sA,106201.80981,1.636,88.58%,96.42%,N
xSTAKE | 0% fee,4EsJD6cpaae8rh27U9pHsfxAheCLQnze1bDvXZfpjcUv,106046.35268,1.267,96.65%,99.78%,N
JustStakeIT,5evi7HwSeD95YbvwMpA7cfz6uDFmovHXpcGYAwZbKsoz,105640.97220,1.803,85.22%,94.26%,N
Urban Node,D6HbUn4FeyZWiY5ftTAxK1TXmvCLjBoPG9nRsr8z8y5g,105480.58599,1.650,88.39%,96.15%,N
Forever,9EW9kJVj4GYqXmFcN7XzfxuUEfrB5HLm5jsBNscdBBXb,105213.83283,1.566,89.87%,99.57%,N
,CnB88pH35AjH2XUsiK5X257sVLkGUf11UDioXgJXoLuL,104968.27583,1.780,87.46%,96.14%,N
Radiants,radYEig9KGrMTMWbWRFV7LStotQbnLgPaEFHVDsudQz,104473.74601,1.660,86.77%,98.11%,N
Paragon,VotESBSkLKU8vebS6wTR2rzWWJsLc6YThYS6tebPxXq,104171.40095,2.114,73.57%,95.42%,N
AntzCapital,8ZvTbWfA7txjkNubA9jnv8CWQtwbaZSzpf7vaDDcxMr5,103622.38606,2.228,73.53%,81.52%,N
GoldmemberStake,2Aiyq2zob5ikUvmeRFz1xxoAqqDQYdvNhTTXYLCN1jGL,103193.21586,2.209,72.67%,86.76%,N
,2qsJLygBZ2XoYkRtkngH4fH4CtFmzfnjARbtMSWkZAQs,103098.42262,1.532,90.95%,99.24%,N
Hyperslot,EpRvips2doUUdxvs3Qhf4MCLqVeJEPu47Aci5QbBXASV,102671.51735,2.212,73.14%,79.55%,N
Vlaber01,2w4dcnbJDcGrAh4CFAYYpAaEJiUB2q1rFMGByBuB5Cqz,102566.13660,2.073,85.57%,93.40%,N
SoLyrae,DPhzpiNGU9C6576uLsNSHmdi2AxwxpjMsRdh2iVC4TPh,102367.21711,1.640,88.27%,95.88%,N
OBSHTech 0% Fee + MEV,2Q9mEXrNcJknsDyBjsAieH8XrL4MBePEaLJwmHr3NK3L,102279.53313,2.158,73.16%,93.97%,N
Equilibrium  ⚖️ 0% Fee+MEV,HTtwGKgQgsQCAFDPBgN7LabHTMEkUpmTnFqEo5cBcquR,101752.90523,1.546,90.83%,98.78%,N
0% Fee 🗝 SecretNode 🗝 MEV,H7CfFGvmUHWvryBKAaVibVxz85SYmWyoECx3CjLHq3zC,101652.00975,1.552,90.54%,98.60%,N
Colossus,8F1yhZvTwrFq5SqJ5PH2VLRRwULUGYHju84FjMtDbJPJ,101468.66958,2.019,79.32%,85.85%,N
Diamond Pool 💎 0% Fee + MEV,KXMGa7fRW78c6VVND6YwPbR9sEu8V3q9QL3ctLDioAT,101439.47763,1.542,90.50%,99.25%,N
ZinaFont,3M4QYXfFM64wqSpSeQZWA6PJNmR6QQtF64BLzA9SG7ZD,100314.10750,1.666,87.84%,98.12%,N
01node,BH7asDZbKkTmT3UWiNfmMVRgQEEpXoVThGPmQfgWwDhg,99241.35016,1.685,87.84%,95.60%,N
aaanonymous,BfF3vg8UFcwTkFJNgQ7KQTAZBUWegF3spPm79d71WNwo,98894.47718,1.636,89.27%,98.67%,N
Custodian 💼 0% fees +MEV!,5ni6KoVM62cRJNfFFKGdiyDfYbKWWAGZ21cfGZcj1y66,98545.39823,1.628,88.86%,98.22%,N
Capital Alliance 0% Fee,DTwEEF6VSrmTBYkDcj3BKAc52qhvP8CEQUEAMMT1cG3,98366.00451,1.743,86.02%,92.90%,N
GOOSE,H7JJ6aE73ufbUuDCZSQMxguQsj28XHe4VQyMk2hsVGoo,98145.05984,1.790,85.05%,96.04%,N
theBEST,EsELtZoep4TYcugKyMnB4ZWZYxn99V5Vb1TwexDzFey,98069.07614,1.602,90.68%,99.15%,N
Mira Validator,8mu3JHHF1Qkcrbqjo6KWxyWvTxarZjqptJTokR2jrDFo,97359.99638,1.759,85.71%,98.96%,N
Hohla,3FLezD8GJgnawEHhZcsjdPxZVar9FzqEdViusQ5ZdSwe,96063.94870,1.632,88.61%,96.59%,N
StakePistols 🔫🔫🔫 0% + MEV,ASrBTnxfvt8uY164wRrM9xXP925yoHzoRBnVYU5s7DEs,95670.71006,1.513,91.26%,98.94%,N
Andrew38,4PTVcstjs4s89uETGapnjTNPDa4XfHF9kLUu8WCeYNQb,95422.88988,1.884,84.96%,92.68%,N
,59k9CiZ7L1bpEivLrAtaMPMgw18syZ4RQsJUo3hbbj8x,94231.58202,1.367,96.08%,99.73%,N
Tahoe,TahoeLA91rRRqaWWBft1KvWLEjv87Zqe2qaDqSG69fm,93675.43698,2.675,73.08%,87.27%,N
Solidestaking,8DHFGo3fDB8GudbNLZEyExLzXQPwvY4twybPbxwDnffx,92907.37869,1.580,89.87%,97.50%,N
,7nhEnxoCtSavzxQyvmBhomaZiNRX41UNjfkAL6gurT6r,92888.99743,1.927,78.75%,94.92%,N
MasterYarik,CT2CzbiNRz8ccgWQZR4BN7cpm3rDyWyQxUf5MNbMom7n,92868.20408,1.490,91.97%,99.52%,N
Aspis 🛡 +MEV,FPjq7vB2V3TiseJJSPsp47UWSfT4AwvKjiU7GEro7bX9,91254.84490,1.612,89.21%,98.48%,N
Koinsortium ✨ 0% Fee +MEV,8FPz3JG4E3HVXxGbPZVibarva4AGXSZWx3qKLUS5uFtN,91025.85917,1.523,91.39%,98.91%,N
🐱kitty🐱 - HIGH PERFORMANCE 0% fee + MEV,4k4op6epymSYQkuJoX31azW2bdXh3exmEsj7wLCRKaPB,90335.94557,1.294,94.89%,98.39%,N
SOLSTAKER.PRO🚀👦,P4f3F3VfMhKvpGQXg2MuvLfWmZui41gvcH9XKtYDiFX,90220.91677,1.628,88.87%,98.23%,N
Bro,Dh4K8fNV6pRFZtbzQnP5a5HmyBPb2kmxvWiYmc5fJMvj,90074.56553,1.672,88.33%,96.04%,N
0% fee + MEV Bonus | FASTEST validator,Egz6nSLqdTaM4xPyx6ZerwWqaNJV7NFRprXJtFKonASV,89645.51786,1.924,81.97%,91.65%,N
Solary | 0% +MEV,DKeL7T5t7XXKSbWpM3i9mkV9hRhqrEDbVVyL63AJ7TqE,89499.67001,1.303,96.15%,99.55%,N
Moon Walkers 🌒 0% + MEV,F2bcoVhE2he5DCruN4PKkWAriNXs2VWty94n9CCdWZ8s,88667.20101,1.532,90.91%,98.67%,N
samo wif hat (SAMOWIF),WiFKWdvXypmu9nk4RwuMDh28YbVAp66TigPHUxH5iYY,88416.73251,1.714,84.15%,96.80%,N
,6UDU4Z9TTbYy8gcRKBd7RX3Lm2qMsSR4PMuzoyYPzLma,88211.75991,1.954,81.95%,95.08%,N
stake2earn 🌜,6559KMdiUseNSAkRcK9WcFcNTppoj6jWtKVedpMkBYCn,88156.65138,2.033,79.33%,86.59%,N
,NomaDtKz3VQi85XssD6jpprLF5FPWghbAB1SSdWV1VN,88092.59661,1.674,89.79%,97.66%,N
Hedgehog Spiky Validator,3dXXxEaV4fZqw1PL7VezfDkiJV5W4WTtRjh2EHgKSthF,87787.70456,2.026,78.90%,90.85%,N
KINGBONK | No commission or MEV Fees🐶,KBoNKQQj7QpVEzKKFbzxASVUjXx8TauASwYb546hCqS,87539.66912,1.206,96.75%,98.75%,N
Frupis +MEV,3UmhLuNdgE2NYDSfXmbu5DhPRxWUK8JwiRcG6tXV4JGc,87458.07189,1.725,84.66%,99.55%,N
Ice Staking,votem3UdGx5xWFbY9EFbyZ1X2pBuswfR5yd2oB3JAaj,87330.30064,1.429,93.19%,99.77%,N
OleRock,7tr5vUb3j36k4p9bs2tr1GwRFoSsEWd4LEut8e8HJZEv,86946.67618,1.572,92.52%,99.54%,N
Watatsumi Validator,8B2Z2R8dRvqFcXuLBwinu3Jq7HQidCaJCnDuRRqeJLC1,86605.39026,1.325,96.46%,99.83%,N
,J5L2z5rVWQHFeM8PzSSTnDedLrYgnK6WKxU4X8hh4qry,86158.27369,2.023,78.93%,85.42%,N
RushChain,2Gife8andd4BkEbT5CncpriPxmQYqbspDh8cXkN6RUSH,85710.08754,1.559,90.94%,98.41%,N
SolCandy🍬 +MEV,AE6xdVD5e92ZgevjWAamoF5kuAu88AvmUv4RRdBcoyz3,85697.45858,2.175,73.08%,91.10%,N
EliteStaking.vip 💜,5WPxGiB6zBXNJp8JN3WhSKDuTY3ZBX6dBDcbtVMQAJLX,85613.55312,1.632,88.74%,98.09%,N
darko,4v2os15BGgAnqiy76YvPmAywp5xKh9jfBPfnQGzUVc9c,84708.66994,1.737,87.91%,95.62%,N
VolanD,DimavhUqvCpWjUZqSFZGLqBiUVUYQ5jZEaCHutKKVs45,84370.59334,1.798,85.41%,93.10%,N
Jaga + MEV%,9f6sqJ9JvWm2eMC4D2bTRqjkkrzYQ8bzoUJvffmkkKL9,83008.97894,2.183,80.68%,87.55%,N
⚡pulsar - 0% commision + 0% MEV fee️ ⚡,PULSARWFx8NpS5rbUxRgJiUbGVrGrVT6j8CykdH4UCX,82694.80681,1.191,97.01%,98.94%,N
,GREENr9zSeapgunqdMeTg8MCh2cDDn2y3py1mBGUzJYe,82586.32458,1.662,87.48%,95.07%,N
Alpha MEV,aVotE2iXaXUVKeTWaHtKbSkkUqH96zC6kTKyonzHQZ4,82147.23825,1.741,85.69%,92.33%,N
unode2,F8vL85h6Je7XQYZBwwQPy7fbHd4rf81pTVE47Y2VpjNS,81376.16081,1.522,91.06%,97.83%,N
toly,8M7fvH3pXSrDK8xaNXLN6kNxaAL3J4niRqPvzQru7X4w,80535.04539,1.601,89.38%,98.62%,N
Code-Breader,HeTyhZdUKswQoonJJTXqAnDN48ceyVAeFaKfYKayGPNS,79463.64614,1.771,88.99%,98.27%,N
KodSun,7MMhQedcxv1ZLMthZsDtPYy14reJMYF1FbBVMba2FGK2,79368.72146,1.441,93.12%,99.52%,N
TazmanDevil,1gqv7KGm888nQXsJoNFwGaDkNERUBztuekjzK3J3T7a,79109.20927,1.694,90.48%,98.27%,N
Lamport 0% fee +JITO MEV,FMKT6kHBkmPf3LjZV5tpo3oR4m32rF8nF8JtC3WWcWoN,78932.62338,1.469,92.55%,99.54%,N
Corgi-node ⚡️ 0% Fee,GFK84uv9cr1d6KnkPERSEYagTvpLKTuwa8W9adx1qMg6,78912.58205,1.916,81.62%,89.02%,N
Adorable | 0% fee +MEV,votrmVhKBfy2taHK5RYXb8XF8zfgU8jK3VTi77KL8Bz,78053.80359,1.285,96.38%,99.78%,N
Stake.Cake,o27rnqfNHPwHsRp2xPXXwWzn2q2dGxn6UD4Rt5KMU5h,78012.74666,2.050,78.73%,86.99%,N
Glory 荣耀 | 0% Commission + MEV,9Lp7PzvKVMhjqyQfJwxyha5P6thNWMmVDuVVyqqSaK7b,77870.39754,1.666,86.40%,99.68%,N
Gaveljas,BUyTfHHrp3HQ4TQXaXrRrNuhLsbz23auKYNrxkQRfViP,77626.52951,1.667,88.19%,95.56%,N
Squads,SQDSVTDfE5HqL7D6RjZk1vvZhaheWoskrDdDHCki68w,77152.67323,1.657,86.60%,99.22%,N
✌❤☯ WellDoneStake,We11J5D4iXcNbdMwCZX2o9RRkwaWBo1AGLADfubmeTb,76756.37842,1.426,93.49%,99.48%,N
Making Cash,8BbpzqTUCUa4oR71AMgcBiTQvd6Gta3xJHCG4xK9mKBp,76457.00914,2.119,78.89%,89.07%,N
cesar,Cn9bZCGSYN57GsTfJ5YLCy8HMejHZqrBQkv99eusJtEH,76292.08278,1.547,90.62%,97.60%,N
Cheese🧀 0% fee + MEV,8XPteKmVNkkAwESc7b68BLKLLfHfBwKrag9jk2JnotqM,75750.33085,2.103,74.04%,95.99%,N
Luanna,8vyuJTHSDkx7k1zymea4TMsgvixf3rCYBXHPDQajePkE,75570.92099,1.447,92.75%,99.59%,N
OYKC,xnYks8B2TPLRumBHQSocoXqpH6fmDxTStVQvhZNf9D5,75304.23616,1.807,84.79%,95.29%,N
,G1itch7djMvG4vMRToAgs45cVqrLGKFbzrgV4qNDsG1X,75047.29959,1.475,92.19%,98.67%,N
Solanius,J9m57tJrjukiCzubJVYQtskwfHiKD7DB6295nhwVRhpc,74852.93651,1.546,93.10%,99.62%,N
BullMooseSystems,2iWXwF2Q5W6o7yntV2mkbxncB4rYHnX61y3NU8a8EFMJ,73550.25098,1.881,82.08%,90.21%,N
STAKED IDENTITY +MEV,AXA7ztxJGz77RHmocYQ6MEbPYHbpc3TmhtQqZGrdzqo1,73452.87478,1.604,89.13%,99.43%,N
CyberStake ⚡ 0% fee + ALL MEV,74UYnazXV25u3SCTsx6AHfPak8nennsxYTMhaeHbvuE6,73345.72012,1.527,91.52%,99.41%,N
Bodech,GxMWXbj3xLVf9bK4rspJ3yjg7cmaLhZX6325brY8J1wi,72931.69579,1.936,84.15%,91.76%,N
A Unicorn Julia,686JcEJ98r8fMtUiVuKiz4WRoBpJ2Sm9zMhdc2b6H4bu,72922.18979,1.678,91.92%,98.19%,N
Dual Validator,CNcaYdqkCwxDpKSVK8in5f6kqrTiZ5SuHsHFDqx6jNvu,72599.15850,1.544,90.62%,99.00%,N
ADevRocket,CsfWHXyL85Ur2vsfJcxg8advGyfFa6FbCWMX22qbsqmk,72538.41428,1.742,86.51%,94.41%,N
GPvalidator,2PpHNHPLseBb4doTu1ajTwAxCrjmu7ubReDHKPrjxi9F,71910.17116,1.623,90.95%,98.44%,N
Cypherpunk Holdings,punK4RDD3pFbcum79ACHatYPLLE1hr5UNnQVUGNfeyP,71704.96931,1.772,85.60%,91.85%,N
Eclipse,5hxHdAJAJrJ8UYkDU2BboECxJdosCYcQqGYjkqJFuCJi,71578.18845,1.628,88.99%,96.46%,N
@bftpapi,EcWtSUtmgCPfLP456LrKG7QqhSSSeSVuQAJSdqFtBK3v,71569.17531,1.596,94.36%,96.17%,N
Boss,3hHSwKHgnrbVDBWfkx6TJY1WABUoRs7Ve57sRTg9rAY9,71096.37676,1.761,86.28%,94.93%,N
ROCKnSOL,eRuZHEsLgULocRrgw5PsuDEjWR1SrkC4aES8QsiHhF5,70527.82273,1.788,83.39%,94.80%,N
AltaBlock,A1taSaBJrLMrqfWsPESYDujnZv5yD7bF35LjXoyNXhzN,70465.95057,1.745,86.48%,95.60%,N
NeNa 🌻,5RCD4pZcKH3NHN4XHxvsnVAawSaConLgsZbreSN5dXpZ,70457.29580,1.558,89.47%,99.75%,N
SolBlaze,SBLZib4npE7svxFA7AsD3ytdQAfYNb39c8zsU82AA2E,70288.16753,1.947,78.02%,98.79%,N
ApeDAO,7Bp6dp5UVhwbDWnrNQhvVBUK3K2poxQSf5we274wYnSF,69980.29167,1.563,90.55%,97.84%,N
Dmitriis88 +MEV,HWeDLvzf8PhbYCuNFXB9E3fiCaz8RCtHW8b52iPAboCJ,69536.77699,2.161,73.05%,94.05%,N
Pesky Penguins NOOT NOOT (+MEV),vvvvXsU6iG2enDVvs4KeVqS4YrZczTujSv5p3dSeNHx,69255.15760,1.579,88.94%,98.24%,N
Tensorian 👾,A8q1whmfdNKCNN2Y4Yjc4cnc4esCBcwXrcaWnYwrH4r6,69106.33095,1.569,89.80%,97.36%,N
Nasu Validator,BrPtQfUipB1yV2kMXPeQsEKERy4uZAX21t2ZMb2Ee48M,68430.17000,1.596,89.35%,96.81%,N
Asteroid staking,5mSBnz3zNSVzXQHxBmrTLESynukH2JHVcCN14GHtVsWD,68416.49216,1.636,88.20%,96.02%,N
Farben,Ej35PiU6wxfrQeJJwuqoT7s2gYSwCjcxQtEpHvpvWBu2,68335.11122,1.500,91.09%,99.60%,N
,De4k4hrdkxFHmAx4nVRA3g5ukdg4YqmDLdwuYUcrjjud,67772.43427,1.482,91.95%,99.56%,N
SpaceCat.ws 🚀 0% + MEV,DM8eVQwKYpFUq4MAC1XEeZMjV4T34LfvGkK9vca55GaY,67761.19715,1.802,85.28%,94.50%,N
Hypo Nyms,nymsndUdAZyUPpWYz5VEg8Ghj9cFvwTRgciLogpmYaQ,67240.20967,1.236,96.13%,97.88%,N
,93jNtLuu5MF3Me4MGidwQFq8Pg7iVWiRHioXm3aYhsv6,66780.03394,1.827,82.99%,96.73%,N
,438C7o4cJrbchdmxEPvFgaE5g9DocWKeSc1k4E1aY7qw,66492.28600,1.676,87.19%,94.48%,N
,irBmuzr6ZJbkBZwreeDeQBCpVLJWsxeWS4pfjsfkDSL,65936.77415,1.818,86.65%,94.04%,N
StakeWare,C616NHpqpaiYpqVAv619QL73vEqKJs1mjsJLtAuCzMX6,65443.49463,1.638,87.27%,99.83%,N
🪐 To The Stars 🪐,FSDKGroWxgBf7VmV6X1NLDhnncrWW2ekztwRWiJrPf3k,65436.48093,1.263,96.83%,99.89%,N
bloXroute US,DSzLJLUQD55sxaCsJBHLFSV1SYngMmT7oY8rLpFhyGgb,65351.52797,1.867,81.81%,95.98%,N
⚡GorillaSol⚡ 0% Fee + 0% Jito MEV,CCknLtNpJWNzq2cBrwqYxXR9oguZmaXtoMQQQDCec2xY,65119.80528,1.517,91.48%,98.98%,N
unode3,ET5johBaPyWugD2Mx1zbTCvvbedxZFURembUHng1rzfZ,64298.02857,1.502,92.05%,99.14%,N
🌀 SolWave 0%fee +Jito MEV,GwT72fNWtBrFa9GsBru2kPso1NEw3AnzrjPwprVAv32X,63887.84468,1.354,94.71%,99.95%,N
Sugar Free 0% 🍹,3JFt7NBHuz7bR1wbWVKgGLkZx9QPwnkuW2sx2nREgbbr,63876.59222,1.357,94.69%,99.95%,N
Huisky Staking + Mev,G1juWDqojmp5CWDhgRqtXrtpAFw9xqhjmEQAKr9faf4V,63723.62139,1.881,81.36%,96.66%,N
WDMASTER,HqMYqwdCRqUDfpg7sVJZxTVXRfxTAQv6r9CZajtJZzv8,63555.03474,1.768,83.10%,99.70%,N
Shinshinoo Systems | 0% + 0% MEV,8W4JH1JgFuB6qY6En5zyVZH1qLAr2hafCaXGFZaKpRFm,63233.19020,1.564,90.56%,97.51%,N
Flipside,DMPhNJFSvi34NmfcqR4B5rdKgDYY3kZbXpdXJBL4cJ1q,63215.18613,2.013,79.99%,84.52%,N
SolTA,D8aGMETy3q6ymADJs7YS81QY2qTQmptVox3iCfGDgSTA,63063.95204,1.511,91.18%,99.44%,N
thugDAO Validator,H7fXvnLCKtZqJBTipxeseabGfAZUdHJ9XuP6hCKrbvUb,62199.14752,1.517,91.24%,99.05%,N
astol | 0 FEE + jito MEV,FVhMWs3bbayWpUqDAbWUPH813gzFzJEo8fzhLhhkGstp,62015.89939,1.452,92.67%,99.56%,N
Solana Japan Validator 🇯🇵  Jito MEV 🚀,76DafWkJ6pGK2hoD41HjrM4xTBhfKqrDYDazv13n5ir1,61868.35187,2.204,72.94%,85.15%,N
6hTLQ5HSdWcpZkbXmZxXaGjCgTh7zh8UeWKWKgGE1BPp,6hTLQ5HSdWcpZkbXmZxXaGjCgTh7zh8UeWKWKgGE1BPp,61861.72681,1.849,83.53%,92.15%,N
❄❄❄️,EkLA4nA5jtM2t2FkNWo6XWAyvQyaJJUZoX5p7LMawoaz,61772.44406,1.626,89.06%,96.63%,N
Zemnoi 💜 +MEV jito,53ANFYA6BCDzdtiEeWawm5bqsH1Qgmjog8oMo5N4o4wU,61484.57086,1.289,96.39%,99.90%,N
Tokyo ㊗️ 0%fee+Jito,7okgo2YWz8fgNLAHSmAFwqPF59GMq9QuTSFSzPkkVcq7,61293.93018,1.986,77.13%,98.21%,N
🌌 QuantumSol - Jito MEV (0% Fee),9gY4S2LkL6QJwBU7hpDFEMKcvb7tvdqW29UfobazJG5i,61231.71384,1.359,94.60%,99.93%,N
Elysium 🧊 +Jito MEV,3R4effnUPr3sDo5wdegPBnqTmKTZhKkbgL1wxYw7w4B6,60959.20460,1.341,95.83%,99.78%,N
0node.io,6cvBCfFXugkTqgSFVPvzhoWaLbhHWvZfSsZadWP5rryR,60908.60220,1.709,86.98%,97.30%,N
marisarze,9rY6YGuR5tQZvy4YjZGi7oujhjRSR3zqmCXX5LGoHmas,60704.31634,1.252,96.98%,99.99%,N
Alien 👽 0% +Mev rewards,qjUuLxWo29QCBr7ZQw4EPLkAtmjHS2ZdZpZcH9g7fRb,60598.24170,1.318,95.91%,99.78%,N
Tuzem,EujFnyMz71DXdN93GeSCDU7pFiy1vrFG7cAbtfAhFeSe,60561.69272,1.343,95.08%,99.74%,N
Geleon,Hi8vxcjvAoLSDB9a9xjreJBFurMg41UQhNndx3qS1BJW,60424.56377,1.972,79.73%,86.25%,N
StakeThat +MEV,8xV77wuFP5BkMDdb1845hRRWZNbDNAbcV75BjMuViWpf,60390.47003,1.820,82.88%,93.72%,N
BLOCKPRIME 💠,8guXF5HQVU4g71ZCnn6aEJxQyb59NaEc4XCGjF5arsiH,59950.40828,1.907,87.57%,96.46%,N
JB273 Solana Validator,GK9MfwWEK7BvMS8eQDaiEPnKcqMJoS7SKUiEBQY2pfxC,59899.16201,1.462,92.40%,99.69%,N
Valera,9esjPxaUdD7yg4yDrBkP3jLipcAGVjpLDXsddF89avzW,59644.49605,1.600,89.47%,97.12%,N
romanh,yrfQfUfsZechz1zqQyTRRz43czTZQidcrm4SNVWiDPi,59414.07619,1.508,91.64%,99.11%,N
UZB Validator - 0% FEE + Jito MEV,QodirbUG8AZQBWpHhPJPfjj1xg4AaQUZCVVtwT8YfPi,58906.36481,1.842,84.66%,92.02%,N
SUNREN,FgiteGaHbA22Wt4Quzv3muscQtvX7gzVwvUHbFnb3rTJ,58635.79807,1.956,81.19%,91.04%,N
GUIDES,wetwJSUHT5afX3gP49q75gkz8FcCfvsw2kuSQ1UjT9R,58605.60291,1.896,80.35%,94.92%,N
Abrea,DLMhVf7xXa8R2D2y1fZSRVQwXdup7EfwBFbttzn5ppnC,57710.66161,1.578,89.80%,97.28%,N
S4Mar,9wQQnnnkk5b5GkQWTW9L4kEA3CjFv6CqsQd5gt6tRsHK,57442.95617,1.503,92.17%,99.23%,N
Solana.capital,irKsY8c3sQur1XaYuQ811hzsEQJ5Hq3Yu3AAoXYnp8W,57089.92053,1.861,84.79%,91.48%,N
gLAd,StakeSuWAzutXc386d7PRaSJLWrNfh5iBhqxqGCkmZ8,57088.87574,1.604,89.41%,96.70%,N
Raposa Coffee,rapxbkwBSSvtqRFrsY83f51oUuZNuVXci74MuzYhiCy,55767.87226,1.946,79.51%,90.63%,N
web34ever,ENVaKoD7ytn58xJ8s5htFfQ8hqQt1G9dcPUDqbSwVcgB,55618.70964,2.133,76.01%,83.16%,N
EAC solval1,8ty86LdqsnSW4fpbZRFaR1EfgB3eUknJVz8BKY5izoWy,55531.14101,2.445,76.00%,80.80%,N
some name,uTnZDhnbiSV3TX2obj71nFPAm2aXy83mFTFYzaBRk34,55024.09307,1.760,86.47%,94.47%,N
Solana Stake Two,ErvMUdtMC7AX55zKdYSyy4DnWNCrTsWn5GwprSG7ocnx,54924.46249,1.427,93.18%,99.70%,N
StakeWithUs,2NxEEbhqqj1Qptq5LXLbDTP5tLa9f7PqkU8zNgxbGU9P,54628.77622,1.831,81.53%,97.45%,N
Helblaster,5PKBzZEbwGEXhQj47eiwH6RHAPSCxcVhdYcFttW5gLWQ,54144.66108,1.721,87.13%,94.63%,N
Butas,7LtXiFCXqxwntUkTfzMAmS8TTehK8m3cbzx7BgvYFTiP,53887.09204,1.619,91.09%,98.72%,N
Bitprim SOL Validator,FXRu5NA4ouLGFuZNNWZFwwnvQz9zE7JCX3D23RJTc2NU,53794.65124,1.887,84.22%,93.62%,N
Ordnung 🇩🇪 | + Jito,5CcxrEwDtJYJWatpYd3Ngo5TjZa61WTR279KetxRXJde,52853.37592,1.502,93.00%,99.01%,N
Huva,DTWh2VQuUJmskHuZWy1KLNvzKqk7PeMkCoaNvZy415U7,52802.40408,1.838,83.87%,93.91%,N
Appleyello,78QvBqfkWbDbyo1DMb2ku42r1UfxecwptjbPWJqxkX6E,52287.21025,1.734,90.27%,97.63%,N
,BjREhubbyR597w8tK9NUCLY74Zct2VuhvrNhyLinVc2e,52141.39938,2.138,77.04%,82.76%,N
,9BSZriSFS8Yb835exZwTLN19Dqy9B43yvuMAAdL3nBvz,52109.95560,1.599,88.85%,99.22%,N
,FWwnxVb7Q59MoMraDN2k8gqkdJJVd2qu9o5iiQsxpoUp,52108.52724,1.926,79.62%,97.12%,N
,95Kg9C27WjjrnQpgZ418hxWTeumPTyH1ENnBoimVN5PL,52102.08880,2.258,73.67%,85.61%,N
,BRrgfW2AKKYYEGVU6j1mbnoQajHTRuUgXCAPPzFgcF9q,52091.47575,1.647,88.49%,98.74%,N
Staking Fund,SFund7s2YPS7iCu7W2TobbuQEpVEAv9ZU7zHKiN1Gow,52003.16787,1.892,82.35%,92.20%,N
StaRKe,D3QPJm7BDzzPeRG51YZSEz3LfV7GvFNu9NkcibzURxuj,51617.50174,1.461,92.60%,98.61%,N
sobolk_n,GRWCUtxwiSLtLGERyNyZymr77NJdko2HdDHxpVcJz6E9,51420.15342,2.029,81.02%,88.45%,N
,6zzAPhyFZgS6rdknHNZLcsoooZ744GtVmTDyfvRmN37Q,51220.19190,1.944,81.44%,90.43%,N
,5cJyfCLBfghRtoCuVJNreJgNCStqXLrhHmRhSRYtbgtr,51146.81054,1.584,89.18%,99.42%,N
,CzGLRXJXoDo9q86MpphPVNNsTgAxHvZfUfAiouWDH89M,50836.48564,1.595,90.11%,97.64%,N
labas,GC8W2uHZ9UyrmgoDGsuFt322L18cRhsbKxWiZ579aLM6,50774.98125,1.450,93.40%,99.39%,N
,ASifxiwxht8FvsiV3VcLngsCBMw4E6zw3QMWoJTbM4Uf,50388.41420,2.099,73.77%,96.70%,N
Celestyn,6UgxzgqkEyXMwPtgyDZSn8WGzJ5GdSWG1bSPvy7V6QwV,50241.10976,1.757,86.83%,94.16%,N
cleverFog,55d6G3qVzKfZ5ZWQxaExw7rJSZ1sRg5EQfXaJAo6vwwZ,49693.64602,1.755,86.90%,94.18%,N
DAIN,AEtdq4CwtuktCEUWLLpRTNPBZs6tr7BBqxkHJ1DjAttR,49689.30258,2.137,75.83%,85.53%,N
IN OTHER LIFE,DX3Rpy2drSHvwS85EEy29wH3LQG2ZrefoYqhroeJSzY7,49660.71923,1.802,92.52%,98.91%,N
Solana Meme Coins Validator,9yYzduhLTmv2C9unYhiEDxKvaTj6D2yeRXL8mFkmTfKc,49434.46627,2.209,77.38%,84.46%,N
bobbrus,3yoaBCgeuNNCK7SWqUdSvbjKZdj9BeN3neQc647oUV8g,48883.23994,1.378,94.38%,99.81%,N
TDRSystems,BKccvpa2f5McCLjE91pSGzEY6Ac5sWm1jmHy5QmZ1vTm,48810.06706,1.760,85.78%,96.15%,N
EWR 0% Validator | No commission + Jito/MEV,5yHqB3NxovCEMUniQCboaPRMyyQ7kQQF4QqvC4vaz78z,48417.93091,1.670,87.36%,98.33%,N
SunSol Validator,SUN1nYpPJVjd3gKnDACdaUVL53LJaXR9u8e9i1jkZ3a,48413.64605,1.584,89.88%,96.94%,N
NodesGuru,xSGajeS6niLPNiHGJBuy3nzQVUfyEAQV1yydrg74u4v,48209.93852,1.392,94.05%,99.72%,N
nga_validator,9K67smfw8hDXmtnR7uvP62WrKUcB7oZ8cvpsB1hmrCzf,48155.33807,1.441,94.20%,99.72%,N
ART3MIS.CLOUD ☘️,3iPuTgpWaaC6jYEY7kd993QBthGsQTK3yPCrNJyPMhCD,47932.09169,1.731,86.69%,94.28%,N
rocknode,DUxWarcMsNYD5EKj3mchf7ssT9j6h4Bdw3VFJi7QxDry,47749.26101,1.783,84.80%,96.27%,N
,9r5ifZdqmyK6fqB7t8WXPAibCW9xgizniaihFPpWkaP7,47355.34002,1.395,94.26%,99.87%,N
Honeybee 🐝 +Jito,QXmsTYFK7YT2BpP2AnvXwuRpfwmsJZpovLcUqdSjoK1,47039.26041,1.341,95.00%,99.95%,N
elephanton,FkK9cat6c8zhLXeYFn4UTvy6fnSLB4p6SCbRQQfdFkkP,46743.12284,1.730,86.39%,98.04%,N
Ded Monkes,dedxrPfNqPKBRmUyP9LDkaitpQzU6PD44jA6GP9Ndhk,46487.80850,2.056,76.45%,84.82%,N
crypto-jack-sparrow,9NZ18GkTnXZug6eXAzpBsmyCsYfAJ7mL9bgUfSJDSAKr,46311.94415,1.392,94.09%,99.60%,N
GrandReserva,5m8kTjAZRGppy6Ag5uCfUBzY1Ev4NtLR7fJwoaK3HanP,46296.90998,1.856,86.56%,93.97%,N
Goku,DvFTFLrEQSfEadPQdesvf5bpYWYqXK9iaJAjq95piQBs,45965.07838,2.008,77.29%,89.34%,N
NodT,3pBPy27F1Wz3iVydZnGkdvefStrFm8UMCDakYZii8AUZ,45649.13040,2.345,79.10%,91.10%,N
MainOrbit +MEV,6ztDG1XRZiuXtoCotN51kUPtdHXwRAgRiVEbbUfoQ6CK,45302.87250,2.431,80.65%,87.86%,N
AsmrValidator ✅ 0% fee + MEV,GFQmJaC2SqTDf2tfAHauiGdaBfBD8tJVpwZTT78SeBCr,45292.71518,1.666,89.26%,96.53%,N
LatentHero,4sFsBDei4m7UXwuMeAGVmnJxZe9peJ5tvq581HoT9aH9,45281.20771,1.508,92.10%,98.66%,N
valer amor,ESjX2jRuvdr2a47JfEKjP24gNsgreE9PvSpkw4t5Xn2M,45260.77122,1.554,90.32%,97.61%,N
alexar,FXbkkbLWH4PxSK8t1JmKAHn4pEvGsCFyMT7pfgwm62us,45175.32727,1.453,94.08%,99.71%,N
dogo validator,sShosKd6uA5c1ZpVMxdsE6do13TLRWSMYsXbSMmNC77,45089.52704,1.410,93.69%,99.36%,N
Sarmina,VNbW721iu6uVkrx246N2BiQth8u4b4SCPJwH3JvUovD,44892.88053,1.792,85.19%,93.99%,N
Skalp,72i2i4D7ehg7k3rKUNZLFiHqvhVFv1UvdCQbiNTFudJa,44392.53630,1.868,82.89%,97.89%,N
MoonyTonny,2BGBakG9kjmZAaygVmAuUrBSqBZt8p5FVabbStxHEXUj,44068.24829,1.746,87.08%,94.39%,N
PolarBear Validator,CQr9DJLMeYqmXcfG8Z8cgSFw7ntXvVUamBM3dMVzWiJz,44040.31485,1.390,94.15%,99.77%,N
Africa,8gjfs4krwDrME3n7jzKshMBhejFPHE6pTrhm2LcKGSPd,44021.89954,1.913,82.14%,92.62%,N
,NikGQUQqSLtsdHGGx7mQopojZcgd3N9uWFaZQ1r5EXn,43715.65070,1.542,91.90%,99.44%,N
Smile:),E1CzrFHxFG2LBQKMjizgSdsgfEejrEJfrvzUGNVxz6SE,43689.26987,1.611,89.57%,97.07%,N
kuma🐻validator 10% APY LST🚀🚀,4m1PbxzwLdUnEwog3T9UKxgjktgriHgE1CfAhMqDw7Xx,43442.07116,1.564,90.44%,97.58%,N
Fibonacci Finance,fVotEjqpmpQYgyVyBCwYm62BKqqTQNE6SpYnRmdBazH,43421.04479,1.729,85.52%,90.77%,N
🦋 Butterfly 🦋 +jito,AaxfteYTX2ftBRQfW1x6FiC8wY5dCJYgsPr8JwwMUuPZ,43353.71670,1.425,93.92%,99.63%,N
val37,2QE9X9X4tdDUTYic1DgBBJjU7cWUNPbKYGerCb9KqDQN,43122.74588,1.942,82.33%,91.50%,N
MomPudge,4K4qpgksvHbKnk8mpMNncHxihMN1ayidQ8odqJKaN7mH,43092.12178,1.626,92.01%,99.28%,N
Republic Runtime,83pBJ852VuvrX8yaJgNSeYiEmgP98WuUGoADtaZUuqMR,43006.81407,1.466,92.42%,98.84%,N
🚀 ELSOUL LABO 🚀 - Support OSS ⭐,ELLB9W7ZCwRCV3FzWcCWoyKP6NjZJKArLyGtkqefnHcG,42965.90121,2.197,74.24%,80.12%,N
Dante 🐾,AYSvheimgwhpRHXossLqrTBDPwo4jHDQJ1UhMeAArTwH,42931.58740,1.450,92.68%,99.78%,N
💞 GirlWithSol 💞,ESaLvDNR7FVdf4sR1edjAGN678ts24s8VGirvPq9q7H3,42416.13549,1.451,92.62%,99.73%,N
Stake🛩Jet + Jito MEV,54LAJpkmdovUQPRqE4pyDXHRfHpVJqT5MjwEmAEVBboY,42039.71172,1.538,91.04%,99.01%,N
Evgeny,5wYHvcKbCHPsT9dhEZaVZzoVY1qA7bosKRzKczpcaXpq,41854.63162,2.128,83.02%,90.12%,N
,JeDosjMNLfyjzj8Zpu27U6s2vbidbKZj4N3in2KRECB,41808.94262,1.671,89.71%,97.97%,N
iX,74PrnaiKU5q8SJX4H9Jis7xyzMUNoSesizn7FhFZaxfG,41780.62988,1.636,90.16%,98.50%,N
0base.vc | MEV 🔥,5BAi9YGCipHq4ZcXuen5vagRQqRTVTRszXNqBZC6uBPZ,41687.36687,1.967,80.57%,95.09%,N
Olaf,YT7i3TkDv9GpbQ5qEkL7dvb3fAXSuNKwCotw2MjrWxZ,41642.99473,1.420,94.15%,99.76%,N
FERZb,kpkkSzKLha44i5ij2eyTf8Aju9eQTEixeR8ktmvtDgT,41506.51851,2.128,83.15%,90.56%,N
troo,XBtfuT5gYU27UAukT3pEzgiKgHpHNQhSoa3zX2PYtiT,41488.11215,2.534,79.30%,92.51%,N
cyberG,9jJNuZE4EHTrz8xiTzmDGjJnCn5dGmruCyUwG1vgdHZR,41399.90724,1.833,81.87%,97.58%,N
clockchain,HG7a8fgjTkQhGFTPukbTdf5FCwxVVjKzkbo6ToNswTXH,41175.05526,1.725,85.97%,96.71%,N
StakeArmy,91ciyr81FJnZaoWcDT4PHwwdzgNp21cgH354JbCuxnwR,41174.21604,2.012,81.54%,90.94%,N
Above and Beyond,ACE2rAgt842mfSjaB4YYzxony4F2AogTPDNCYtCoRh2Q,41060.41202,1.484,92.17%,99.45%,N
Moise,4jEHuQZTNTRYAhxRYEjV3HJ1b4wqdQjnBRdPzFWzkCft,40887.41360,2.040,78.25%,86.80%,N
Meissa,BK5Km4MyuncoBWKCM9y3zntA1JjhdqNcHd3mxitms4Xo,40833.61595,1.913,83.79%,93.43%,N
Hyper 🫨,DzQHN1oTdN85Sbku2bc9Fu9yEwrgRMiu2XbRcntZ31yb,40252.52737,1.805,83.18%,97.89%,N
SolRealms,Rhob5aKMhFYqwn26o2zvApzwAWmagtW1ShLmWSPxhKX,39684.41409,1.688,86.77%,92.67%,N
QuantumElevator,5vfEHBMSCTkR41GeKLyLb6ua6dd632eCpEXYC4YzG5df,39638.91279,1.836,85.05%,91.98%,N
KlaustinMB,CCxSNvJogH6LWyoiEbG7JfcWybw2FqqCExs5GuemChGr,39552.01283,1.705,90.64%,98.67%,N
Kraft K,FKyoehgzXD6KVSQoHJuTteXGCrChYe65k98wMckr9MN8,39172.84143,1.744,88.69%,98.28%,N
Node Integration,Node56Cr7y4Udym2vPt9DsRbWcBL29JivsGh2drpbKb,39142.62556,1.649,87.74%,96.62%,N
AiratBaia,FEtRZqL16RiizCa7CmZH9tsN7oNfWdKtBf6GM1ETzWR,39111.29837,1.811,88.15%,97.21%,N
BaboStake|JitoMEV,Ha5QeKj9o3u1116qohTcSqEhPRJgUUKSLxS1n5Phgq85,38977.51270,2.170,82.55%,90.08%,N
StarStake + MEV,G2Qvt31y3wQDqLvnZTf1Lj91JrZ8rKUhtCP5kVJxXS9,38828.70023,2.161,83.66%,91.88%,N
Knedlik 🇨🇿 | Stake with Us,FKSXgi9YVuMwUzc4miWhFnJPMTbjJ53XMFgyoCZCo8c,38821.92399,1.644,89.56%,98.91%,N
,Gr432yJ6wqeyh1p87fVCxcdf8RsWsGtfAdEVLYrajBAm,38694.55100,1.589,89.23%,98.72%,N
ILY♡Validator,DG6fVEB2Qy1jntvHVPui3R12CMqcwNNnjYPYdsbQ9ACP,38652.46933,1.966,81.86%,88.61%,N
ment,55gncCYVFXYZhjD5a3aemVVtiHaVwfzu2R4axgamGLwV,38644.49295,2.145,83.02%,89.91%,N
goto5k,14YCghb1uYPreALx6arirtPAnoGghoPH2Ac6gCmNQdq7,38577.37499,1.503,92.20%,99.07%,N
Martinkas,2AWVgdBDNhUjkfvueyoL5BPBycJavMwTGC9wEtqh5QwV,38564.96277,1.721,87.53%,94.77%,N
Stakezilla,pgbB8erEYkTBKxyuXJRB4HrwtgyKYqeGCQnuPAH8yVw,38458.41153,2.004,81.18%,92.43%,N
sapog,CGj63fS6gJXm8KvaUkkL5yAZvH9cjeRgHCgJwcZZEsRd,38441.30448,1.813,90.22%,97.81%,N
Solissoul,9V3Yy2fYZt65so3xg6wmnUiG1mDQvgkTJYTsn3YPkgLH,38413.93795,2.171,83.13%,90.51%,N
Staking kiwi validator,5afRnmkFn1pRU9oussqwk1RRBVyoDgUkL16Jz4qNf574,38410.83178,2.023,86.92%,94.08%,N
Lis1,23utbQdXgsucDPTVcaRQiTZMrKPhQ1nmg4iRNdHDNwTb,38359.99449,1.836,86.07%,93.21%,N
,GwjRJdT9nKmegq6a8nyvEPfoQZUSPp6N4KmWAUMo76aU,38063.65979,1.876,85.51%,92.40%,N
Nelly,ELvd1ayPGicuX9yBNr6tn3V3BUCa12Cme8FDdghcmskf,38045.64273,1.765,86.01%,94.25%,N
shishaonthespot,JAc59DHJCxu9T1xSP1eaMD82aH3jGNqvwQYZkfA4JLy3,38035.74014,1.639,88.71%,94.87%,N
Gladiator stake | Jito MEV,HD9FwkthKMAFzT3zsPfsZuELUN7pW71KkDR1EczuX8t5,37941.39553,2.212,82.75%,90.24%,N
Bork Validator,6gNdKvKUXLsmGnhYHAa6BRtcirMEM6orhZfikoFVXen9,37813.90544,1.861,82.34%,95.50%,N
dreamstaker,7r1g7s6UjYuosRCHwedpGRCbJhZqM2LhUPxgoayRE6Rm,37763.19325,1.838,85.03%,91.90%,N
HyperSol,Fbnesg4kSDDoFbjaSiDQJ3GXHHAnNb1CJCgLQp4dxj4C,37718.07056,1.413,93.97%,99.36%,N
Sponge,G9oM5tuM9E9r4Q9N5cNbm7NbT8bGuaQFdJ7QTPXVYHeJ,37659.65279,2.109,83.32%,90.74%,N
Troix,DggvF7asrbjrqvcvPPRKovy3VVvjCgvc2GnWVusxq2MP,37581.94797,2.041,81.01%,89.61%,N
huglester,4QhNoG3PN1FXXFhAEA2QWdor6xjXvM9pjq6MXAUV8Zg2,37566.64138,1.842,84.83%,94.18%,N
TokenVentures,Rn3ERP5cLVcB4oWRZpoujk5VRPM7SLrM2txPVHGYwn2,37557.17846,1.636,88.90%,97.77%,N
Vitaliy.T,5kAKXkZyBpAncEyYxGcn2peRkkCMZh6ZrhopWQXq78Pe,37449.32479,1.499,91.60%,99.47%,N
katealmighty,CnuTdyrVwnNFLzUWSkhbX7VGYUTVEqhavjehAXHhAw3e,37320.71940,1.646,87.66%,99.46%,N
Agrestus,sBcuGeMJCRkdtMNgskLTX7MePb4CzCqZuyMKDrcPP8v,37233.58970,1.443,93.47%,99.68%,N
NastiK,3Qvmhayko5Yn3sSXDsHsMzS8QjdU4CshQF2y6L276kgi,37124.05579,2.175,74.56%,86.31%,N
Sanderok,2LdPsE15gum8SDCExPHuhYz2Gx66gxaETQcUruDoavSv,37115.56503,1.613,93.82%,99.49%,N
Nuclear Block,CMPo7H14cu4irHQgBo5uDLgsrXX6TfVaMmqeo4T2A3BG,37115.25883,1.457,92.84%,99.54%,N
tenerifka,BJipnsRJCxgcMoYc7Env7ee2YASTtwLuyvD23AsJ3E6U,37093.73353,1.846,86.41%,93.22%,N
Anode ⚡️ Beta,AnodeNCzJGQ7QwheFqJr6EknKGa72m6XHiLtDQiXcmEc,36888.54233,1.428,93.21%,98.87%,N
Race2.Space,2uXoWb4tuNZ72wAdQDfGn42PzRQ2kZD2x6ZDt3urwPrv,36701.67287,2.008,87.32%,97.02%,N
C-Key Validators | 0% fee + MEV,A9YmK82uhCXieM9Cw9gN7W1F2KCxa8U1ArA6qxnyYcXQ,36665.82613,1.606,89.81%,97.84%,N
meAnn,DTDvrj1mKFv453DMAGRuFwg77DuLjsfVHnbLe5BJPL9D,36648.74770,2.034,84.36%,96.94%,N
⭐StepByStep⭐ + Jito MEV,2wUhcnViyzstvWmk7NAboKtjbFbqJPo4BvFBV37dacLc,36560.64497,1.513,91.62%,98.86%,N
MBGBuzzer⭐️,5bTe8MuMyP1A1ahXHpAkFrhQybNEQuKgU5QhpnQRKxuQ,36543.48023,1.507,91.43%,99.74%,N
lapsky,dcwMB2qjmAwid5KNo2qquBPyDxzdLfe9io8JAxeRU5m,36528.65799,1.570,89.36%,99.53%,N
dman.sol,BYNXBFkB89FoRCJ4VxFE9Tfde3anECjZjasTP8qSYQUi,36471.21019,2.135,83.60%,91.30%,N
,4YykTGwg94GgHZEPSsQfbaMaEE9HHAHqSuXT65L6C6wf,36426.30099,1.400,94.04%,99.38%,N
BBG 🫧 +MEV,BBGumW2W9u8NEpkKeK4Gq1dCL2dUzAcLVPoPFYHwHHjm,36393.44241,1.560,89.90%,98.28%,N
STAKR.space 🔅+MEV!,3a2onvgTpGynakAQwx6gigtSeL7itZewNxqb5JiAvWeA,36315.07257,1.720,89.56%,97.06%,N
DSUM 🌟0% fee +MEV 0% fee🌟,GJ3z7fJnAekf2LmGMe2gYdrxjqUrDQiqzcb7hgQLFc7X,36279.24050,1.828,91.31%,97.92%,N
Masternode24.de,3Pb8KDmneuKuS38aDSFnK1WGz18aZN5Tuyu5ZaNUnySc,36145.06909,1.639,89.14%,97.05%,N
Yurbason,9gANMngbGUmAaLXL1RC3JdiaLjRowJXNbzCTh53ht7mq,36131.72812,1.910,84.64%,91.94%,N
qwertys318,GTeoHau1SpLhoiDGJdQpGd7AS3gyaFLgGVG2EHQRHoWp,36055.57089,2.049,77.44%,83.01%,N
DinoSol,3TZAkZtKuQe1B3wffyke6WNy9Z7cLVY9xhR3qT1hVEqv,35857.26161,1.759,85.52%,97.95%,N
kisslovefun | solana.ing  +MEV,EX3g83pPDBzmqhR3Butivqobds4Mx547REXycx4jAJe4,35848.79798,1.528,90.87%,99.43%,N
Solana Plutus,467Bg8FwFFq5jqebWPnMQtdDRjpmHUqvCWBW1zYVMzHg,35762.53400,1.850,80.98%,99.13%,N
SunStake 🌞 | 0% commission since Feb 2024,4FsAxdHQ6HmFrDD7yCwsKNApuA67QYSCMoLAy3NfySxJ,35749.74982,1.716,84.99%,99.54%,N
Pr-k_Zadov Mainnet,Gd5ngiHe5vQbDW6EbQ1wNNsvumwL1M3ranZ3xh4Wy8Hm,35746.84916,1.529,90.88%,99.69%,N
LAB517,F82nmpcZMdHtMVsLtAGByPavdN5WuEX1hjNwzs3UFuwq,35728.07160,1.913,91.16%,97.66%,N
Gaxx Validator,GaxxAn5335dA4U3772MCFeqdyqCVEfmsQTQ47YXfC2Xi,35727.16334,1.527,90.29%,99.43%,N
KURASH,6ZDsQFqdBNmcLho9KLv4M3ggzHxAh8G1EdR6DCjajPvK,35639.06183,1.452,92.76%,99.63%,N
,Gk8yrBiy3gBWCgnHaXcEeMEyCZf9sK3kvTaSdAQAj7zm,35622.30741,2.110,75.95%,84.39%,N
safar,22hhSBsywC3qxr6zvT38zmmhkBQCr6oTqWNABLTgdnm6,35546.37428,1.902,86.42%,94.35%,N
Averonix,4n4KiUuRwgAqdTh6ag8WRy3ibL2gbWTVJPfEGw3SAsHx,35430.89762,1.825,84.68%,93.46%,N
⭐️AK ✅,akVU92YQV5hNTuzLBkF3RZCzKydZokyvzL7WdPF3D57,35365.34790,1.767,86.35%,94.60%,N
Manchego 🇪🇸 | + Jito Rewards,75EiDe2N17CA64fUhhJLK9rKm4TcRfhMFdghzScycWfa,35342.90373,1.618,93.71%,99.43%,N
RasSol,7DvyDUHg2bLVxZ3ZfdrUoAHwoF4cv9AH4aKToBqT6c7C,35310.14394,1.569,89.96%,99.07%,N
TKTN,F1uC4BM1KbAHfpcJALXcZNvuxqbrYkC3Mt5ka8tcf5Hj,35305.85157,1.857,88.60%,95.39%,N
mindstyle,FqUfeiVYd1LMNSDw1t9WE6fAXAKzjUVHf8YzZXWQjSMd,35205.98311,1.472,92.01%,99.02%,N
elvis,4LhqjPqhFMdXPMPN3B7raXVmd8zCKdEddRcrFuRf46Y9,35157.91143,1.746,84.25%,98.99%,N
myhauz,BdM7KCd6ZYWcaCMmHVi8YeL4jFzDVM9cRLJUeRAGSvMS,35132.23779,1.984,83.61%,98.64%,N
M4711 Validator,9b9Th2hxmgf49rzs2mQcg1hHoasmQT51DDwUH1jFtPtk,35040.32655,1.500,92.93%,99.70%,N
ValTim,8cmey1eqqVS7GRqR22NafhQWhzsdgEiciM3xiEPL2Kac,35037.12107,2.013,80.49%,91.09%,N
comr8_nga,522BNbxBg9jdF1GqxhmGGUi4geFZRJH7Ky76Y6HuifXV,34949.85819,1.742,85.14%,97.26%,N
SOLANAZONE,GxqWAnLwrwZbRq4uqzgBukToCpquDZSMKpJ7ram4vzb9,34937.06529,1.876,84.96%,91.86%,N
Fthr Validator,AfyTzhTXBRBCxGdTEMc9LNEkVGVGfGA9wHf1VikaNb37,34908.01474,1.764,86.46%,93.58%,N
,AL6ax4FgMDFNXSgahcifrsri5XYqE7Gsk7z91uBputHh,34901.02712,1.743,92.52%,99.25%,N
,5FbFgsGsAHxDJU9EvtB7Vyy8geHXegkWrcTVscQDaspN,34858.61551,1.743,85.93%,92.54%,N
FilatovDM,6k6Yo8kmwssvayHTzp8K4jtVwmyRyjvQx6T96DNJAdYH,34762.43642,1.803,90.38%,98.57%,N
4t2.capital,CwrJAdkEp7fibRs8Th989tX8gFyJo88jVoK9HmaSCkP7,34653.51337,1.847,88.99%,97.09%,N
,8AShJVwfs9MjHAA5MxRb3QUdt1KZQhwiHip8XdeiogbX,34608.59286,1.999,85.63%,93.02%,N
Kukis Global,4MpRU9fDDSQNNTeb4v5DPZZTKupYancGksH679AKLBnt,34544.16121,1.633,87.47%,99.77%,N
Appload 🚀 maximize your profit,56CMrsFGVrnXJ3PwNV935vFYhfCBdX9btYPnLPE1ATFH,34527.78737,1.568,90.04%,99.42%,N
Carolsol,8ztfVJM7Yf7CMXqTGMGBkXmTkGCiJTgVfh1CYDZZND5b,34519.64641,1.899,82.55%,92.41%,N
yelllowsin | Stakehere,EzZEi48kvDWPJJBM1z9nmjpgRyMwWJwaa4xVW2U6psPr,34467.13467,1.399,93.67%,98.95%,N
eva,93JNyhEhzyNQWAyqNRyCE8GN1jTAfR2NBT87hnrnYvAM,34433.19145,1.572,93.05%,99.29%,N
KingSol 👑 | + 0% Fee 🔥 | + MEV 💰,8Y1ghRNu6zyAcrb79uddZeWPfth6arWaaSazbpHES2q7,34425.22195,1.759,86.47%,94.08%,N
NokrimOZ,D4EYN1xz2VJbNcXGpV2F5cGCi6pH7WZZeSYgarkZ2caY,34408.56945,1.446,94.08%,99.81%,N
🚀RoCat🚀,7StQWSBg1tCFRqQ2GUEUn9owmZuyacUiD3xQ2djXDFpd,34401.47716,2.115,91.74%,99.01%,N
seanode,3RhKQt1L4RtZMGMY111bjymGqKcd6ZbExux9NCm8t1hd,34396.88495,2.465,89.40%,97.95%,N
basist,74DQRGa4oqepMGcz96obZvw5gJPEPwaPa9MTqbAfBi9F,34357.59043,1.686,89.10%,96.70%,N
,GBj57rgnT8gvFdU7awQ1u4toKxMGcHGHp6VVRXz34qyV,34239.14928,1.630,88.84%,98.49%,N
BlockRockers 🎸0% fee + MEV rewards for stakers,HkK6U5e8HkTs5uE7VEWQ2H3NuznjLF1mpoRVjzdDgfF5,34222.17774,1.980,80.56%,90.25%,N
Uberg | Jito client,HnkhL3JYBSmb3s9thcVWzAQA9NqJb5m9U2d7mdDxprGo,34167.91969,1.665,90.25%,97.42%,N
NikiWop,HNXuDfYtRnRjcUJHqfNg6sKzeqfz3YBCXeZQEBwZJg16,34109.69815,1.738,91.35%,98.44%,N
nakepelo,8vumofCfwJXMWKcBufRnMicvUmXp41pxa4nMGysSpcWq,34103.19969,1.497,91.99%,99.46%,N
Rust = 1 Love,5m3oE8X1HokEpjXJv9eES98JiNuD9yp1T9TDCuxvZZDR,34032.61366,1.673,88.61%,96.17%,N
,Bp1F9Ma65vJCecNQBauQ3yvbARDbC1kZXEvfmcux9HLy,33995.64551,1.988,83.84%,93.53%,N
isillien,AdtBv6jyEjY74XhkxZkowMuGfV1r58j44WCRyeToic99,33944.86732,1.982,83.88%,93.55%,N
Banana staking + Jito MEV,8EQwZusrHgjZyDKXVdtsCeGNsL6VmEB5xq2EP6XK4AUq,33940.73231,1.829,82.68%,90.48%,N
CamiLLe 🐘 + MEV rewards,4ysUQbvWDjUdRprcjaBEH4V2VqPJgrPSwRsS6ATTMbiB,33908.21146,1.915,84.70%,93.38%,N
MAS DeFi,masvNDXtxVVMrYSV84RMry97JyHXAFcdfTZJ5VzpSYR,33887.71585,1.896,78.04%,96.43%,N
Crypto Flow,ADYZmUgm49MeEotqzz59eVtoeNKBv5d4jRn8xjvR2uj3,33885.63427,1.762,92.60%,98.84%,N
,GpPNw6TxbR2z75ECU6Bdbtpi24vSWP8JQA6CFKo2tiPX,33883.53024,2.079,77.31%,87.83%,N
,9oNSYHVuPFYSVRBUN1nRW3Hoz58XGH957etGuQ1pWAmG,33860.74163,1.674,86.47%,99.46%,N
JI2 Validator,F9PZNSEtgbqmgsa4mkgkAuLFYQ8nHzn1UqubJQiLkBn3,33844.76671,1.552,91.06%,98.15%,N
POSTHUMAN,F1emDGY23U6YpJj4H4af2CHcHUmiDGgAWs2xvWYZHWdR,33801.96919,1.458,93.07%,99.05%,N
roadswithoutend,ECJMTMCroXLtAqUnSbrCH85ARP9zg2vYooM3fwAMfMSM,33788.69582,1.431,93.48%,99.70%,N
Soph Validator,8AKJkPw4d2XXXy1fjQPvty9ModNrNaqdJJb9ifi7iXAX,33772.36420,1.400,93.81%,99.23%,N
Umbrella,8GqyNGq1DGAbQLJCqidEV3cyPzByQdj9Ak5MrVibnu6c,33727.12712,1.624,88.45%,98.32%,N
bornslippy,DdAvpE1oUuV1sNUxLgtCfC6ZwhgdyPksoXU9EfYdXL5U,33711.25380,1.507,93.42%,99.42%,N
Yakamoz 🇹🇷,5pfqseENmSjqymBEUc86MM1YCX2d4hzb9HnsugADb72B,33706.40333,1.611,93.79%,99.43%,N
Khaos,DhU3Q2NoCxU5ArXJWm3zxFDRuBiPU4fGrJ8kUasPxMnQ,33701.14298,1.995,84.00%,93.79%,N
,27JusH756d8Wc3shn5rB7PxBW1Xwmi3CA3Qeh3KtXf3z,33666.51564,1.483,93.50%,99.48%,N
UA_YaroNode,JBaE8QhwFwka2kZxdF1DJHKb7XGdSRuiWutVB9SyENbJ,33632.32915,1.646,87.74%,98.85%,N
,GiAsNLcrHMMwmd5H9RqAxKgbwoiBVw43Yb5b9eL2uhWh,33615.09820,1.480,93.22%,99.78%,N
BeeVault,42QPziW5fPVjK2HWX89UE3BbyChbJD5tze2VazQU1qvw,33603.19792,1.695,86.42%,96.23%,N
Crypto Plant,EJ59wFK3qPrnsFFSpZ7jSwCnXe8hVQ12heXYUqry7Muc,33597.82384,1.981,83.36%,92.61%,N
Morpheus,FSZ4GBucapayiQC8w1VNpKDmzM6NZDBSZmEFZsgMteRr,33593.39358,1.680,92.98%,99.19%,N
Stellar 💫,8dHAjvZbnBfi67A7RTBXyMuq6uomJNNyre9guENFGcFD,33562.76303,1.307,96.03%,99.48%,N
Supernova,GdRKUZKdiXMEATjddQW6q4W8bPgXRBYJKayfeqdQcEPa,33557.68356,1.629,92.79%,99.12%,N
DiArty,BTQbHhcrqMoH1zyFBeXWVLgF4KV151uS6Kb5zpMBpwT9,33546.73721,1.841,81.67%,98.39%,N
igreq,JDeNVy8krNyf4dziyKnXwSMoBeFDhGUnHEeSmqWBAHkz,33496.39462,1.646,87.44%,99.01%,N
3bepb,HtRAGpko23W2t8wPUU8HuUQC1TrRUuK64K8RCqRD5ubX,33491.48469,1.736,84.11%,99.39%,N
croco,31XTYdLdpZh3gAEr6oKkXRhx9hiEWJwRh84jo92C5CBX,33490.86017,1.777,89.80%,97.60%,N
,5qdCvzzeCXfGH7EPjfu1fBNjL6DtcwV2w24A2m1xRM9p,33486.77545,2.015,83.71%,93.57%,N
Cryptonic,mitDy3gnfY2kcvvrHygv3qsU5i6QqNve3cw6LDibRS2,33464.44674,1.649,87.74%,98.24%,N
StakingTo.Me,GuY9VVJkH2tdg1z2tePC3uy5y3FbyqT1cHt8ETYWPWNh,33461.19612,1.726,84.65%,99.46%,N
RocknRolla,52J4Nhv5u3bKiKBw5nvAJjUigoWHfP7PBQCfC4craVEY,33414.04355,1.594,92.71%,99.13%,N
traderusdt,6QbXuFT59Gu9ihxPmUcLFpTfgXwaSxoJPUTcEDkidPAE,33394.77298,1.926,84.85%,94.81%,N
,HYjVeaM7XjdVPVUR2xkSDRDKUvaz1VaVAxn4RTj2gwDu,33372.75009,1.981,84.18%,93.66%,N
Dragon Trust Stake,CP6mfD4Qc5AYrboXBAQeHMYj5x1UnYksDXRjG7DMkHH7,33364.33950,1.604,91.15%,99.39%,N
Block Aegis,CvfYpW8gRQ7bHy9uvuvqy2vpcNmXuBnvaoa2AC8pGHJx,33354.69729,1.677,87.09%,97.60%,N
OrkValidator,FWyBxaJa1GAkM8sUeC46Mxbj9TZHzyn7Eor5ojBPboLK,33340.07973,1.583,90.13%,98.74%,N
Solana Sentinel,8Bsn6atd2NRbtRvkotzM8aLa8PXWv56SQF6bum2advGF,33334.66852,1.663,89.64%,98.25%,N
Stake on me,7teJuHhmHjCHDZiB2TEgdS5wFru4sRJB9JJR4wAQ8pM5,33327.97817,1.776,92.28%,98.82%,N
dikijkoala,33jhUy4KkZ3AxRfqLshb4u6u6pA1MC6yoNHrKWNeRxbg,33310.05275,1.572,89.83%,99.32%,N
,J4JhJL3kurhw8RZKhXp3fFTjyd5NX2yCbKDBN1eMh1Uy,33286.47183,1.666,86.77%,99.51%,N
Nikita-pusher,s2VZdgVB1GkLy9y6N8CwEyD35bomuvxSkc4e8affvt9,33272.11118,1.622,90.26%,98.15%,N
,EQPh7izMjykXgiKr5Qwk8JRGdooHph8YJouLZmqFAMxt,33264.52670,1.527,91.31%,99.18%,N
ganymede,7z3wq9dTjdRBKGpapQv6FugsdSUKxZTEEkzSFaUG1noE,33246.70277,1.495,92.00%,99.47%,N
,8SRc8gaFpmnb2behQp6KXZxrt9KcV56eFTzUDhzk4qei,33200.73876,1.998,84.10%,93.61%,N
,F7WubP6g5CLmumKWyB4yUouyucxZbnJxFKJtxq3DiRhA,33186.62831,1.591,89.29%,96.74%,N
vibeloglazov,Fxnh7reapaQPZdbLPpFG1svuEGcJvibnT1Q4N8h11g4A,33173.44034,1.635,89.11%,96.19%,N
SOLAR STAKE,CrEA7jydDYM1kxLR3MoYXm3r7WJxmgR54MyjhF9FgbtW,33164.18000,1.578,89.18%,99.71%,N
pythagoras,HjGn6RPn77LGaWGvzBHvsNAwNMkpBXo9AgfYToA5Ka2N,33151.75838,2.099,76.89%,88.24%,N
,AMZPPHg2Ht7PBMQuzwrk9FAx47xZVPwxSstC4GcuhfKo,33125.89694,1.652,87.63%,98.09%,N
martta555,C2bJpaAU2cBupABkV5p9ed37sn7z8f2nfXqZ1gFBNBvv,33120.69279,1.719,84.54%,99.70%,N
Node4Life,C31ocJKVAi8wxCvyAMjXte2fY9zECV2fKrn786F4WZ4N,33112.79165,1.734,88.04%,95.40%,N
DSRV,2mxWiqtwdpE8zgkWxwFaJLn127dbuuHY4D32d8A6UnPL,33108.00144,1.666,88.66%,96.64%,N
NannyNode,FKCcfoLt2pq7boiNqRGucVq5LE1K5Dt4HALCx2WbEQkv,33107.91030,1.817,85.82%,95.22%,N
,2m15uU8ifpfLY2myMCeNcxwn81KxXoQ2g7akG7Wf6pm3,33081.26902,1.964,81.66%,92.23%,N
SOLrainDrops,4BVYjw1ztUzUPsxsaCheWWwThT2X4rjogZytGnuWPUGg,33074.31778,1.964,80.73%,93.80%,N
,7Uj2rdTRibv9Bu6ovCuBeJ8gyPPR22SEYD19kNEXf63w,33073.21825,1.625,88.83%,96.22%,N
pupu,F4UVoVGgmd2aJwnfz3eojQ92P9AvYbRG51z1xnEj8tFy,33069.94741,1.614,90.07%,99.56%,N
,9H7v1rB2tkPUaFmW6BMNV47Qpj63crPTzmhVgpQAmz9Y,33054.00507,1.694,88.59%,96.57%,N
MoneyLong + MEV,2DM7z4MxS13BmxHc2aENmDYAiMPvYFnMmDyDDYHfuK7D,33053.45514,1.587,89.96%,98.52%,N
fraybe,6h4mhExruKD3zp7FLFU6ZDK9yVqoLHHdKVGpGXcauveT,33046.23840,1.601,90.00%,97.25%,N
Nastena,8EKcbqKnQT9SV7hFUmfpJixZ63GL5btf74umgPQWsMUH,33037.84071,1.770,85.65%,98.50%,N
,AbacusTT3yhEFEKkQKjGStDhKDnvSFGpg9EqBwz8FnDF,33017.30538,1.445,93.21%,98.98%,N
Unicorn,BgheKvqFnT6qEyBtweMGGBRGtgqzb7DxAYn13uXqfoZW,33005.76428,1.728,86.59%,96.76%,N
1ce,BQ8kUgoPwZ1HZKWPFKozv6dcXcmGrvbG8TCXZZXnjSJL,32973.93796,1.819,89.00%,96.51%,N
IuKni,5TkFPZf79rezPXzCTP6DjH4NLb7Hw3jRsAme1fv431oz,32970.98213,1.801,90.25%,98.45%,N
Valik - Jito MEV!,VoteMYitKq7mruk9QPJRUgryYbSkyZKBuvnL1VTgoMq,32946.74732,1.721,87.28%,94.57%,N
moninorka,9BUaTrUWHVpwq4mN5YTWLD5cYy3UtyRSwzg5v2hyNFNm,32935.16932,1.684,89.20%,96.59%,N
BellamyBlack,BfVYYC3HBuQW5GLkR1VTyQD7ERGSuX3gBpqX1DJU4Gqq,32934.08432,1.880,82.96%,98.61%,N
meme32,9HkDHk27SwpNdVuAjWvxx8d1Pg8HYUNCC721okcvj9Eg,32929.87537,1.543,90.44%,99.76%,N
Dragon Kiss,ApcUbFDskBMrYJqu9orEnPSq5uMAH1YjhwR4DP2JwKT8,32928.10116,1.819,92.08%,98.55%,N
,4NTGFvib9jutwo2GZbXSomgMoeJmoFv66T1mup4Kd8o6,32911.96376,1.607,89.69%,97.19%,N
,DR3Gt31cATSx4T6qRTaWcPzLKP3FSYpqrZ74iDHVm5A5,32876.39588,1.555,92.71%,99.11%,N
ayk777,GSaWJ4FjXQ3RGctXaBdcW9oh939cwxXUeeV9A9d4shvf,32872.45218,1.719,86.00%,97.56%,N
Egor - Low fee + MEV,ADaCfGqp5drykfme5omgfFsVgyFv2kHJMQCTxcGngrn2,32854.66632,1.448,93.19%,99.01%,N
A2Z Node,FjEkD78awHu3Zh6x42FidATyMfaU7QviZbDjao4UfZ9m,32844.41401,2.215,87.19%,93.73%,N
nikks,6Wi4bMzio6PGnHXg39zBMjGp5vgphLBB2k238DzPBqhz,32836.26083,1.938,86.30%,95.37%,N
Yerevan,31BQ9aXoHU7TpJ4uQHyYGZW4JVb62LefFWW53NpeSYmB,32813.75036,1.450,93.52%,99.49%,N
skill,6minRorGYiA5aEeDvXL1Usat6DCdaF46owL3oANVQ8uB,32799.99360,1.600,90.46%,99.74%,N
Rapunzel,3m8Ct5n9feJFEuuXFb67oqt9XEJeBYkGyEdQRX33QQ5H,32792.57784,1.786,92.50%,98.90%,N
GreenStake,8GN7k7hoSXtuZ9iGwNcQbEDHBiyf8AhFKCSAi2me1pTe,32762.39125,1.743,86.27%,96.45%,N
Anatolik,2oxQJ1qpgUZU9JU84BHaoM1GzHkYfRDgDQY9dpH5mgGn,32743.59847,1.813,89.92%,98.03%,N
stakely,BmMVRAVef2qmJ1tJpG3JwRUtnfEiTbvDw9ZeFEi4wE7D,32725.69248,1.832,86.17%,93.50%,N
PleaseMilkMe,BeLBaGs8dVP1bcA2zhv1RHmEPFY9PfmSR2mFgoqKkiaz,32724.15084,1.790,90.36%,97.85%,N
UFO validator,88KvxpFUnahtg4GCuRayvoyysboHp8j1P38EqgjjdB4r,32721.80121,1.705,87.19%,97.18%,N
zero,3LAzTH2Fbsza2wbnKgrDcQKdaQRshQkb4w4vk12E5KH2,32720.51059,1.638,90.84%,98.07%,N
Venovi,8NQEDxYxwUEPQk1yKFJEGHvYj22Je5xUQWLPkHfKkwrD,32681.68656,1.443,93.31%,99.07%,N
Solodron,7LR33GiYcNS333LpdccyytkfPUytcZt3ZnVn7CRvW4pT,32645.62504,1.531,91.36%,99.20%,N
,EbTAFfpPzoHYAbj4HoSbiJ9nYtZjwPULi6y2TxummJcw,32640.41844,2.026,80.77%,95.31%,N
Justake Juggernaut,AumDzwu4mvm8TthHRcKjCGAWMBbEutMYE3tsPqArue7g,32617.74009,1.737,86.44%,96.55%,N
Si4,DzGHc5pLJACrLNrXQqvhoLW5cyEDQnuRcP4QDEhumkpG,32617.52265,1.969,85.11%,97.21%,N
malise800,9MDcVy7CjbNuxUvSzeUFbppSP1XWzXGTPo1PiC4CqtGM,32611.56652,1.603,90.06%,97.89%,N
JRock,EWQfCyftKLVbeJtJ4idbLDcDFSGaZ6bZHGS5vboUx3VR,32603.89007,1.704,87.22%,97.20%,N
BlockChain Bomber,BdDF74LLy8a2o95pXLzMx2ribFE4SDWCfDMkq9MRx4yb,32600.29553,1.718,86.84%,96.98%,N
BCB Credit,5Ri6yTqus7LdDaYGAVNGStC77BHZuQy8F6fYsp5cC7Vf,32600.22149,1.729,86.60%,96.68%,N
CoinClimber,6csfbzZEnk7kGJRy7Xg4cgAuRdFCUdrjckzRnnY1Qj55,32593.40711,1.685,87.60%,97.52%,N
Shepherd validator,BX7MLgYCYkZtnTTjccyJDMdD4ycr6D4cFMgaXfkbT8Vc,32590.72792,1.947,92.48%,98.22%,N
Fins0,AVWnWgnS1ysX7ymBbQ9pMdWnt2hpweWGYekHRM8mxpQy,32589.84201,1.745,86.19%,96.43%,N
,36jVWrHfpyN2RvXCkGA75qdzcBqFfMcyKbC2qg4o2gA8,32555.76981,1.885,86.69%,94.64%,N
StakeSage,GAKLDmghREn6YHGu5y5vTHA9JJY1Nuxy7n8zz4RFzH3p,32545.81167,1.725,86.68%,96.82%,N
Khinkali | From 🇬🇪 with ❤️,7dz4Zpj4bt6T6DsF8Lt3GKpWrkUXCXdmKxK2UGeAG2bi,32542.05926,1.432,93.48%,99.34%,N
Dosirak 🇰🇷,J4pH3yiFrzFG1AQPRGBJXo3HP72MCZwsQamtp9ym4LwN,32540.10466,1.487,93.56%,99.14%,N
TokioClock,FwPkzFcLFGH7GCAELuHVxNMuUV21C4wTdai5BA7Ptz6c,32538.05372,1.692,87.52%,97.57%,N
"🔋 P2PStaking:~$ validate --ecology green,carbon-neutral --in FR",5cXLZKeTuRm95ng96K2qCdxB2kSU1ajW291HmEkNpXkM,32505.16655,1.958,84.74%,92.70%,N
koshelek.ru,BEnZR4K28tNLPiH15tdxYkyhaXGbzxqFCNjzTU66uh8b,32475.39827,1.729,86.61%,96.79%,N
Welty Pro,AavwT5GecqFL18ino3YVv5z1icD6p7ENTuXuzAUf6QNM,32471.54932,1.725,86.68%,96.85%,N
✨ SolLine ✨,3tjGkvUsNEk8UBUQECCTpeAoo6NovHvEG44MZDPCcZko,32462.59116,1.802,84.90%,94.66%,N
,Dca6LSCR24veJsdLbDDS8n73vvNfSdQaa4mXhVjTXUWD,32460.04513,1.579,89.17%,99.35%,N
Yevheniy,7ECQ4mUCMpxF8kchT5sHg5JpwV9eves7yme4GB72m1uk,32453.88425,2.290,89.25%,97.62%,N
Eiernaggen,G7vraB2xC1yMLp7X451Wof4DyEqsWzSXXtTKdRJb91k6,32445.78183,1.934,81.27%,91.82%,N
BUIDL,4XRkaMPQnpAncWVZxAw1NfiqGiAX7oa4Ccg8mTD1JMn3,32445.27912,1.696,87.41%,97.51%,N
CoinAtm,78Txiv4aMrEeTLNhJYtfnGwtvuVH4NZ8igXS3oYeKdg2,32444.08846,1.702,87.38%,97.34%,N
IT-DEX exchange,2ueVedJz8CZm85wet8vxPGX2bD3VrhB9oXk46ym9rcDA,32443.41848,1.699,87.35%,97.31%,N
Prizmbit,2Dh9w9HuNuvmpmsfRFqWhNqQuMX8U9BAU4xyyyqzEq2h,32443.38051,1.751,86.04%,96.24%,N
Abyss,3JadNLK7V9NNzC9a1jRAZQXExT7mBtBhcjCaaaRE7B3R,32441.09195,1.885,91.73%,98.58%,N
StellarNode,6GjZkgrdkS19Ws5Zy5BEBgrHqgwXZynr2biHjTZb1hdM,32439.38729,1.700,87.26%,97.29%,N
Captain,AtBb8cCroMeGNhiF2H5eAzfqnHLn6jS5mZtWFhszwKnp,32435.87286,1.699,87.30%,97.25%,N
dunker23,BrF3uiDCn4yX55kZ5wcGN6NBUdg9pksWRzaniBALJLJu,32431.19847,2.097,76.70%,87.36%,N
GCrypto,66ADRQzSCUySLWsrqaxTLzH29a37SX8xcuda5VJg4Mga,32403.52884,1.698,87.42%,97.45%,N
,CP6eYHRX9UXgucwEt6J21zfi5cu2cqG7h1UJZpBSoySW,32402.07602,2.028,80.96%,90.31%,N
Mo's Validator,3eV533fsCb9EkazR6C41rTHnvLfwtzh415U5v5W8hZM4,32359.61061,1.801,82.38%,99.02%,N
solomoon,9JiAAwGRDvb6JzAarUfSBTeoD1vmGd2ujxf71CpQZcbJ,32353.06043,2.040,84.69%,91.72%,N
,63CeFmqGDCSUUbF2EZ6UfMwoCzrZYJptAvj143qVeh1,32349.85691,1.761,90.50%,98.63%,N
NVFarm,GrtCNjHDd9dFwJ2HVCR26rKBfvDXHav6wkDZT8F5d4E2,32343.23117,1.418,93.62%,99.68%,N
Synergy,ANRnEc3NFWyDFkJNHPnts9XAT1odt931qbgzMsSGdE1z,32332.69030,1.607,89.08%,97.78%,N
,8TdjJkjmZM4m2gPCCSfVYwd8gZc5sb9WtcYm4Dm2wUvk,32331.40918,2.054,77.97%,88.76%,N
cok263,7GLsg47ChRfrLNTouzzkZGJUFe7BvuSLd4UGPAowBxhr,32296.05087,1.923,84.43%,92.16%,N
SolSheen 💞,HMLfMHdETcGSqPGAr38rSiwewsSZvLPMMPALc5pggtiW,32290.44066,1.870,83.41%,93.60%,N
EvasMainnet,C8MLmDCg3LReWoNCkFdHgsscFpHx2WdtcU9ZziNfXrhd,32289.86639,1.801,83.54%,98.31%,N
,9QFvZhLvpbcFJTPkKq5wTWR2DGTXqrsP8z9igPgjSsZ1,32278.99700,1.760,87.68%,97.20%,N
Payler,531ABLCYsNQ4xztxHfoCc4xqEQ8xiEWWSP3TKDG5s7hz,32271.34679,1.704,87.16%,97.18%,N
rs_99999,8cKzJdvB1imSKAg1SeY6yMmNDgVkxhtqMcuZgiyWQTmx,32263.79296,2.074,77.93%,93.60%,N
,7fx4aYDuLyGQenUWy5xdXPfqFhiH5rcMsMjnx3asii4f,32259.51477,1.778,85.03%,97.83%,N
🇹🇭 Sabai Sanuk Suai + Jito,65XpGeR8ScLit1sEZTf5moSEJR27QJTPWJ8AdAuHM6Wz,32247.77597,1.749,87.53%,95.09%,N
,DiYFYCDVurwZPVWieFsDNjG6iS2nSfBb5JQg3huY5eEu,32230.63784,1.552,90.07%,95.96%,N
Kitsune 🇯🇵,H4cXCqtAy8qdu9qe2dSxoPhUscMTYVrmVBXyPqRVTNR1,32227.77762,1.601,93.64%,99.32%,N
Gaofushuai 🇨🇳,F13Fo2eRH5EecT1gL9TAisbLxwDYiLsK7sTjHAEmprTM,32227.54553,1.599,93.72%,99.33%,N
Solidarnosc 🇵🇱,2WKHhJ34gNkw1G8iReLXn8roPfQUjsLyzjWHspNdvbFw,32227.43272,1.633,93.77%,99.35%,N
,5zDuZ9QYyREv5yWJpKJ9x96R5HPEmBMMcMV8VhP1zmUb,32225.39479,1.823,84.43%,93.61%,N
,Hmq1oALENff8DejgYhJxB4njb6pyCtuMKKxotdZicB4n,32219.38200,1.927,87.57%,96.20%,N
Collector,6thJCXmoS2EEgKxiub4ekWysjKWPDc5kAtuMgSui694H,32203.13373,1.705,87.21%,97.12%,N
Saltee [0Y],2YnL16L174Tj8awY9FfRfR5odpGNEbLnx3dM6CRt9L81,32183.63495,1.433,93.55%,99.48%,N
GO2Pro,7EehNwMoKCwFULMYDcNxv991pVdtBALKR9DSXnN8DJE3,32183.35487,1.761,83.54%,99.24%,N
MustacheOctopus 0%+MEV,5n1QipQq1eZUTCggETJu3824G44JHJP3o1x9xnY8popV,32177.20460,2.029,77.56%,93.41%,N
Stake Sonic,862VZk4B2PrWf96MDbvu6EH1j9PMKqhYA4FAgQWhpRYF,32175.35264,1.702,87.26%,97.24%,N
,DhfTMGRyG6Ce8sm4jrLpFTDERGDR5EL5PBqTvYoT6h5E,32171.80937,1.551,90.20%,99.44%,N
,HhsdMwhsaUgAtYZ2pedFEWZwsAhGZsjLF3sjFquS1H2Y,32171.51262,1.438,93.22%,99.53%,N
Gotham,FyrSH4VeQidMVPQ9AE2szAbP5xBZBprRG3z1QMMLNi5X,32146.92581,1.828,84.27%,95.02%,N
Hygge,85ykoc8e56w7wDB3q9obP4fA8WwzvWVNGspgqN2KZ9gC,32137.59785,1.604,90.77%,97.13%,N
NiLSol,9KUZ4k28zDMUuh34tBBmdnq9sA4uDSdCPPjCPnUa9jKS,32115.19602,1.413,93.72%,99.71%,N
Craving_for_knowledge,9hRVfSz8GudfGFQd3X7HTjaGRiuwj7dpjS3jtuy8c7mk,32113.82657,1.397,94.04%,99.68%,N
GoBit,AY1nugg77a2QEMfTKrfniYqHp5MgLMWykXTKwZwXYxQD,32101.69472,2.178,77.11%,83.61%,N
Vietcong,CjspxRz7DTACphbx9J7ijypCvvVg3PHFo9rwmfajECfL,32092.54634,1.839,87.00%,94.34%,N
mythical-stake,5bZfZn16KfmQpmjQeVGrbo5t17aUesLtNMmNNM78FzC,32090.13711,1.827,84.97%,95.51%,N
Alex0Alpha,137Hw29uc3HsYkz1YtdG8AheS3a55UKiaAfBWSn28vxA,32089.43529,1.723,86.74%,96.85%,N
nova,53fAQnWfTPoTQUb3AwPsUZsTTe4djRHmW8U8yztvVF8G,32088.08943,1.539,90.63%,99.32%,N
R2D2,8YBQZbNQKwtNLgcNPExr2iwWUsrSTT4PsR8duxjtWiP3,32071.43731,2.101,77.20%,86.24%,N
,3kV8UahWWN7Fh41PddYczuismJSLjtrKhYRZW5RUqiEK,32069.41579,1.887,86.31%,94.17%,N
Alexandr Threlroth,A2GkHf71SqegGcLmhgs6XzR5YfLh5ZJ2Ci2vKM5SY5WR,32069.23270,1.846,85.30%,92.51%,N
Khunchan,8oGhRavfRf13fBdp257nitq8VVgXhRAZxR9fR5Q4oKhH,32049.83280,1.444,92.89%,99.15%,N
Forge 55 | 7.63% APY | 0% Fee | +MEV,8StzUMT1Kq33EHPoFx9zYhfuvzAbiqeh5nE3DftLLDPG,32037.74893,1.575,90.63%,97.01%,N
STAKEZILLA 🦖,GNEQZLFjM1QXvMStREZhK9Z8mYH2ShECMDDGhNWcGfxn,32030.65772,1.599,89.68%,98.45%,N
Spartak,HdP3326wLHUqtzNvVfxFWtfp5EA8njHdfwnWfPoCBjWa,32020.76794,1.898,86.57%,93.82%,N
sustainablevalidato.rs,8HKqT579dAjdTy86zKUs8kAaGDHXY11wDC3ohGCkLSQH,32018.56452,1.987,80.84%,95.45%,N
Retsina Technologies,9mg9SH69itqkRdy1CudMforH3ju7uR3K8GH8esGx4Mfx,32016.99763,1.883,80.79%,96.43%,N
Svit_Validator,3khMmeupU7B6ZSDSbTX5cYtME9yVqeJ178PQD7mCE7g1,32015.40533,1.671,88.33%,95.69%,N
,7PHy8rXJtkfkgpsHVtSiiX3StdwD4MG2VdhoeciLzaHv,31978.41864,1.516,91.01%,99.54%,N
Infinity,Bzn4NxNmh6vTrZyMRoL2qjZFNYbckRwNyHQwxzoJoggX,31974.32522,1.810,92.37%,98.74%,N
Sega,3Rv2AfJuaunDHePFPGiDkN828nwzsbcZ5nM8jNdW2i2a,31970.79881,1.843,86.96%,94.14%,N
,6wLyyZDBRy88MhyfNK1qjqWjihfdcZWksSHiYecZ3ArH,31970.11637,1.431,93.82%,99.55%,N
SolTrustStake,GDgKAmToNdQyB4bWiieh4z9MAfPknnnq3LUUq3Rc36TV,31967.28588,2.228,89.78%,97.39%,N
Sign Labs - Validation 🤟,91413b9eEvG6UofpSgwdUgH9Lz4QBF1G3J325Bw7JwGR,31961.56268,1.906,81.76%,92.45%,N
igor171M,jVYhgtviF8DjxGQp3JYS6YZXoXA2LontoxK9cqQmjq3,31957.00121,1.940,80.02%,94.52%,N
,5cYwwC8dmQ2tvtjDueHrU2B6NvmTHmoimsNGeGXVbkP8,31955.70192,1.873,85.22%,92.15%,N
RealNiceNode,84gebYpPpEafPeGJUVA8QzfaTQC3GeyVufCTHpqsQqE2,31953.80905,1.521,91.62%,97.36%,N
,QxAyeuVu3oWJt9BBCcuSphvXADPic7hq9dXSwLYssmo,31949.03434,1.458,93.19%,99.57%,N
PlusX,WTpLibwKTmWo15cRBtJFiBU6NoN8qZEnMDMkuM7N1rH,31946.29245,1.886,82.23%,88.43%,N
Forhayley,BmCLQofhV75owwSAbhZhvQtRRcCaftKUwNfnGBv41QEg,31943.90808,1.814,92.33%,98.74%,N
Ancient,7bshVP74UGL7gn6CTEztizxKsZrcmwPmB4rT1tVbU3vH,31935.36063,1.702,87.52%,95.70%,N
GVCmd,DD74C776HxSr7rzBhoawFqGf2NBbxurBXkjPU1oTkNJm,31929.56326,1.435,93.47%,99.29%,N
alex,BQMvUHC6wqpd3TR8B5tAF8WXQ9xBRkopVqzAC65BSd4A,31920.94597,1.940,84.68%,94.28%,N
kiwami.sol +MEV🚀,Cue647T8jgwpRSDUb8ttTYx7NiEfJCRZNiiw1qmchXsG,31918.60089,2.192,75.17%,80.56%,N
Nautilus,5woJQ7GLyexhbpT8wzQQV8keYgFhZaJWKf3QGHS4YPmd,31917.35256,1.550,91.54%,99.01%,N
,2UuXvFqNmyxsNygvFUfjmDGMGn7pGQ61t5CUzvgczazW,31915.71172,1.944,84.36%,94.15%,N
AaruAbhi,6CSENi9ZT4iMQGgWi7mBBe9bKwe5qKamcJg6MAANTzrN,31911.57878,1.986,84.26%,93.70%,N
maximka,7rFAeD5UT4fy8cQCnY8Y5F8GW1Wgw345Nxb7diXu5cjG,31909.76460,1.974,83.99%,93.73%,N
BAZYLA,AsiGmWgxcbZm3FdbYHJ241pqt7r5FjUndATazYeJ871w,31909.30756,1.947,79.09%,96.90%,N
Saint Validator,56ixbAMwsBiguYXsbzABGNaQVDeFDXQdA9m6hvyumtLy,31908.94312,1.713,86.95%,97.06%,N
vilar,DsT3eKbWAaX9wVZQYBsbkDwpFA9NTDtXfsYc9wXUEWpn,31908.92405,1.760,86.41%,94.42%,N
zankinpro,Asns2MR4Su8domaswW1qnMcBBbzcW1SfJurPweKXgvd9,31907.49589,1.934,84.37%,94.06%,N
,ifHMQAxuzMPF19jsZXpLMTA9wNzPzB8XkNaWyCi8Zg8,31905.14690,1.971,83.89%,93.63%,N
greshnikKing,87d9cGc1xHFxoiteZhXjYL48U6B1DAdLhpxXhmVKi1un,31903.21713,1.974,84.25%,93.81%,N
,HfXwCe7o66x2bDC9LvXLPcP7FpxcDzDhWzxgrCJ9r44w,31897.01436,1.680,86.25%,99.45%,N
Yulana Validator,Hocu6Vb6cDRYy5MnUj28tvDwda43wWx1Vc3fiCXziJ4x,31895.65696,2.201,74.58%,81.22%,N
,EZCQcPkgsNS5rnfoAWRsVZNGEo3GoZSVV4qSdeWrXzhX,31884.22934,1.960,84.20%,93.68%,N
,8EwqVDPwa773DXfymS5dhvahabfjTSB3qxnpq9kR7bNp,31873.64740,1.502,91.34%,99.77%,N
YO Validator,EreifamaYZ1cAtegv5hJFgRSqDQg3i6uRamWXfYuJeC8,31873.14902,1.840,84.71%,93.61%,N
gsnode +MEV,Aq9DBA3EtBRU19Vk1NKBCEReRaZNv9eSR2VexgbZteu3,31869.78025,1.802,89.64%,97.70%,N
2poyDev 0% FEE + MEV,725My2yzg5ZUpQtpEtivLT7JmRes2gGxF3KeGCbYACDe,31869.22381,2.047,80.33%,88.22%,N
mainnet_MHS_validator,BgjQPDdsHeD9XXs7pYyHsmvKdkLR1A4SBNYs3mLmPUCD,31853.09215,1.794,83.75%,98.47%,N
gitbash,8vqRKnHH77FdrBxSDR9KozJE98R1ETUJCSrFYqoYmbKh,31851.28944,1.700,86.23%,98.44%,N
Arnaut,7cUkUBJKGHEH8dT6FrJG7TfifE7ZUjhu65NakpAUZuP2,31839.08846,1.863,83.57%,90.99%,N
trk,ARondxXAhmFsVfVkhyBuCvnszpzpH2Joge1nD65L1G4V,31806.13184,1.518,90.80%,98.83%,N
RlapSKY,YWKwnuovuAw4X3VDPJDPo5DPZ4TmdxsXzLArbvqu3Ph,31799.55348,1.440,93.03%,99.73%,N
FroBegz,GZzcHTsorXLrWEevXYo51ED15NTYPLPLzgGxddYMNdn5,31793.21204,1.920,84.40%,94.37%,N
,9gX9MV3nGHRs1R9E52Q3vMg1tNGe5NHvzdfo3AMHnr5t,31790.98278,1.968,84.42%,93.91%,N
parik_main,E2J7T2reBRF1VesJJozG6T73RiLoNBqjfFmZR3zoDkGK,31787.39370,1.591,90.04%,98.53%,N
SolanaBull 🚀,FLCrbfbwEhFARa8nK9rnZw8BVtKNAuHujh9EhWy5A4U4,31787.17404,2.150,76.59%,87.10%,N
,kWEiSEQZMeLAbMUiz1njRTZEjuSpJDCgVynB6pJHpcr,31785.48476,1.762,86.44%,94.09%,N
pons_main,GW2AzEi3mttnuhnNH2hGqMuUz3FYKqo5Vgspp8Rx44L7,31781.68826,1.609,89.43%,96.66%,N
,Fgevrsfh8KsFN7eomRWS3N2bjKvqRBGMcEo9oQbT1ikX,31777.63529,2.000,84.00%,93.79%,N
anyast4r,A8ARsTnLNEieHGNvnjoiJj9A1JY98dXbnohA18YRmDzN,31754.83497,2.221,88.33%,97.17%,N
metralunabsolstake,7fCmwpjXHBsJsSCecxsuSHeGCuragbh2UXfzfKet223o,31754.30102,1.587,93.09%,99.32%,N
spiva4ok,Agsu9fcnH3rKBix59mktDRqJhjR8aStgLDd9njaddcdr,31752.80198,1.842,83.71%,93.65%,N
SOLPOOL.IO | High perfromance,6fq69K3h91Jd8s8StttX5CkusubhTfLBQy7uaot6XSzk,31747.03242,1.533,90.95%,98.69%,N
OMGmd,7t6MVrT846optKpHkXEKNMUMhMMukCVyjMhjTdd6ARBb,31739.02633,1.609,90.58%,98.54%,N
G-Scale Validators,AduRf23soau1sxTo1eyAoV11RyrtbyeF1fjj48jX9vYh,31735.73539,1.701,87.71%,94.95%,N
OniksMB,rM9aGauE58jt9RHYwZwsqiVfE4F8Rq429iWFHohwQuf,31734.87163,2.131,89.24%,96.83%,N
Jack-o-Neill,2zTwGrCrmXNvuhmasxZerKd8ep43Rr2MMoxgs8xS8gWb,31729.82589,2.328,78.01%,85.41%,N
AmnesiaHaze,5PyiGb6dNrCaKTkMfovKRQPYgH5zizcsvXp9YUAVWqbo,31729.19181,2.051,81.90%,90.82%,N
Sveta-solana_MB,6oKqaVoS6o8hHSzP8uFp7E7C6c9i7hfznvSb5noBQAFT,31718.09081,2.090,74.91%,97.39%,N
LucaMB,6xL2wVoBKjJkkvPYstjT6yrNHTaxMezmPhq3dqLA4q3i,31713.61765,1.678,88.65%,97.28%,N
SHP,HymVLhdKah8BrZj4FAXJJYH8nhWGqjqvFvPFJM5L5VNa,31710.88363,1.653,87.66%,98.20%,N
8888,5KgAGvMLZogKnDGKGgn47xY6GaTwQ3WBbGPoBxW5nDqp,31703.36611,1.702,86.86%,94.05%,N
Craze validator,FSwhPiYebzF5nNGvWbUUZ4SxGx7kw2QcA7A6xgYz1PZJ,31700.57943,1.715,86.95%,96.96%,N
,5LSs29bKmRBDSJE61jAbEcW9KSzKo5Zd8iuidU5yApKy,31688.78711,1.971,80.26%,88.76%,N
Ti,8HKHFcDGkmeedbTcnK8ntXdqRhYJYWEGbk8325tgv47i,31686.71976,1.529,90.87%,99.13%,N
,4hZueUrKETMSg3k94JihgbyCdc8nma3GcvdeKBrtWamQ,31681.50474,1.732,90.53%,98.27%,N
lal,FxQLh2b8JnBFwPw325tix5x6BEJ7ibmqz2LyKLZWiGAX,31681.24546,1.857,86.39%,94.99%,N
RSP | Reliable Staking Provider,NM7f9N6qGAW6bfGYPxp1ZU5ycD1SWqPvFSx6VyeHNvK,31670.94610,1.982,79.05%,86.10%,N
Arti4,GAnbgkZq584QAdfZZzX8aCiKvDYcqszY3jGCiwqm3a9h,31660.08742,1.424,93.13%,99.33%,N
,6sHtpsxU8KPY5cd6EbutSBUGaXnwu8r3voM3kgjSKoW9,31656.86502,1.955,84.25%,93.76%,N
Dima_FantomasUA,AUTnPgB8m6qsctP9RRAcmnVrLSpZbBYB8nQAzYUN5j8q,31632.79707,2.005,79.34%,87.89%,N
Light Solana!,6mEgxgVus3rWJrt3qFk3BvEV38SVHNCqBdQJXxLBbcst,31632.54494,1.688,87.56%,97.55%,N
Wave,H1kyn75BFTXr8QRmToRRvuEEmYan5n6M5APyfhMLau3b,31631.02420,1.662,89.22%,96.72%,N
,HFpuMHuQqUY9o5D4g5ByAJKEYQrMLjwcusDNjozXa4Dg,31624.50765,1.975,84.03%,93.78%,N
SuperNode,9rCg3Nduf3YSPkvYWw421n8Ya8EUJ5KQQvkQaK7G3DkM,31622.89669,1.690,87.57%,97.57%,N
Solid State Nodes,4MU64AyHBkRBUAYgAm91sP5vFgzUUgFHuS82CVhE8Q2Q,31621.04919,1.527,91.29%,99.58%,N
verasilver,8e8QYWHrPEEpAk7rDJ3BSKm9YGnfb8cwmGzo6EMb7tYb,31620.72730,2.136,88.51%,97.39%,N
SolGeo 🪐,Cqg1VwU4pdC8zAYMZZUViJuy1v1G8vxdYeUW3UNCqpfV,31617.26171,1.604,88.36%,99.60%,N
4Alpha,57gGMmhTCxHtLevWHzDdrme3e4SC4UCXEq9oyfR4hDjE,31616.74707,1.700,87.36%,97.51%,N
,ArgSLuXhyJzchuv8cN7oYzsVaqiAZwgdvG6nQgyg3Mhw,31614.57176,1.972,83.93%,93.67%,N
VXTbit,66PSXQ5Z7mFqLZFEMYD657PJFGqwqqqLoFa1rkrp2S7G,31611.03284,1.749,86.04%,96.29%,N
Stake Sultan,1bB6Z9iaL1TM4VTo54B5w1FgCXFDbbtVkVJu4VbiNNc,31611.02983,1.700,87.26%,97.28%,N
Block Chain Barrage,Cv4i8f7AZ2hA7LfSNmTRTbvCTUyRSbriSa6gUA3ncbgG,31604.75346,1.695,87.44%,97.48%,N
Cup,7A9NSA1SZrszosi37WHSYARjAc3JuXxVqg3q94xjtpM3,31600.80771,1.882,89.38%,98.50%,N
Pizza Pool,77vww1KxwCCsVRFioJbV4CGwTVyeyrf3KRC9SZdbHwtc,31598.97728,1.736,86.39%,96.60%,N
Rich Druid,6cEvDrwXz3Lq6J5s6iFtg3hcuYoznPPV8g6JZ1mJ5aVf,31594.88091,1.737,86.35%,96.56%,N
SolWizard,GDeQhGxQeHC65MWt7o27NdjichewGMm7iCHuZLvgGrsA,31593.30694,1.704,87.13%,97.21%,N
ALX,EjCgjDEG9Moendqzv8wkCmnJiuNMAkDioYFRQxGYU7gc,31588.78416,1.691,87.49%,97.38%,N
CryptoBox,DFciHT8BrdMwUqQj5s1uzuN4u7EZ8qzkCgEEYTsF36uD,31587.55224,1.427,93.44%,99.67%,N
sergiovanni,J4oLW1wjuALZhiDUQeZF4fo9ZMwTCmup6YyjxAxwsjbH,31582.81719,1.977,83.92%,93.74%,N
ivzor,8Rs4wJJVFaRmARmwSvsVSAcSsUb9ZJD4USejuHm974hH,31578.71007,1.851,84.65%,92.18%,N
⛰stakestrong.com,2yruMEFWuAJ9C2jv5JyjAfgTZVGhCmv5945TUwdP17kk,31576.57102,1.633,90.97%,99.06%,N
topnode,4jx1b7HCN9nCxygP3hruC85BxcYndhxby4hkNexuHvxT,31575.32858,1.834,86.65%,93.76%,N
OSATEAM,3nSx5yrMimosm6fWh3KooRp6RxAr2A81o7UAgZUhuLQc,31574.24912,2.233,80.22%,89.37%,N
Bazel,3z39UyCtJf3gcCmBMgLU3LJFUBWP9Fvmr9fhGZXb9Hdi,31568.74998,1.750,85.98%,97.33%,N
Approved ✅✅✅,F2kfm7Mt95pd4UMPs17yVAoGDDDuTGxkhkbPZmBrUNtz,31557.41754,1.555,90.17%,97.41%,N
Nautilus Navigator,9UL36jMUb87NLqGhMDTZdEreZQ4gjQMcc5w5p1B4JaNS,31557.36368,1.699,87.30%,97.26%,N
StakeDC,2Nd2Kc7hxj19GY3Xshrxuv99kU2EpAYT2KfdbvoDXcuQ,31552.44993,1.552,90.74%,98.79%,N
SolChest,HXAepTnchdti3ogS88CGTiAFKrxrDt8gfiFA9KeVZBh2,31541.23707,1.727,86.71%,96.89%,N
StakeMaster,82LBHm7QzS7AZ266njB8uQkMa2t891Ma7CjhfTwQfuy9,31540.91830,1.706,87.11%,97.15%,N
[CLOSING DOWN] Stakeland by 9GAG,5RGkitNE39MRL78ttAPTfBMv7g3eKHzFiKHZ2Sr2J555,31535.19535,1.443,93.35%,99.13%,N
Aviasim,7iC1Uu6QBqNG6oaBimnPgLmtoantH7Nc3RD7SoLHgVET,31533.33365,1.494,93.00%,98.99%,N
,nVu3zzzLXJJzvoozEaUCyNFnHE2ZTgjzdG251EMW3JW,31528.76145,2.272,74.00%,79.00%,N
AlexNode,Ecqv59gqDSjVc4XsnAjR5TwK3Csk5dBxKtWJUG5c8ZJF,31515.58238,2.434,86.19%,93.84%,N
,BUu7cMtX6vnp7DFciYD7LsJqyf3WnATQPGjAgUoq8sgW,31512.65676,1.894,82.70%,95.68%,N
Finance Man,29VMLFnCzjTeJBpKpoq1UQhc81y6LHYVABE6DdJNWUXf,31512.63448,1.696,87.38%,97.27%,N
CatStake,9fQPHLhdbxiVCM8y5vNShMheCsQtk4Qp44qSSE45BSBm,31504.31368,1.601,89.71%,98.26%,N
,HdRcSKhqD4iG91qtsFpgATit1vZCcJQgbjnZoNdHmnC5,31503.24515,1.562,89.80%,97.97%,N
,8Uxj5i7CHajuNBUSNHdGzTz8yvmHHk2HfHwLt5ac1wxV,31501.08654,1.708,90.91%,98.50%,N
Opt52,HSV5EHECVyJhDFV1uApzXbU7uK17Z1FXcvtJvHyi2jXC,31500.87779,1.468,92.11%,99.73%,N
,5nqCxM3G1FKEZ4gUirNfpVoZSV8csVFXxbq382DdMHPd,31498.88420,1.742,84.21%,98.87%,N
APom,s1V1Y1XFHfr6pqs6edVNzA3W1kf9ye2J3VhrgKMQyb5,31497.40667,1.837,83.13%,90.68%,N
scoobystake,AmDHRdGGHijAoPGr5p5spysfwms3otXjJ2M7TYuqmwGA,31493.58759,1.656,88.47%,95.86%,N
NODE WIF HAT,BpoqTRHu5K2XZEJe4EicRnyYabeBLG9TVekBXiHXSXTi,31492.75981,1.581,89.52%,98.76%,N
kaz4a,A8f4eVZPybix5Ep4W8Q6iAPZ83jo5Y2wWXttwF42MH87,31491.44473,1.658,90.53%,97.76%,N
,AAfutJ61CwSB4Y1t5iBPVRRaq33nCDEot4WxbdQ6Bahn,31491.19775,1.614,89.00%,98.62%,N
,BtY1xJFYukPn1sFnixMDpXcUt1feL4sGqQC9A3LZi1Rq,31490.78154,1.705,91.55%,98.69%,N
,NfqEUZxKU4J7C4HobtMRFhBP6MvKvNCoa7wXSdwZNcg,31490.75151,2.378,77.89%,87.26%,N
,FKU3YWq3AUuN2mJVR2pJgbsVQHdGeaK1Yj1iMBhJugd1,31490.45322,1.721,86.90%,94.76%,N
trezorito,EFeLsLsrLhGqy7LSdws4sKvinvCohBBAda2q4iHBrrss,31487.23164,2.427,75.80%,81.12%,N
,3j1Xp8ZrfEYTUEYyTsDNv6kVCtDdwoKeHt86BJZTftav,31487.14168,1.570,90.26%,97.56%,N
Brotherhood of SOL,5F2HsNA9j1A27gFH253kxbbsmh4dWUDxFJNFrQuFdXcJ,31486.68149,1.722,85.24%,98.91%,N
,Gk7aonsprBZXQBMMEDgRVJ6RdMRwBd3KXQcu6k2T7hyU,31486.61738,1.470,92.06%,99.72%,N
,EtGWDbP7342Mo2PnG6MYUP1rL8v69ycn1FRnRTB1BLU3,31485.06063,1.911,82.12%,94.89%,N
,BG43US2rrtZggEPtXuVnabwp9FbKCuyZDASvJ1EsNAHF,31484.63701,1.610,89.00%,98.54%,N
Pelmeshka - Solana Validator,HTSo7WLg8EGHCHJREUYrhTpsz3SDVjda5gP8xqDTejEe,31484.25260,1.663,89.72%,97.90%,N
,GeYn4XjKycYJ6NqTFb94sYowMrtmKfHBcorE6SGAomQN,31483.37550,1.612,89.32%,97.20%,N
Cabasol,8BCSZyw28kK3pt3DTNKoVysjMggakuPpE2WB3pTcWGim,31483.05148,2.204,88.36%,95.42%,N
,HSjWikZVP8JmNUa1VqZuQuhQzkK4WrBmiJn1VVEtvuZQ,31482.53001,1.653,88.59%,95.76%,N
chucky18,H97b7WujYu1qRLdngfSWVxsXpasMoTaCfRbNx3qvu3ev,31481.93316,1.837,83.64%,93.56%,N
Dimh4wk,ACyyUk2AF8XCkyjVKL6kMxUHqaud5wrXo44jawohn3qT,31481.26588,2.357,79.44%,86.60%,N
,F6ui6Rz6cCKBtyrSBqnNY5RzTzENdjFFpTJZYw47GD31,31480.86982,2.123,85.51%,93.19%,N
AnMay,s4VEVydfBor1CyCDXJNNQXzFFPnt9UFwuhM59NXjotH,31480.86415,1.736,86.95%,94.65%,N
,4NhuurEJimA7Y3heUb9ejnGbUXKsCws3RsbHLCL6FxXx,31480.78682,1.780,87.29%,94.52%,N
,8S9tun2N71Q9VmTsyf8oWgf8wWsLF6YVKQEpsTmsnBfD,31479.67503,1.927,82.80%,91.68%,N
,7xBb5NxfSGGP4KuWvTY4iKNfXC7hMWmxm86eZfs6vAJN,31479.42978,1.834,86.64%,94.49%,N
,GuPnsaM3j4ojKe2KJpcaAWNmhk5n2kaJxc8ZKkowdxrw,31479.29940,2.072,87.58%,95.45%,N
StakeRocket,G5dZZ3J95jER4v7N5LBg73ybxfg9RxFBpVc3LAY57UPu,31479.14029,1.532,91.89%,99.72%,N
jLbey J.O.S.S.,DKnZkpsqtS4kpFP5zWudrg8w9eCUHixJ2QCRtwwxh8Me,31477.94991,1.425,93.50%,99.74%,N
Julianna,D1BYFpbZuwUtgNT7CeuQFQjyhEQbm9Z6XP8R7cfeWed1,31477.33731,1.702,87.29%,99.46%,N
,8b3JPQtHbw8MBJQNwUDVXC6xfaL26UNx6WA3GShGy5Vw,31477.13951,1.751,86.50%,98.81%,N
Valis Tech,DD7NQUKUex26GEsM8jpcx36MoGykbdUHJ3LbcD6Lzrfn,31476.89099,1.855,86.44%,93.18%,N
Lightning strike,FLocyJ8N1BynUs9MPMVbGYEbH2GMxsdacsbXb4N3S5cq,31476.68290,1.789,82.94%,99.64%,N
,JEJ9KC1aQgcYigTG386mkS85J3EGVPkKib1Xi1otypWJ,31475.35185,1.828,86.48%,94.40%,N
Mon D Aventures 🍀,8o3tfZcpTizxtxphuBCXNDxnVX7pFNwpNBLmHyf2Dbvx,31475.29106,1.716,86.92%,97.05%,N
BitQi,7kmTFq434qDsbuCbJgDsAtih8AurPfUk8u6kc5bJb5Zb,31475.19262,1.703,87.20%,97.16%,N
Avokado,sAESK3Gda4FqBXvbj1XfwLL3ZMzhuW8NikgXJvPYV88,31475.13784,1.693,87.47%,97.51%,N
Konomic,EDjoFJLunZhjS7difXbi1DvLPPdFenf7YvTFoa9y5pCZ,31474.96321,1.695,87.40%,97.34%,N
Top Miner,H4UcftxDC72MW4WYcXuyYmfSQMo9hDXpkGBxycBMVbEi,31474.95427,1.698,87.28%,97.29%,N
Husky,Bjq4FbzK9aA9bQ7nYd5eGjTtiMyB8yFLVomgr8Wow4hK,31474.90853,1.697,87.36%,97.46%,N
Blue Shark,6KNVY2ijdADSy9F6qoSVr9FYKrDoZcBkQdZXkZDLcei7,31474.70559,1.754,86.27%,96.26%,N
Transaction,CraRZ3Pk5mJC2sfGXGH2rFRYjr8LPVz2gLowNbujcND3,31474.57244,1.727,86.70%,96.79%,N
Satoshkin,97DsFuV8H6RiFXSXds1k4RscrLPbbDnxG2CW7wDwqrZn,31474.46254,1.729,86.57%,96.72%,N
Green Validator,Ez5oqa7UBJosiUZ3YbXsjGfnZAdcGE7awrkRmcCWY3yB,31474.34396,1.716,86.94%,97.12%,N
Ferrari_M,A3sMR7KhVkjheCiaNbDSTAMzgiyRE3Ewm2n26C7iav7y,31472.93095,1.846,85.94%,94.43%,N
,7uPvNKF16Cv3QJghZWp9aANGaF3GVbn6XB5RuFZcQwqv,31472.61288,2.148,81.52%,91.92%,N
PolyWitch,6B4Cu11nC7reP3F3wgKVtrHKALH6nFi6io9TXyYijweB,31472.54880,1.551,93.29%,99.34%,N
Skarlett,DkFMfnJku9arJJtUytBXijUyb8tuX5FQvsTUVUQQ9pgX,31472.51187,1.696,87.38%,97.28%,N
TdrSys,5CBkJdDPMWCmss3Y48B36w78Bgxur4mDib6tQ9yMKe1B,31471.40682,1.781,86.21%,94.75%,N
,jUP5hCf2fGJEz8F2j2gACezxFYCNE9zo1eTMsRQjRK9,31471.29378,2.317,82.50%,91.65%,N
paulg,HoaDnzBq8UMyS3mPC9k83shv5YvQARh7Muz4KWJMfqPo,31471.26406,1.550,89.91%,99.18%,N
Cryptoded,BG2FGmUyQo9RuGk48ypy9sa8LDJRx6j61tt64eGuAztG,31471.20586,1.895,82.36%,92.27%,N
Starfish,3S5Pw4wiwvF3B5pXQVzraiFUF2iQUDnowZDTCXBmE33k,31471.13203,1.705,87.18%,97.24%,N
GameValues,8UZnAPPeYMbxju37MDR3it9nTutGhK9F1hKDxZikygfN,31471.08437,1.714,86.93%,97.00%,N
Dear Dream,4DBehwe4U1gHaE575LZVnjN1MfyPSyWjidadRJoQcyAR,31471.03701,1.768,85.64%,95.79%,N
Lemanpay,9a7VQpVNCwBKEiADAr4EHW52CTesXnDDfnPvvp7qRFyP,31470.92864,1.702,87.26%,97.38%,N
Utopia,2WgrQTu8QitYjqywZ6uBZBFWigMdXjR6trzd6SYNwihU,31470.86591,1.710,86.98%,97.01%,N
,4ZxDeRyvhXi7Bc23qPFkeZptzE8J54eimL8phVPN5AXa,31470.53477,1.865,84.61%,99.46%,N
MiningLove,9RkA9F2YB6UtTFaFS8oP3sSMXKyKcoQUbvDEft9ttpfb,31469.33585,1.696,87.39%,97.41%,N
Crypto Evangelist,7PrwBc81z19peAGLjjq3Bt4uLtRonRrwR963gxJE8i18,31469.33019,1.700,87.25%,97.16%,N
Rich Validator,BkQJo4j8V6Xhi8p39B76GhF3csWzUz9C6VMz5Dn4bmKb,31469.32314,1.704,87.15%,97.22%,N
SOL STAKE 0% FEE+MEV 🚀,H5oqciP46Ls3mJZu334niaKMcVWjsC7JKULLCZHxT8hr,31469.31956,1.548,92.83%,98.88%,N
,9uCHWHPT9xwrhUX9AnK7zm38pC1qc4Q3pS2zi5HRRCZZ,31469.02156,1.522,91.38%,99.15%,N
GetHash | MEV,57SfBPYR4n47Mb6EKW3yAu5tYicUi8bYbui1T4qZ7RYh,31467.84679,1.531,91.10%,98.90%,N
Cherry,5nscM8QPTf6ggikeRrAuWTa5mEBumXJuWZZBk3uN1auQ,31467.78263,1.689,88.01%,97.84%,N
,GbRQmLLZFwc6Y2T6LWeKAj4jYRUA216kp2qrVrpT9avM,31467.18742,1.620,90.67%,99.03%,N
,7VKJjStSELiuK9PRQzQmQCGgy627sGSRSJhCVobMLVqL,31467.15533,1.591,90.93%,99.07%,N
SoLiD,SoLiDFg9qMi7tFEo4tiLxEVE7mteRyGZkBHJn2YYyjP,31467.06088,1.671,88.17%,96.38%,N
mSOL,8WVqaMTGPKsVSFBBPgm1vHRvSzTZYhJStQhUva1jtg78,31466.61986,1.859,86.04%,93.75%,N
,9CJCtwxXQvnSTiTWvyWJgXqpJL8oGedtUft89X5eLHQL,31466.45070,2.488,76.69%,85.06%,N
Nozomi,3zH61eoL7aL626arSqKEbfsx2kPb6P3WFU9ERUWciPSq,31466.00639,1.876,82.46%,94.12%,N
,7xRrCC88etyrLveU2PAGdSYyB6iL4krUnfyHbvbHjkEk,31464.79664,1.743,83.74%,99.66%,N
,9SFU2TfJmGB2jq8NHc5Kiaph6BGje7MDJRu7joQ7ZqWV,31464.61168,2.293,82.42%,97.88%,N
,9SGUxCqs4fpRCRuVKyfqoZxkBSSXgH37ca6XfyLsK31F,31464.47892,2.045,81.85%,92.39%,N
,6K5veuKeVeXXnJQVm9NPytNX3ZAbUoGWePyC83ymRUCh,31464.45414,1.601,90.85%,99.06%,N
,34nZYTMHzQcrWFQ7v47t34B7AzSbJgwLVehaZxTRPQwn,31462.89470,1.908,82.21%,94.84%,N
ArtVaut | 🚀 Launch your stake 🌐,46aWpTtjQaTRL81dWXg19H5V2Jf2rg1Cy3hzr76vJDSf,31462.84088,2.379,83.99%,91.33%,N
,BzFtHeFSLDDEWeGN4UbRNLCtdeaicHWsxRjCTvxUnJtw,31462.75131,1.888,82.17%,94.41%,N
Icebreaker,8qPCNWqVehF1Sc7YgUKUr7DUZtt514WHF71Wah8ZTkgR,31462.62306,1.728,88.13%,95.82%,N
,DDhFhvdVrS7nQ81KLKHaoHskQ6EiVFxowqXokXJJrMi6,31462.58360,1.678,91.64%,99.54%,N
Ttk69 MMS,sRMFc8dQFS5QU8j4LoRavfg3pPQu8EXX8L8EwchedNS,31462.53136,1.664,91.11%,99.47%,N
GENA,C4UD55ynixANA7brHZTyBwPN2uL3YYRwn2d1x3TgShvi,31462.51285,2.290,85.22%,95.72%,N
spaceNode🌐,DfWrf3vVkqkMQA8vYoJ8mVBHd6tTHjkVBPJ84CyTAybo,31462.31819,1.516,91.41%,99.28%,N
topstaker,GtieaErmxgFVySoaxcN3RP3m6kcmpWGqknZ3peXkaRPC,31462.01945,1.952,86.53%,97.33%,N
,5vZqGaxGdjhrAVqScWxLiy67ze2PqgMzyNVJcagMvPaQ,31460.91697,1.562,91.85%,99.20%,N
,7PGx3h8ZYb8A2TXh8fvLDPg5dJ9dmxxfA1xoDQCd1m49,31460.73986,1.712,89.91%,98.14%,N
☄️ The Mandalorian ☄️,42XzJdJvr1qE7zdEnPQhV5PsN9eyAcR45SWpTrifW1JB,31459.92885,1.583,89.04%,99.59%,N
Shelby,3AUwBLVUfGG9j2VNreUxbrLf7NP7jjBymVmoebcz8L9D,31459.48389,1.516,91.65%,99.75%,N
,J1r9rLo71mG7eTpX1jiYi7vyLE3QMZ4PCBXYJJfXYsp6,31459.18075,1.587,91.09%,99.31%,N
SolChampion 🏆 validator,B191sdbDFjEmLLNixWEfjsoxoYLbr5hnpT39KKoqgkUp,31458.71798,1.728,88.77%,97.03%,N
ArcKat,8nQB9R48S3SXXDTvffTs4HNR2Bf2YdbXMHFcRGXCsVG6,31458.67427,1.667,89.63%,98.77%,N
MCMaster,8b9afBA43fSDH2GHMFWVgz64Bsi5k96MDkrjPx8esePg,31458.60022,1.695,87.40%,97.28%,N
Monessy,2uuSBFp7gLzBBA9w1u3ZfHd3ZrXypctbuRheH2EBgcpn,31458.59072,1.700,87.35%,97.39%,N
HyperBeast,B8NFTRJDovY5DHA3HXHXC76rhafYM11gVasbsACzEAs1,31458.58926,1.740,86.39%,96.42%,N
Crypto BoyS,g73uD1jYARir7KJBmS94KN5XjasoZwcxAgCrS59LyBG,31458.54158,1.713,87.01%,97.14%,N
Smart Community,AJmRAtaMf646abDoNBK18ghFTwR3ocnQjRCttrQkzFET,31458.53985,1.724,86.64%,96.83%,N
,AvDxkBtVZgauCHTMLMUMFCG2GfnsN9zv2qXbrgAoWUmA,31458.45900,1.727,87.10%,95.02%,N
2hub,Dcd4JMKNuAzoSbV48FmpmdiA1iPZ1FpZp4QPjBXdrNj1,31457.42974,1.758,86.12%,94.89%,N
Extrime Money,APLFy3sMEaUVXfoUVKLVSqPyWsgKens5iS3JCWjWUtVX,31457.28038,1.692,87.58%,97.51%,N
CashLove,72Ag5dggfQFknHXABYnG172r2vtepa5ugiZDJCmKnx4X,31457.27677,1.726,86.63%,96.66%,N
viki_miki,FqhGYvSrTwEnJv4VHJZx1oEtd5fewYcdi2CPsbKnSYhy,31457.25935,1.451,93.23%,99.55%,N
SolanaReg,GV2i2sTn835Ktvkvq3ANLxbujPjfMCnzKjiH3JWUYDix,31457.22756,1.699,87.28%,97.21%,N
eska,3aHzcWLrkY2QrcDSR3bMbFWURRJWFojxh3o8wbEghXZ9,31457.20302,1.455,93.04%,99.37%,N
ttbtc,3w5guZWHiP1A1gSnhksgtTXejAYUnTQqWvXWd9BfSdUL,31457.13214,1.499,92.31%,99.11%,N
Crypto Champion,bhWgxLuBivaKiUgywT7JXsNhMgF8C6Pjg3j7jFKs58E,31456.76056,1.716,86.88%,97.14%,N
,CUoE2FDBKfmPsEN5NSH8xToXcybbJrbNaBHKdpYgNaQB,31456.72936,1.917,88.87%,97.20%,N
Darvin,4CaonBV9LeqJ2oGhTdbNMWKFcHMbLmCnpCyvrRZtLkz3,31456.70894,1.449,93.04%,99.11%,N
PeSSo'l,97im1Mxgn8FFcwhoVoqgGc7QegAokpQS2sxzrPVggKA3,31456.58577,2.014,86.70%,94.09%,N
1Gnod,ABA59L7zGDUYDjDPpP7yQ1DxLfXoFfjJJ5MRnBQNs87k,31455.91076,1.935,91.33%,97.34%,N
StakePoint,26KEYanAp9hccSFaKPaYKzt6r5Sg7gZN99zD2khDKZch,31455.87929,1.648,88.42%,96.18%,N
Cryptopia,4vggdLQRGJYvBkgbVh6kEWhyBzua1yYVpZKh4GeiLo6w,31455.53601,1.749,86.32%,94.53%,N
CuBe-M,DyDjFYB6i51FMHQvB4eKSwGHmgMxVf1i3FWwANAngqyY,31455.41209,1.696,87.83%,97.54%,N
AsT@FuR,J1iPFXVJrvx4DuGvgUJeBicnvxTkroisx2Lbeo2Q4aA2,31455.23827,1.696,89.84%,97.28%,N
ZenithScape IO,GioetmC79nLRnN7VDfHaq8coWAEFPJKu9py59uUqdV5U,31454.79769,2.181,77.83%,83.48%,N
HassettNode,EQahA1H9zQDGTHzt5uGq1YXoiFSaYU8WxjtfCCGjUAv1,31454.67493,1.694,93.19%,99.32%,N
zazoley,ErqEyaojEmRu8bhJz74mJy5MgQcyLN1rCQ5frrusAb8A,31454.55523,1.758,84.69%,97.86%,N
Apex Lasting Earners,4qdXKJc1hQcwBVx4hdPFCG6p7fEXKbgp5P1HkcZn9Atc,31454.47711,1.916,81.08%,91.83%,N
funny,71mmEPyitXLyMeZBTd2YU6NahVSYwgJaK2DRMHvb4HUC,31454.22182,2.350,88.37%,98.05%,N
,9rQxLv247GeCxmmfESBMSygX6fBxzniKec4kv35Gx4J6,31453.10792,1.541,91.45%,99.13%,N
,8xihirHNzLTCGtEyRTH77q7WzAWE8yxtD1ciQJ5j3HQX,31453.07823,1.894,86.18%,94.25%,N
WhiteList,EV4FXbtXSMKuBKG4hUeWNhaTQTEknYMXKxNry864mVdp,31453.06709,1.695,87.46%,97.49%,N
Guava | grow ur wealth,FCjVa6gBiKjvacMqWGGMqJ5kiQh1kFcyeAcNyKMyCxzK,31452.80208,2.171,84.48%,91.68%,N
Igor Gusarov,9yn8kRqgtYsAV5Pg2YTmu3PCmnm4yXFE3cRGZ2G6WFho,31452.44074,1.875,83.62%,90.81%,N
Solard,76j8TGM73QzGLd2KATNsCwewPVESCkVpkePQdm5PwQXT,31452.41918,2.119,85.28%,94.01%,N
,GYRsheZ78JMfMNETuAZNrs6L1U3GsHP5crzzLPeETDYm,31451.36321,1.514,91.13%,97.95%,N
CyberVillage,FwLsjPJdnSiuCvs1NXyR1cV6Sw5GRE6Lj2s1gZ9NNTmv,31451.34532,1.885,85.32%,92.06%,N
,9hpbRMs6SCsVVWTeL52DPhc4FEyeN7BQvJ8xXH3F9G8e,31451.13023,1.738,88.41%,96.18%,N
A4 Finance,GGKZN9R2aGaW3rBA1HyzSUJESjNccpEfUQtQNZG2z9Dr,31450.95943,1.693,87.43%,97.32%,N
Bearded Validaᛏᛟᚱ,VMP1iN9D34jQo1GFvJs87SWQxvs2eL1VEkT3aEU7nEG,31450.89275,2.057,74.86%,98.02%,N
,26MXTErkUfxTGJ78WKjNtVSTXHBrZEPYFY3oeuGeewz5,31450.83965,2.002,82.32%,93.32%,N
,C9t4MQD7GGidZvdy9AV8Nwmnoou1jZEa7ZsEZnw5BncX,31449.39097,2.062,81.99%,92.75%,N
FAN2,FGcFu8thUEhvnsKmPBT7D2Nzgeef7fpnXsWtM3WgDv3f,31449.25905,1.803,82.44%,97.77%,N
,61bUK8nWjw4SeDyFARVc1B67gXWwX5Gykfdfi4dMgCYz,31449.04202,1.517,91.85%,99.60%,N
,5VocRSwT6cqSTB8qcJ8CsSmHCmGNnohXySHWWQRfmv3a,31448.94040,2.119,74.24%,93.52%,N
F,SoLdWNZvT8f9293cELNBcPL3XLzsKCyG4AFmvqwXbmq,31448.89909,1.978,80.63%,90.79%,N
,89jnaTMuq5aXUkmpLbykRNaU16i7Du6QywqqPeCPT1Dy,31448.89576,2.124,73.79%,94.71%,N
,DF65vydoevPj8q4LouGebBFnzETHfkioHfHgLHBFk71G,31448.88436,1.468,92.45%,99.65%,N
,3fntToRUTyDpSoLF1QMZgpF5HoDcSmvBisXoyKASMaaH,31448.85809,2.146,74.07%,91.15%,N
[PoN] USUCH +MEV!,ADoWVeGQscFzTue51tMtFiLWiTTYYnkQryQFN9VzoRxL,31448.84431,1.695,88.99%,97.71%,N
Sila Systems,siLaRwjLu35b9uRkwz1aiToUGyjoy4JTTgHMBDj3924,31448.78811,1.450,92.73%,99.40%,N
,BGhFJPWxDdr8ATxFYEBifgRaZXta2nZ16oav2pdwiBck,31448.64305,1.884,82.85%,95.93%,N
NOVY,2b3UDcHQ8J4wLcCGjjh3f155Csoz24hrM4saG2r1Cydx,31448.57915,2.087,74.75%,97.17%,N
maikrotik,FsMucSM7B5y5PtehabtQJjDrGmKcMEtwvt1TpSjDrcZW,31447.91064,1.567,90.77%,98.39%,N
in_extremo,9nyiCpH8tfzSDXWP5BX5u5Fyi7Mz1DcMPp5a7aUhDybE,31446.99825,1.949,80.79%,91.91%,N
Mari,8drPe3FbV8SjsU8S415vtjarTnW9XR9TGaXbhAdWRUWp,31446.85817,2.352,87.32%,95.14%,N
,4FCCbZyS2Za1RpAk1uw3Ewa25B1BmuybipvUpBzR6RpB,31446.83591,1.571,89.79%,97.30%,N
,9QAWHKhWuwAYc6vZhGarcai9WeFeZNeBJTNfMbNTbKQ9,31446.80659,1.789,87.73%,95.51%,N
,DU7Xi2JhP5UFUZaLgPkne2VkQueJdts7YosdHyYcJ7bE,31446.80214,1.758,88.34%,95.99%,N
Golden Man,DNK1bxnRtsg3Xvif2wHbPsVjAJvoP2EQmwsTxtQbjAmh,31446.70895,1.612,92.77%,98.70%,N
,Cc6B7VmLhvqoBghrPwKTkZScC1fcXB15zkSGVBM6pTSS,31446.39811,1.595,90.55%,98.71%,N
Sol Team 0% fee + MEV,7zFvisPXq7xCFoSAL4oxZhRpDonmf8NxQFuLNGW4UYFh,31445.13810,1.435,92.87%,99.31%,N
Crypto MrBell 🔔,DQRqi1v2un5eSoWxCkheGyVvcxm5LiMnxmSRUXazdGVX,31442.19646,1.519,91.32%,98.29%,N
Sec3,EnRcbgr5r7EUS2P35szncy6TW6eWA9UQiU3yQRCDbh2P,31441.45104,2.036,79.59%,86.63%,N
Smurfik,7YzmMGQhrE7VaTiDFnb7R633gquLEKmSpwkXG6u64fhj,31441.06604,1.597,89.80%,97.22%,N
QueenSol 👸 | + MEV 💎,B1u3QSjYXHhiD4iWo6t3MwbSnRXjtsguMYZjYGXu3FZK,31440.53049,2.164,75.47%,80.76%,N
,5bjKPhoQDcpPVeMhu83SEtXqXA9vw62k7KhL9zpsK31b,31438.32798,1.686,88.26%,95.38%,N
Veterano,8NGHra5ExC6zy2dBXc92MwDTrDCtmJXZaGRMRihar5SP,31437.74665,1.529,91.99%,98.42%,N
,taiVRnba6XSryVXnDGvUTm2xJNuFiZV5VijE3442SZ8,31437.12526,2.090,75.76%,91.66%,N
,1M5USfamd1N4i1z6UZeECrWeu2VfrxjYMBSXThu6TqB,31428.43023,1.672,88.45%,95.56%,N
,DzCirYWNsCECVHgSaMVg1mqMzKwtGuN2Pqm2a4HqVpTE,31427.61270,2.087,90.19%,96.11%,N
Reveleum,Fm3YevqrrvwKWEAJVmypyja8JZnanYudvx2ZXV4RogX9,31424.86594,1.507,90.79%,99.65%,N
,EPrq1DvsWqX9CHBKgMU7gxvNvPbqRLhbqz2QzHcPFzab,31413.67922,2.307,87.08%,94.37%,N
Plastilina,4KAmS9X8tGJPPzDdwT9Fa9F1y3GZEoacGhMqJ6zstUXN,31410.00447,2.173,91.03%,98.62%,N
Ponch2024,8sHMgX4GyEByphQm8b8ESKJhSpveSMrnwh4Y4pt8t8FD,31408.88473,2.140,87.53%,97.10%,N
borsh,E7SeJHDuThghiqzyq5WRP67zGr4JzLCQYqeAeHKc8vwM,31408.05122,1.967,80.40%,90.97%,N
Capybara,E8SMqsquNDQQPPunKkKCrMcDayNXKYzKaX5e7hswcPVj,31402.64123,1.770,84.39%,98.97%,N
,2eZwQcDuomrzfuj3kc1p3EqoSKwaBUWqqADeagv7PcbB,31399.92607,2.036,85.83%,93.67%,N
alzak,GyGjudkJs6Ss6Vu1U8rGSFVLPQsXsqiM8F5yY43Uegda,31394.64042,1.664,91.69%,98.36%,N
Monkey Kingdom,62AZkVfjLRXmNtW3guA2nsXv7MmzQsCWmscwkFzwts1k,31394.63007,2.694,78.18%,95.98%,N
FA,DrCcHpAWj8a4JU99QKtwfCynzdhgQeuieAY9WadZD5Ry,31392.64143,1.655,87.86%,99.35%,N
AnanaStake,EijMpL5u45wg1ZTJZa4i7DvUsn8um8s5woVJsNmvCpTP,31391.39956,1.938,84.97%,95.02%,N
linap,7fARjzLYPH77jVBPyUfptJGbi4aXfN4FAfs8W89BWZDC,31390.58781,1.763,88.09%,95.49%,N
,EcZBjDPzSZLdsyKCBq26MZMYFfiinZsfcL3SwWMK1eNL,31367.44724,2.153,81.23%,89.66%,N
,6h8UDnJb4Rw7j5ZnszWPE5qKdCmQpXSpbfndzHbzjJ1Q,31366.65840,1.967,82.56%,90.87%,N
,EbWmbjxUrq8uifB4gCJLaxv7joYmsXL4qVpX26xYMFBh,31366.56024,2.204,83.72%,95.89%,N
,Dp9gpMr68ZG6gKi1ByGq1oACwWrmRe7cvBWBHhRbdHxr,31366.53487,2.375,79.54%,94.25%,N
,7y4wStv8XxUkuBgwNkidfxdy1V6TMYr4UjaTDwcS3MUr,31366.10126,2.366,80.28%,89.07%,N
WestSide 🖖,7miZ2ZoXwS3YDzBRCbWcEtNVyuxk8WbbcyQwq7i5btvZ,31362.39745,1.775,82.77%,99.64%,N
P-OPS Team,HLM6hyDWrEca9QMS92nDBa2AreU1qDkppttPVuJ7E2CU,31254.65695,1.912,79.79%,88.27%,N
blockconsens.us,AZUYzQX7nrbN1iE25YsSCSZAywZcyr1C1anMnwZtaqX9,31201.58423,1.812,83.32%,96.65%,N
LuCKyC-MaiN,A9igcq5tcmPjg8gy3soDnrmCMwXT3pmeFx3oojFjTfwc,31131.60575,1.653,88.32%,96.24%,N
SMCvalidator,DpZLBTc94PHUQLEsGh3mjRF2U9etouZbSVyAS5aqFrom,31126.57313,2.184,76.91%,92.44%,N
,BwCHr5RNd3ZYqQoZS383FwFn8cbNHiHkqkbmqgKbXBkw,31115.97167,1.747,87.42%,95.13%,N
Blockson,D7rALJCR3KUMhTwtmjvk4ursBLbDNvAVRf2FwdQtbVF9,31112.55846,1.681,87.75%,97.66%,N
,mStRhdPx1gCC8aTteWrEzqxLyjsn7nqh2LqsCZ2Bihr,31107.12613,1.429,93.12%,99.74%,N
,A5dLWA1kcZZSEjrphF814Da7PW98gz72eG9EPTR4wuqb,31101.45697,1.888,84.12%,92.35%,N
bulldojkee,D7ZCDE1PHe8duMjNpxwHrYbrRzcnsS7p4nD2daLzWwtr,31086.97744,1.831,83.89%,93.47%,N
,6AdK8MMRrUUN7nn7SPkbiu1FjyL5mJpX8sPAhg3r2JWN,31085.03346,1.698,87.56%,95.28%,N
TomNamNan,D5tsrjN9suzT6cbeqZjoPB7KNMKj9vfcAuK3V65hwk74,30914.66104,1.566,89.73%,97.42%,N
jdr,3ucuV6s4F3jvhvMrx9hz69abis2Q6P14aDxpdtP65kCc,30863.47163,2.060,79.23%,85.74%,N
,BCVbQ44TgcDeuAEdpcdUMjy5qGKSxaeUovBqXqWNPNVh,30862.31792,2.074,84.82%,91.85%,N
,DXv73X82WCjVMsqDszK3z764tTJMU3nPXyCU3UktudBG,30862.15167,1.791,85.90%,94.30%,N
IceFrosTv2,7jp9iA5QF4VJrV1YZ47FqFDziuZALp9wJSWRLWBa4Lg7,30832.19476,1.943,84.39%,98.62%,N
,46Acpa1Md9k2Nxkr7Xp7eDRbzNt4AGXPGyzZ4fnJ7z8y,30831.28757,1.881,84.31%,92.79%,N
,9ZPYFXWnVTjzDUMMJNKzfqCNJaC1SEyRSHtSytAd5meS,30830.84295,2.234,85.49%,93.92%,N
CapitalMagnate,CTQjcSEuAN8Hs5SJ2F9rTJbJAAKxY5cyCXLzRSiD4JPr,30828.36663,1.989,78.66%,95.43%,N
Fairy Land,3z4NrwnS72RkSmnZ89MNr3GMxga1WWjjW7qGArg8wCng,30826.67337,2.141,73.70%,85.93%,N
Mors,13Yq17i7dGknpzHB4L77QB1AMcfAvkE1c3D1MKJnj8zT,30818.92009,1.649,91.83%,98.49%,N
,GjZdDp7emowSgB21XaV9BCcStSBjypDPA3bZtc1494DU,30816.24466,2.292,84.61%,93.12%,N
,6H2opQ2ebr3B6PPnjVFoMQK8pFiJhjb6AqWTjAYGqLYH,30809.54477,2.185,86.09%,94.68%,N
Magnum SK,AShjuYEE1bTBar9HGJehw3FgzibJuVwuP846guzbjRPM,30486.42221,1.801,91.18%,97.07%,N
,GakAanHMN4dYY8rMKL1e6uUKjNJj2nN2sENFaxzdMEBm,30421.04942,2.204,74.38%,84.64%,N
2007x Top 🚀 Validator,6fiUHL6s3iGgp19H7PfbEuJGgu4LQsWMu625fya16xgb,29946.26016,1.865,83.02%,93.46%,N
CoinDataFlow,34oGkjDsb6mRwSbvw9xZDtR9URfVpRnYjvwZecUZUsHF,29771.99033,1.693,89.47%,98.51%,N
Urb4n_Thr34t,Hr3z7PxvnZ7Wa5HnKoRkBcHU65imwqtKHQPQ7tE8Y5a2,29764.18854,1.983,80.02%,90.00%,N
,6JpwHChay7q9meZVBhGp4wBvTGy7L28XsCzwLhGF875r,29757.60398,1.886,84.53%,98.17%,N
Moondefi,5WF1VwByGfW31Nmk1xcfz9k5YyZLskX4659JXyAA3rpb,29754.88284,1.764,92.46%,99.03%,N
,7ZJHBz4SzQw1GDQZRaCMLvo7uoUo7cY1BUioA7mdfD65,29753.75556,1.983,84.07%,98.06%,N
Blossom,89DXJe6XTDASsmyXJoPyRetLq1csRj9N2Bwn67fNvYGt,29743.21279,1.778,86.27%,93.45%,N
,137MRxQWHC47fFiT1F6vDsTBzEuZJb9SwTt2rm3nHLYM,29657.26246,1.925,84.14%,98.11%,N
SolX +Mev,SzNm2zDpK3eJmSYR21pRaQ5b4wQ37ecds6det5YCZFP,29544.50585,1.360,95.24%,98.98%,N
ChainLayer,8jxSHbS4qAnh5yueFp4D9ABXubKqMwXqF3HtdzQGuphp,28682.11435,1.871,81.52%,88.65%,N
jjwoods,EXYEG9LAhC2AP9FYGGUhjJDTKfCU57S1Mi3Zp28cV6CU,28561.36707,1.590,93.39%,98.79%,N
DeezNode,6F4gdYb1sqHGMeFaeEcqt8N6S2anHre2BkZM7QWo8r6N,28463.14380,1.860,83.46%,92.04%,N
SHINOBI,HTz9TJBmyuT7YEFVYTGHdsnTgt4bzkgq1Gv2Zx688FP7,28182.72541,1.750,86.45%,94.54%,N
SonarWatch,sw222BfVDABppvydacSCj3JVaPSC83RoRtyvLmr6pNx,27405.31187,1.541,90.62%,98.13%,N
,AWDiZEPxJizd3f7NxiJijUqHt2NDViGN5CWzzeN5Uoeh,26776.33691,1.832,83.46%,96.01%,N
,3VTepuwgRA9nyw2JESdnqrb5cqFZS3vD3R4TuuV2wGHA,26747.46899,2.682,78.02%,84.66%,N
,FqERCVEHjm9P9hghJwWbyN4TqwCCAYteeX1v6gBtt88p,26745.73641,2.053,87.81%,94.86%,N
MightyMooseValidator,EGg6LTZDgV9CgpPZnpTTzmebSSyaH91cQ2eoiDxiJPvm,26736.24637,1.568,89.73%,99.19%,N
pro100invest,4gg56BTsCSEXW3CLw7BuT31x3ptEjSz6aeVE1Xjby22R,26303.47442,2.139,76.02%,92.20%,N
Digital Energy,86Sw9R6ynPmXnHfwUWinXtq1QoF2KHesfQQyZG5r8sXo,25809.40030,1.911,81.02%,93.16%,N
Chulok,6V4SMF3vweyPZWUiPAXkZsNstHDoecsWdCDTUacn8j4u,25367.70209,1.779,87.29%,95.45%,N
genco,6yShbTX3KRMJLANDfo8Xo4aHYCjepjUbna9Y64mdQB1a,25239.43998,1.796,84.99%,94.34%,N
xXx with ⓿% fee + 💯% Jito MEV rewards!,6p7SQ6D3ACRYDM7x5Pjb9xa6sChaD3ZBoZxXpR2LyUZ7,25219.56211,1.610,88.68%,98.90%,N
Envbest Validator,GMiBDMmwFRZfxVuHt3bXe6ZF7mGUBGWKXHLfY97NwQ72,24767.14656,2.047,77.96%,83.26%,N
DeezNode X,5yFNiQbTabGCMzvfyrhjiMAH1g6VEcs7uHe4W3KyYwR7,24728.17459,1.745,85.75%,91.73%,N
Reflect Validator,rFLcT89WTT6kJsKmrMzpz5FUZHy7Z9bycBF1Q1SMy6i,24492.71545,1.625,88.55%,97.49%,N
,5TFdzjKE6LnkhQArxWjt26yVCXskPo3fUXE8F351Cfn7,24462.98192,1.888,83.22%,93.88%,N
Restake,BARLL1NvF3jPHQ3zb82q1v5m6uewcpkgRBYVNufQMWjo,24345.00743,1.355,94.61%,99.90%,N
,5rLhUQWKogfKixoUr3XxrMDJEx8FPWBnXCdVgH7YEFGT,24206.22207,1.880,83.81%,92.38%,N
gaver,CJznrtFkWvkK91W57btS77cXqRKce3DcoX8KXRp2WzpR,24092.44775,1.775,92.74%,98.88%,N
,7CW3zdKsfzCVDZBXsKcimqkGS7nuHEsz4KB1oysfec2K,24043.68812,1.643,88.89%,95.82%,N
Pigeon 🕊️,A5tXuTBECLBm7DwHcUvPJrqFbzCuBpj2Vm57E8vnnq5W,23971.02773,1.656,90.81%,97.83%,N
Tiggo,AWFQY2upeyu9YHstZM4gNDvRWS3ircS6EGrSTntg6E9k,23971.02739,1.675,90.39%,97.31%,N
AirStaking,Ea3QDFfHSEPbTDKPaDSKwcYYK4unXR5HEuqeiQKU5Scr,23585.85056,1.674,88.39%,97.24%,N
vasrox,8d25KBXdovroNVbjRmvDeW7H3QMW2nfZZo7G9zQ693ki,22964.68698,2.186,89.57%,97.29%,N
FomoSapiens,5ysJtUNfmASWjzdQy1vyvrVp9jAg5Vq791HABeobrCX5,22509.88141,1.437,93.11%,99.74%,N
,HimWQUK61d9wxhw7EYu9jUje7xQiDs4jKexaTSvuCmXE,22071.16160,1.986,80.80%,87.15%,N
VNStake,2sR1ApkwZebjrfMxAyWxEokCQVDzw6FyEYwSk11wav87,21725.95354,1.402,94.38%,99.64%,N
Solscan,scanjszMg2p4pXCZJWNUY8gEN6sCqY2oThXV58NPbWd,21650.68626,1.886,85.60%,97.18%,N
GERvalidator 🇩🇪,5nH6sYJNSa71DCBQHgRCsX1dh5W1bWrUPeYieo9xyZ7f,21426.17400,1.509,94.08%,99.53%,N
firstblock.network,HpeyxYuEXXdB7Xx58pWN6o6aKdw6mxSRBHYAZpXsdkpS,21267.23230,1.849,83.45%,94.68%,N
Good for SOL,AkTJNhRStpi6FmehZi2tit96vQgXkmgpkfGfrp4krQuN,20655.79465,2.378,89.32%,97.13%,N
Irishka,4DW4nrbGrjXRhhj3CH3AYgocExfqEoCCSMxZ9uzc3NpK,19895.65924,2.253,81.30%,90.12%,N
nik4,6T5kjAEURp7jsEfX6NdQVczDseUgMFHtK349Agouwotq,19868.78704,2.177,89.99%,97.40%,N
Celestial,2Z3wkL3hKB9ERwcPCDXLok7ZY5SKWC6m2ExhmDRRuCEv,19782.46139,1.403,94.20%,99.23%,N
Joker  - 0% commission + MEV rewards,JokeruQoFrVevoPR5QBRPGncPQbtrpq3PJEcY22JefC,19689.07089,2.461,79.73%,86.23%,N
CyberAlex 👑 MEV,VaCdXKupamusfRsDf9Ai7e8Up36Z4f3MP6SqhnM7c76,19660.45073,2.248,85.92%,92.66%,N
WayneWayner,45W8qw7QurSGkRrsiQpYapifreLouNv7hFbwnnzRjMMR,19646.15924,1.923,80.75%,89.99%,N
Otets,4ZCnzKSLNUrJnLqPGYvD2DWgZuoFrs419tEk1J1VZyNw,19630.31064,1.407,94.44%,99.63%,N
MMGuru,12pVREJSt8d5AV4aBzGFf3QZn3qo8DWmwBQu3wQ5RAZ9,19552.84443,1.748,86.30%,93.79%,N
VesuvioStake,2EugUXCgvu1qAfKiUgDjcMpeMcr1pvWVeug9YHtGDoSq,19544.11418,1.468,92.35%,99.52%,N
asaf91,3CnKZPQn92W8WXG7KTVaFQRk8LJJ3KZbrVVF4ngUxqkg,19466.21157,1.598,92.43%,98.93%,N
MSK,Fx9gdBmp4Rer7rxu139ofGKcx3iffKS91gg2kFUeBvjD,19416.23989,1.661,88.31%,95.67%,N
web3ident,GhBWWed6j9tXLEnKiw9CVDHyQCYunAVGnssrbYxbBmFm,19148.62051,2.486,85.16%,96.10%,N
Maline,5Uq8xt2rMRByjXRWJzHMZA3EKtsGnGaaYFWK8CJFM9tx,19046.25331,2.330,83.84%,97.94%,N
Uzbekistan 🇺🇿 + MEV 🚀,GVQEm6h2UjDKhSU54kf7kFumJ5NDWddyYUtgy5eLCtBn,18926.57375,1.607,93.27%,98.67%,N
vladika,53RJBy7aBGA7Aag6AryxEmBbsHDgwfBWagLrPbGHnfvR,18909.76979,2.728,87.38%,97.30%,N
pasha_k,4EPxG5rp1sUuHtrTcgQYfPo6KjvTWp6YafYsdUSP7mks,18904.27921,1.498,92.03%,98.09%,N
,F19Lw3eT39uTa9bPRvqePP6DyukTeAP86ctrceHoJUTX,18902.47755,2.390,85.56%,90.70%,N
Eugene_A,H7v2FWKJJ2mPd1uof34QktfmxmdZxDH8Pk1YchoeyMXX,18902.37610,1.583,89.38%,98.44%,N
buba,6rC1zg98a89eQurdnvXz6uJ3zZZa2f683WwCDB41Us8w,18899.48364,1.705,92.11%,98.64%,N
phobos,APXk9VZkjTPFjJNLFvmCDHqMQ7moQd3ywf3qGtSjvHyj,18898.70172,1.546,90.81%,98.66%,N
shab,DgXagy9ggXCXjxZiH2D8M5HZDaUvERAE6Lh3jSNCMLZ6,18894.43312,1.602,90.31%,97.18%,N
Visor,ADmLWUm2eQ3KFijFbqa4bVfiLVmW5iqjStE5b8Wbti1y,18890.75382,1.819,91.08%,98.83%,N
,EJEsgjKdxKPe5mRaepH6bT8Q8xfSo7Lr9G7iEi6AgZMR,18884.83642,2.475,90.29%,97.01%,N
Bynary,xMjsjrBAYaccVsHR5FhAYjTY2SCTRR1XcsAbt6P3TB7,18884.29540,2.145,90.49%,98.46%,N
kira,5RBfeGBGQRRTvmoDrzuzgz72qR6YFUknT91Xfra2LRL9,18881.38046,2.082,90.76%,98.75%,N
QuickNode,2DpnT6to3eJsXeg1Tk42XFCXLMKL7pGzMKFwQS5CNK6a,18878.50334,1.598,94.27%,99.52%,N
YVa,CSWfwhactcdyK2YcRmk3Hx1AZzNKDFnCecwiYsJDkuSm,18875.26991,1.475,92.25%,98.03%,N
ifrosta +MEV,BNYVMkawH7ekKdbZ7NHqd7duLVc6QLATHYf5aqMkwjec,18869.12115,2.061,85.02%,91.61%,N
Dark74,CS8DoKUL3nXeyVbg8arD8TBZTym4U5ijgCf9uZHGqZET,18868.91838,2.012,79.09%,89.18%,N
,HzJULufbrhteHLQDYAh8ZZn3P6Kip9MDo2eLEXgiTJed,18835.69720,2.241,87.00%,93.52%,N
Sirius,a1exajFBsggm7R7ydb4LwyEAdsLCUKNAiUrre9B12kV,18832.05596,1.459,93.17%,99.57%,N
,66fsNu5A6iB1WUXGjuBMBXm2qYQrbtc385bcVYaVu7QD,18830.61883,2.716,89.96%,96.46%,N
maximxmoroz,DgHgHL2j53ugB4whBJh21MYLKmyaW9jrCzVM87E7zgVe,18820.44062,1.667,87.78%,98.19%,N
DeezNode UK,3XDZhoRESsx9bU9rdX94qrtLL7YCxhgX3dKmXFRV2vU7,17666.24857,1.657,87.98%,93.90%,N
"apySOL | 0% Commission, 0% MEV",apySoLRzPkGf8EEinWQjAbL6B4frjgx4gG4YePoM9NJ,17207.12658,2.035,82.79%,88.68%,N
DeezNode XYZ,FwnUt6MUucm4mKKGfRVcKo7W82MTusfZ2sDhnc8k6F5i,17085.71244,2.497,81.27%,94.21%,N
Necro Monitors,vCLwKDp6hSCWQgQ7yVyx8vhbW4zQgrZ2btWfqvtw6ic,16769.89946,1.375,94.40%,99.72%,N
Litx - 0% Commission,D7WodK26tETSqyWBW35vvMGfige9afLEyTsm1Pvvropd,16528.24850,2.041,86.61%,92.97%,N
Humbility,EWRHPjhZmYj4oqgo4MyjuqoWzuPhCcRvTtdGDjuLWeMq,16007.75255,1.818,87.99%,94.29%,N
Raydium Validator,RaydiumJDX8X6om6Fg44xyqz5eukZ9KC3LX61SttLbH,15166.47512,2.088,75.56%,92.85%,N
MX Validator,Mxv1Ubm71XoUvxrN3qjN8ii6Bh5b43NuuKywsWx6ox2,15161.90180,1.863,86.22%,96.10%,N
CMS Holdings,RAREcr3SmDePhWD4Je1qEh1UMCQD5MFaDHF7UTzezQh,13824.57370,1.879,83.91%,94.75%,N
REV,EogKVYgic8LKAuV1kR9nRqJaS5zpwCvSMfqoehzmAMpK,13312.57064,1.538,90.15%,97.18%,N
Karma Stake - 0% fees + MEV,KaRMa7rp6WbmBgkqLAGLHw2KGmffiTtb4GsUQKM1onY,13007.39040,1.314,96.31%,99.68%,N
MSC DAO | No comission,CdSGp7TLd8cFSwpEN4vKyroVxaCq76dCwCVMSmzAmGNF,11940.97659,1.457,92.69%,98.51%,N
Cryptostake.com 🇨🇭🇺🇦,8fw5b8A2Ss11PFUVSN9MEA7LKkHEwwADU8YaKtaVfdLn,11758.88411,2.113,85.21%,94.81%,N
HydraLabs 7-8%+ BEST STAKING,BGoQwskddfA7DvGkp5JBSuBbryQ96tgeq7ubu7Y8TCGn,11572.48031,1.421,93.72%,99.72%,N
Serhio911,FXcZJuQwkcQpw2YrkTaxWJ6rnw4P12wvULttviMRn655,10234.85468,1.743,87.36%,97.50%,N
LEDGER,DDyikTKaM6RW8PZes38aULUeZkWCtecPZt2pmGCby5Q4,10012.84274,1.736,87.05%,94.03%,N
Jito MEV,7Tky1T9JDevVnNi9oF7tbq6T9KjRVdsMyrHusMKWbY4n,10012.84191,1.716,87.35%,94.56%,N
,G3wJM4gfVhkSapswtSgtQ6HmYoaiXY77asK3pxJTxeAX,9352.38901,1.403,94.29%,99.48%,N
Pastuhov,HgovzvawYMRPY6Go2kaQF1vLR4rNixooHKrUWSH6aW4C,8884.62037,1.761,86.74%,94.02%,N
Absolute Guard,9G19HT8xqceG7mKQVSrTRS3DGnGqDHErPyQEaEfyWEuW,8429.40159,1.719,88.01%,95.11%,N
funnyponybunny,H878keHKWKrviodvW2m2PsoV5ehiQX5n6hbzDQCkSrET,8349.93370,1.465,92.60%,99.11%,N
Foundry,4GAmUQ8FvKcTzeYGqxu2oSBMStYNwDTmBo7LC1Csg6SE,7911.08044,1.986,83.06%,85.79%,N
,BfbkjGQJjfA8DDD6Pkkdc9c2okMQ2pzrg7qpbiYs7TGC,7865.32768,2.402,85.19%,92.53%,N
KarKar 0% FEE + TOP APY + JITO🔥🔥🔥,7BEkR6kjnh7XPxQ4Ew5ePby7orLrXKT4zDE97kbN1fiT,7727.89369,1.765,86.83%,93.72%,N
,EFEKcHrUBsRoQkuTSJAQNZnj1u8h9oE4LoCYerednc3F,7386.11609,1.860,84.35%,94.21%,N
007,8Dfm249TXe9Wd3wYEnpBdSme659gecoEMH8zx1YWN79v,6970.03450,1.965,85.10%,93.74%,N
shurik,G8GqFzoEZrxHqV279nYxD5PX1vWWHvxWHkBDkXU2qMy6,6944.71701,1.542,90.64%,98.56%,N
Dan's Validator,B38JgkTi7Fu2Uxk8JzNw4M7aMhVxzGu2fsRqHNScPkCQ,6937.85431,1.906,81.71%,93.74%,N
Craftorium,2bm3fmyLq12943jC1UePUcvFho7y1bUik8PisvsRc2yq,6920.10476,2.057,82.30%,91.29%,N
Gadfly Validator,Ccd7Sbwz18cHZ24uYomhc7JHhXKHZxyb9Nvyf5DncbTh,6877.51522,1.707,85.44%,98.66%,N
FlowerLover,37x8TtovaYhKBaByjhNyFb7p4AiJprjm9FnfzeZK6qqo,6514.48156,1.707,87.97%,97.74%,N
Jasper Staking,X5b4FjDKLpYKscwktr3nZjPwTPxsuSiLURNxZKqSvCw,6316.25612,1.745,83.69%,99.45%,N
AllianceCook,52YQr3Je2C1BJMFc4AxydsT4tad3J9ZVHFDHPNMJznE5,6277.30144,1.639,89.32%,96.04%,N
,EdPchRNAXoFUnawzcJYgKzx1b2j9mqQ8VssC1Unfrivm,5940.77579,1.608,92.02%,98.30%,N
Matanat,3YdhWTVMJ1SrouL2ym5LVmj3pYc6EYAwnXwguvccCACp,5464.52028,1.807,84.55%,96.37%,N
vlada1,C2HZnYeF5BBbtAA96iZYcFPv3vqRUur7ZXXYAAZ1GMfw,5228.76512,1.642,87.71%,97.72%,N
Picasso,PicAVSPJBxGianeFm8r9fSLkudZXX73QzYwKe1CpwAh,5017.49508,2.135,76.95%,84.77%,N
gunray,LneJvrSDJGqfpbsKHPfyaxSPecBtqRHTJnwyBzG4vPC,4736.17899,1.994,83.13%,93.37%,N
Dirizhable 🇫🇷 | +Jito,4BwKbV3ViY9huwhxRrbYWC5GgRUCwEe9k1YpFqFC7kQa,4354.12590,1.810,89.25%,96.54%,N
"#3 MEVSOL.io | APY ~11%, 0% fee, 0% Jito!",25rtQR4h9BQKMcU6a1DxpZjB27dwcRUAdVb9binerD9E,4307.77878,1.315,95.66%,99.88%,N
NexaSphere Validator. 0% FEE JITO MEV,8pjtSdYyBZU95qnopcoSZynqntyMvWdwixRMrntqGKAd,4195.58731,1.455,94.19%,99.74%,N
DerNode,DCkFCCEQCuRTcJ3y4rTnWyXnQsi5abfCFXPZZ7pjPJqG,4132.39803,2.446,88.63%,95.55%,N
Little Tony,AZcKUCnvQfdL3BWgX5KUDDRd769WR1AtFE7SV3Q4Pzeg,4000.99972,1.793,86.15%,92.45%,N
CARASOL,CaraHZBReeNNYAJ326DFsvy41M2p1KWTEoBAwBL6bmWZ,3998.72313,1.425,93.61%,99.70%,N
Node Doctor,7ztvwhHQxU68beHN88iK2h7KMZb3zdHcESWpNHJhQwsc,3689.86972,2.054,76.98%,88.44%,N
,28E8jAYguhHPuuMKxQJpSmU3J75zi6iFmktYbiam8eyS,3656.56989,1.620,88.09%,99.47%,N
byasa mencius,6GoijNiK3JZVAY96ykCfPhcJnrQfrQMLvrQaX5HyMVhu,3419.50400,1.670,88.00%,97.17%,N
"#1 MEVSOL.io | APY ~11%, 0% fee, 0% Jito!",7spi8Z1CpG1AezUpjHQ5rGKxw2dBoeTfBmQxqT1YkS9y,3324.91095,1.334,95.21%,99.64%,N
dimGate,E3yhPs5PPN4RZh8FbJo2eqtdrAYKCK9H7pcSD1vCNCP4,3291.89426,1.851,91.08%,97.67%,N
LakeStake,LAKEuKJQYVFpf4vyjX7iuf9ajHo3k9FiyewYKf6VxPV,3289.36652,1.860,83.18%,92.92%,N
Yekat,C2KtdF4FBNybpJrAW9p57SRxv1cqH7EAFeJPJ9J3biLi,3109.08833,2.701,81.76%,89.56%,N
Meria,H2tJNyMHnRF6ahCQLQ1sSycM4FGchymuzyYzUqKEuydk,2772.20497,1.771,85.60%,92.28%,N
佛金疯 Solana Chinese Community,EtMSc3MvcDXUr6ChK5GxyFVwTxYA3zqP5XzjE9jwKvSV,2609.46315,1.681,86.94%,93.63%,N
,Eb1oa4AfSUb5bHrKnNdSkZwjoAofMcLnkF7LgYBAyfsY,2589.84549,1.738,86.53%,91.97%,N
luav34,53gnaHMxDzGTZ9A58S4jbc1qzhYT4X51thUD4MdSBiyo,2548.97761,1.955,89.84%,97.65%,N
Mercurial Validator,4z9rbspUBsnZmTQbWSSPETkXmWHfhzQXXc289Z3m6XcJ,2499.98387,1.352,95.30%,99.73%,N
Skeet Framework,SKTBkag6kjXVTTJb2nWbuK3mZQXnMrrbMPxYU7uhbL7,2374.43127,2.048,78.71%,84.17%,N
ARM Armenia Validator,9PK3feEcZ5LZwyDEygtr84qYN5tk7jSUxhqzFEw5FsEv,2236.03020,1.433,93.44%,99.44%,N
"#2 MEVSOL.io | APY ~11%, 0% fee, 0% Jito!",GCUWGuMnmtMv3BFMx8EmeWxst18sihXxyU3skeNGTj8A,1907.98063,1.312,95.70%,99.88%,N
Solana Bounty Beach 🏖️ Powered by Jito,eYz2SxqtjoojYR3KVvLU3wBQks62fKcGX2821eChPw2,1733.98869,2.149,77.12%,81.92%,N
Notifi Network,Fi5PyZW2FHsrDWvHRwNBiAAuHRg7467jhpEwC29zd567,1675.48173,2.175,75.07%,83.08%,N
Solasolana,AV2h5iBU1Tkdy8j4rxgJK7nBJYvR11hD3dyvjoyBvbYu,1584.11890,1.611,89.61%,95.43%,N
DR. Leon | 0% fee,Bk8riTBHQgTgRfszdKioFrpx2P6VMRZXDmzs3zWtT1Me,1463.60188,1.444,93.17%,99.42%,N
Solarius,9FZWpUMfXZ3993g2BfqSFg7xcx9iUCxQwKeYzr2WQCM1,1439.03254,1.881,90.41%,98.32%,N
Renthyz 0% +MEV,DZQyJF6HwnNejtTbNtihHVi4C8wBbLmRLWnsn1t6sgo8,1327.89051,1.993,80.96%,86.22%,N
Ishtar,CtiiCQbRh13cqorWaEimroRznTL2qTytNhzYz53BCnbq,1317.41751,2.049,88.71%,96.87%,N
pafnutij,2YNubqM7eHLEL7JnygJYSWPq42LXYKiL5GkXfvEbZGQW,1224.99027,2.420,89.84%,96.57%,N
iluxa,ERXQNpsCnxHWhiTjFTKuRYRJs13hHqSKJdx5aDGe8Ww3,1106.83216,1.466,93.88%,99.04%,N
Avada Kedavra 🐍,He4AUUbyUciqmWuAga11ucr2tM64GA3NqFXYEPmHPv6t,1082.15431,1.319,95.69%,99.88%,N
Rackdog,4WYZhk6CYCVEqpehJbv6w7wJUgW2nDjeVMPvsomy8mbM,1027.06575,1.459,93.28%,99.75%,N
"Wagyu Validator - Premium Stake, Premium Returns (No Fees!)",WkP89qGBLsdu2XNVigu7WZThfCEsBJEvDBwWxUCv5vj,1026.74355,1.569,86.69%,98.34%,N
Trump,MAGAwoQLu8gzMdb6S7hUCW6twaKrXWVHWDs7qZ1UNJu,1018.44259,1.712,94.44%,97.32%,N
SharkNode,sh4rko7QjstESbderAwDEGitkXuuHdXLK4h8BQkr81i,1007.36343,1.393,94.51%,99.29%,N
🛡️ EverSafe | +0% MEV,3nYnW8z3Aum5U6HiVLJkR71rauWPW2hyvngye4t25rPt,989.06523,1.410,93.58%,99.89%,N
Free Ross Validator - Portion of proceeds to freeross.org,FREEL1BCzmPpNneC7FHCtBqzeWYrHRbtisFvi4N8XUP9,946.33914,1.520,95.33%,98.34%,N
IggyStake,motHerBDDLoLpk1VwWmztHvw81sMdyoQKtcGsdbYzYq,945.95352,1.893,95.13%,98.08%,N
DogWifValidator,HaTniLULzUW7Mfq5qBXPU3okduucnoq81Kr21niLjNgT,874.80873,1.785,95.01%,98.13%,N
estet008,FD1S7VFjDhWXwq5hnFpmAMqnt8cadQf9o3pNzr3ETJTZ,847.70824,1.666,85.96%,99.70%,N
AMS 0% Validator | No commission + Jito/MEV,5AmyDJ3uyTf4poghKocgUePjFR2y9PgKkZLFM1S1aL6U,841.19777,1.311,95.98%,99.83%,N
,B9aUcoqmbxJgbPb28oVoZg6WsXUj6Hf6Wu5P7CUbJ6NU,834.42366,2.232,83.20%,93.27%,N
DriveSol,9DR48EtgDzh3Gx5HiiQikZn9c2y12casm1bcUMuurV2x,833.42513,2.055,78.63%,89.40%,N
Olegvid,BXaSsyrvY5o19AoRDovjzVyZU9nXHixuDfNjBH8pfbjd,750.89392,1.913,85.84%,92.90%,N
brane226,7yXM5mUSAtBuh2TcCABvSJa3LouZ8wcLps5zTEMiwxvj,680.56779,1.907,83.56%,93.03%,N
SolarTeam,8PTusiY7z4wfjScHU6hr459AFDzrCki4wWmwhXd91mMr,665.32789,1.521,92.23%,99.70%,N
Metisado,9DUTDovSg7Tfc2C9mBHvtGfqfgaBY7srBb2ZYPCDgUPY,595.00101,1.535,91.48%,98.64%,N
Stake-Take,8gGA1SZZ4ASou3mHm61T6vM4jskkjYzXFmbCLwtU3x3j,542.93784,2.008,81.17%,92.14%,N
,6D9w8FRw5EFr5qtZEphPpughN3W8zc8p6zMXg4PFuaXL,512.03174,1.676,89.64%,98.09%,N
,3zQ1MrxjQQFzZ1pwf3jkBQJsx3A6fo661Td1afYh3Euc,510.49238,1.401,94.41%,99.84%,N
,99qWAJz1guUvUFwYAXr8jLMvPn2Tj3DWXjmC4q9SvjjQ,491.22294,1.439,93.31%,98.58%,N
,4FvYz1jD34CLpN4FhLVEnqAboc1HM4JUErBjxQaj8YY8,490.39488,1.476,92.65%,98.22%,N
,3haaHvHV8v6hDoUHVoKnEVZ6ZyyqFexJDizXi1ZoxtJn,465.88068,1.486,92.43%,98.07%,N
,7BmZ4jKsK1ewLZAPajQJdAZeKTpnfebTuzqZjfKT5pcr,430.51753,1.369,94.81%,99.70%,N
olikluk86,5KZ2dv5fnpJGy9LjwXkvXX5M7U6NjqxW8UfbVkTph89n,429.63627,1.540,91.02%,98.58%,N
888|tnso,FdD4CP38NUZf2e1dN6tLw5Q4iU2cb438v1eGcQy5x3nQ,419.47748,1.676,89.75%,95.66%,N
Victorius,EuUxT2aEqiAVkCjdfjehTYzPA9vGSrS4AEcroUf3Cxq6,408.26374,1.670,92.65%,98.92%,N
sashamaxymchuk,97QujuhmyxD19CpgdyNAcJXvKi6oDeyRPdNep6uXBbA4,339.06841,2.319,83.00%,89.05%,N
Klamenzui,9y1fMDRdYaYbCSWEv3sivjns4Sc7eDW8wFQYT1DnCsQa,306.13906,1.535,90.21%,99.66%,N
,F9yuGStLA8Mq67nQKGwp9SRG4JzQNU5U4zFPmgbS1YS,266.12809,1.785,92.32%,99.03%,N
,GmyxzCjsRJupxiiHJxKuiSYy3jrrDvn9pBkbhHzqCH1K,236.69835,2.648,81.69%,88.85%,N
,5fdEXhCBKC7FRRsH64asZCSiwgNXRozxmzb1cFzfrtWM,216.00016,2.050,77.84%,88.54%,N
,FQ7vjqjz7sxLA9m34TfieT7dZZ6hsaNhJV6r744UDRKR,214.53863,2.200,92.18%,98.35%,N
natakb,6FMaXpe2KWDeqzKVuKBAJRgG79zARSLsFkwYyKrij4vX,188.78357,2.106,89.85%,97.45%,N
Cryptology,BfxZj7ckfRGHxByn7aHgH2puyXhfjAUvULtRjJo4rd8C,166.88160,1.756,85.72%,91.13%,N
123223,GxYEVifcdfhoLqokuFUQmBFhCwuXXqPbuMDurc5JQoZZ,149.99771,2.326,73.22%,78.28%,N
,3UZVAr2B7wCyPZUhFftaYTpyUcbinLwNEvkgZqje14Wr,149.99771,1.850,84.54%,89.94%,N
,5wP5Qm9frQfXY9QadZZHqgy6GEvqtHjpJ6uongxdb5gJ,139.99772,2.543,77.29%,95.59%,N
,37Fz6yZjFdZS6DDsJSsswX5kSvunaZQtQ5zusC3y9V7S,139.99772,2.302,80.39%,96.07%,N
,4VYA9PECtNzDRXNHKepzMprS1Y6nxKF4oRRnwkJqQZys,139.99772,2.231,79.87%,96.57%,N
,6m4ZwGp8zCuqjBoAn11pYAQun2FwSMe86RwPbqpf34YC,139.99772,1.736,86.41%,97.44%,N
,8PUpp7RJjTriZXRu2fQiWbaS9MrED8L5t7kPuFTWxRAs,139.99772,1.852,93.12%,98.20%,N
,CyxKaD6TayfbCRx6mSrLpPY1YSLofdVZKA6BSThXWfXS,139.99772,2.060,89.07%,95.40%,N
,3Grtx7bvWU7FPZDWZRdUUmigXBSfkJUzwdZqgfAapcgz,139.99772,2.365,80.34%,97.21%,N
,6QqKyiWbTakuVviGWLAjfoFsyULUMxnFTRbxNcAF7HvY,139.99772,1.977,78.18%,99.67%,N
,CKLRSR1fxYybR553rjwknHdnShRFmYAcCZWvoTExBqBp,134.60335,2.571,78.11%,86.54%,N
,G8fLwPKzRD8HtStVtos65Cmiy6Jjs8Y4dNFRFcdSUhVj,134.15311,1.712,85.95%,94.63%,N
1package,8PMeDKfxUKv4KJBBQJYPmfyZfoYYnMju6fnokRR9uT2w,128.50549,2.544,84.63%,98.22%,N
,6tZcqt31FzJv6DhnNeS8xBCH66gvcL5ACrfqyqxQvgJg,124.64489,2.043,80.84%,90.55%,N
,GJQjnyhSG9jN1AdMHTSyTxUR44hJHEGCmNzkidw9z3y8,124.36817,2.647,85.46%,91.69%,N
,3Z1N2Fkfha4ThNiRwN8RnU6U8dkFJ92DH2TFyLWJf8cj,123.26666,2.654,85.04%,91.79%,N
moon_light,UgmcX7FwNdXbiWsHY2RaqZqTdhsZxx5y6on85j3s3tA,121.07784,1.888,92.48%,98.39%,N
feda,AMvyqeuRBxcDuy38MuGtPksvBtpuT3NPyoiVBDbzza6P,119.62657,1.723,86.99%,94.15%,N
O'Solemio,7HhmcAGzjChFjG1qsN4Y9NPgDWfytXXVA7ZRBWE7eZc3,119.43409,1.946,81.66%,89.93%,N
Moovi,CviQXDMPZPVAZ5qgVGN2gSBSD9GqqwRt7VZidoHMpArr,118.89067,2.202,75.83%,81.67%,N
,4bhoRSz53dMABDx2CkA9KSXtu5NGhoJA1SzY1h2Pttqi,118.48491,2.071,79.62%,85.46%,N
,63mj5NgxsJigb6GEc4KVMsydnM4fQ8qg5ujU57puT154,118.03961,1.498,91.93%,98.52%,N
✨🌻 Stakeyard Validator 🌻✨,Syrd4L1eGcZdhRGoB9wb4aJKKJKv9gMudZLMnXdV7AR,116.87862,1.398,94.18%,99.03%,N
,EARTHZeTM64X3UMYf5rcWonQkTCn3uifEwutBx6e656K,114.20954,1.587,90.96%,96.59%,N
Stake-o-Matic,EwtnPXAgJsN8GVpX4GiJc1pSKcMGnCVmwwDiXrjuC3fP,110.22630,1.749,84.95%,94.37%,N
,9cn49HT2MVjUQtrFQU6WJ29w5THLuHLCjawuEzQf5rVH,110.00525,2.160,75.17%,80.53%,N
,9KUA3BzMqFb5R8KLLdaMDHGkdKWUDwev7B3xY6a3VubD,107.38413,1.783,86.83%,93.17%,N
PokerPro,GyHM7HLmryEbnsK42abvCL2W2XAQLV3ijpYaZf5ietdQ,107.38181,1.780,85.13%,99.30%,N
🌐 Crypton | No Fee +mev share,8CKQeLWLkFXD9kg2U4y238i4eQrAxsoVtNA1dAtysbfJ,105.31453,1.304,96.06%,99.94%,N
Ikari,HBuFNK1dRGsqbrornwge5YVpN9AYF5T2issPmPdvLBWk,104.42920,1.570,89.63%,96.25%,N
,CY3tZ2Rh3tHHC2SAmiJUGMAj1b9uPpzr5YQ7b53PfANe,103.86353,1.412,93.98%,99.76%,N
Nexus 🔗 [0%],GbC2vzt6S2HsUAJ46Qfh3aoG6oB9y3V4T7XD7914K5na,102.30559,1.429,93.24%,99.83%,N
,88GrXE71Kn7oxrptCy8bgmQHBwVhxXz9EGwZ981N3j2Z,101.74150,1.715,87.29%,94.83%,N
🔮 Oracle 0%,4mUZWLYoo16fe2S2xZ1DdXZHBxynRWBAf3prokBQsxac,101.31583,1.318,95.77%,99.93%,N
,HBH2mppWdny8NBgxm61DjDqBzNLymn8fZFkFX6JnSAX6,100.25137,2.363,83.01%,88.92%,N
✨ Starfire [0% fee +MEV],C6o1toH7rriz2DocmgTw6JzFbJdLpQ9w2QsjeKQQinfZ,70.21819,1.309,95.87%,99.87%,N
,HCvnhbT3Sn5RsueDisWzzn5FkW8tAqoQK1dr7cvAVzin,64.16280,1.572,91.27%,97.31%,N
👋🏼 Heystakes🙋 Stakers First.,HeyVYASPrUcKBwV25axjdjjWzXbMs4sR5XCEt1u2f2N1,52.00162,1.458,92.81%,98.42%,N
,9e3pdMefLQxQPsdYf2UwEZ3bFXFtG6uDhTLHUNgVbMRP,51.42461,1.972,74.80%,96.13%,N
,2rrET16i1JW4PueBpiShFDbHDBPd9KXTp51rW2YsfMna,46.59577,1.733,84.34%,99.47%,N
,4m833YwMhQzok51o57kPGkhF1XVHbt7sdqV3NAJZpeHe,43.29569,1.691,86.66%,95.44%,N
TYO 0% MEV/Validator commission,4SMxMpQ2uaF5chFaMg1NwSg4oppoPBrbncKCBeQsxKi2,18.58688,2.030,75.84%,96.94%,N
DeVision,DeVoo144N6iZuZSQPm8uKRrQRtUSFqDmoi5t6E4WQasT,17.34072,1.976,78.78%,94.09%,N
0% fee✅ + 🚀High APY + MEV🔥 Max Profit,HSrVYheVzxb298uP83jFpS3ZHAEk8jJfJ25cbnnZ2gBp,13.32414,1.571,94.65%,99.59%,N
GLD Technologies,CxFe8PsDXAuzgZzP7N8um59iL517Lz8SWtPahbfU9zVo,6.31169,1.349,95.36%,99.76%,N
EdoYiM & Cyf,2pMnLsfMFoZgvYWN8MVYTjdKTtPmRJ1SAMTctCAmrRbz,3.02298,2.187,74.30%,86.30%,N
Pier Two,DierScgiTrz5AM7mddeJLHYNvafym3XhjjdM51AnKevU,2.98557,2.003,78.14%,88.61%,N
,xaNDLhifeWD4rmW4QmTghZ6q3AoKb2ifRaiGhxMwDSv,1.99872,1.810,83.14%,90.33%,N
,proofK5zwB5eo5q6UWnFKiDHxyh8wopP5Bq1aXVnouw,1.49995,1.920,79.90%,88.48%,N
PIT 0% Validator | No commission!,9iFqFRaQL7dHcmqJwfy4RZaTB64ne7S9iL8GuPMfD7f4,1.12549,1.335,96.44%,99.73%,N
ThunderBoltSOL,5QvSK8g7Veg7W9cACqG4sxNjYbexUArMTFJp7PVpFjmg,1.11298,1.727,87.31%,99.53%,N
,6X8ZbfHrRgmLuPBRAsxDMjUv49yAt9T4M9W8WxXU7cQf,1.10013,1.569,93.24%,98.84%,N
HODL,8eJ3ua6hGSbg1db5uLoiWzTyyB8D8nnEHZB41f8JQ84g,0.01080,1.478,93.17%,99.00%,N
,LUM3Ur6VsoBygnLvmU1JjBKJCwFFs21iuohgjwQj8JV,0.00872,1.600,89.98%,96.70%,N
seanode,Gi1gB3t3pimTQcg5VxvuKWqVxs9w6VXMeu2jsvfcthF6,0.00000,N/A,N/A%,N/A%,N
,NiAtsR9wJC66TksBLxguTeVvCzxrKHGJKodMGcSjzGJ,0.00000,N/A,N/A%,N/A%,N
comr8_nga,8jcD4kdVWqMWCftK6GYEhEwDvYyT38JMxUpNAnucfaoX,0.00000,N/A,N/A%,N/A%,N
,SMiXytR2PzfroS7cHz7b4Gqd6xQNT4NmGu5aiHPm8hq,0.00000,N/A,N/A%,N/A%,N
A2Z Node,9rCjrRUhbVtgRLZJkqrbdaQCujrGo2asoHRRwmT6KiSW,0.00000,N/A,N/A%,N/A%,N
,BLy23csJMYqmXaDVseojGWzBWxYJwRddLnLBy91sWxMq,0.00000,N/A,N/A%,N/A%,N
Aviasim,3pkUgFgRcKsopSuL2rVwc8g9rGJZDCKLciL16krEqzmP,0.00000,N/A,N/A%,N/A%,N
,5xaCbKhVdjvS2LMFbZe24TgJiVHaAEUXWswS8vTmFDLZ,0.00000,N/A,N/A%,N/A%,N
Litx - 0% Commission,UPG3TJHUZLVzDdtqTbQ81mWvum7Equsjju5YtNJ45Pe,0.00000,N/A,N/A%,N/A%,N
01node,7AQa5QwjMgCPPYMf9n1eJvCAww6q93Mfhgjss2vYSCVs,0.00000,N/A,N/A%,N/A%,N
01node,4QkWUd7N3H2jXPn9reGJHYKNyrNKL7EAtei1fRhwZxsc,0.00000,N/A,N/A%,N/A%,N
Iservers,C1JTL6E1yY9vGHhUpiGCvSn7yka2Hadnk3jyB6hxgpi,0.00000,N/A,N/A%,N/A%,N
seanode,9552Z4WkZnNswxxAhrwfDrD6or743nQj2vneZwEgWfCo,0.00000,N/A,N/A%,N/A%,N
@bftpapi,GkzMZUHJRrxr7GzJ4o7zWigUQJSFDBgPkXrYsXngwU7z,0.00000,N/A,N/A%,N/A%,N
,Ex4vuUmGDnA8XAWUQLZreJPpzSWizaeHY1DqbzUZJoQJ,0.00000,N/A,N/A%,N/A%,N
Radiants,radV9yVr15kYYdVjzaK1s35cKdYDxtT9AaTku9UJ5Xj,0.00000,N/A,N/A%,N/A%,N
,BpzyncaYq7mgs25EsYFLviqsQozVh8Tcg5r8SHKgzvWd,0.00000,N/A,N/A%,N/A%,N
Serhio911,Gmoe8Fa1tv1b4MqqGL1UaFqgaosDvG7F3NP2joXpzGss,0.00000,N/A,N/A%,N/A%,N
TKTN,8bqQZKNDs1jBysJhwJB8xqYdFr5t3Yqbrk1dqhvEnQrD,0.00000,N/A,N/A%,N/A%,N
,E3xVQ5Lyqmp9fzhvysWLPfiQirhmsAqBvMXzuWxcri63,0.00000,N/A,N/A%,N/A%,N
StakeRocket,DoGj8GWeHSn5yFRSY6eFDztLZq6wbaYr9MByoaaYjnDS,0.00000,N/A,N/A%,N/A%,N
web3ident,cokww994BvGJovauZrQE6rq1oMnA9Zt8UTQnY1tAm5W,0.00000,N/A,N/A%,N/A%,N
Node Doctor,jYzXKDKLHMFbMZhAZpFJw9KihTwfnYYwpTyxCz2wcgP,0.00000,N/A,N/A%,N/A%,N
Mors,HMpU18R172tuTUGr2Muf9MnEjanhs3Nnbj9obRSLFZ7Q,0.00000,N/A,N/A%,N/A%,N
Blockscope.net,4MJ9Xooe6WHG32qiQSKrGZqctCVdx9Jc6murk4rcrBWt,0.00000,N/A,N/A%,N/A%,N
Accountant Validator,AKVVFLXCy93poVKNUrWVbMJ97kvsx36Az3D5ANdEb9mU,0.00000,N/A,N/A%,N/A%,N
Cryptosapiens Staking,Eu4S3UYcknkejoRjKHwFPYR9CrGTJKs5tUn8uFVKb9Qt,0.00000,N/A,N/A%,N/A%,N
mSOL,52z5KoJK3StJj5WB9PBgUKZ9mUr4tskfqk2UswrjKqhs,0.00000,N/A,N/A%,N/A%,N
,Dc2UCgK6MTPUXgZncfH7dNweBF9SCgcBRKgPZHaL4roi,0.00000,N/A,N/A%,N/A%,N
GPvalidator,3n6beoog8CUZ6e6scUhvrpNii421h2DVBUpNKDGMvLtB,0.00000,N/A,N/A%,N/A%,N
GERvalidator 🇩🇪,zbEaRULo6RYPpyJZ8zkAAM4PJajuxKuzs4RdWjnfvGw,0.00000,N/A,N/A%,N/A%,N
Payler,3TpYG5n3mk6cgn2EfGWjVbDHtKHvShZ7ENrxNkJsq9xH,0.00000,N/A,N/A%,N/A%,N
,Bw8sw7z5oC3TKbh9TAwMhjuCpV5YYezLebDyMdxmEz48,0.00000,N/A,N/A%,N/A%,N
MoneyLong + MEV,C6Sbza8h1fZ2ymmHyqGhosZDaPJEJ4vPKxBRaY254Mw6,0.00000,N/A,N/A%,N/A%,N
Lifinity Protocol,CbSmrSZ1wcbhF5HY7MvdgfEmzkiaKkgN98xBAoawHgdS,0.00000,N/A,N/A%,N/A%,N
Banana staking + Jito MEV,DvMLeiRbqnuaWEW3dLHL5exexiLnAQZBYTdQLGrPNRQh,0.00000,N/A,N/A%,N/A%,N
,Je1LTmuCLzfAWbEfAuUNXHv6i72HZPJSicRtSGGZ95c,0.00000,N/A,N/A%,N/A%,N
,irdEwJaWw5tihyUbf4XKeNKbDaAMqBHhZ2ZBST2dnhp,0.00000,N/A,N/A%,N/A%,N
Crypto Plant,7u7MR7wh5Vv7yhj47UBWLkr1yLQusBb7MAg3N9uRkbv4,0.00000,N/A,N/A%,N/A%,N
,D6xChnjpy8SNGiKYZmipMkvvTo3dwuaYTfth5zEB2st2,0.00000,N/A,N/A%,N/A%,N
,6yg4Usyr8VkvY8m7wrbLHegKVnKaAQmEwS6cuGnwB6wT,0.00000,N/A,N/A%,N/A%,N
lal,JAd4nUn6UN3CbR1ESnsV9Dha3BBUmMVzmBXyUjjebSdG,0.00000,N/A,N/A%,N/A%,N
Appload 🚀 maximize your profit,8y7QS2s8RsrM9nBacPvqyRSQ9W5znw57wmMWvSVPYwZr,0.00000,N/A,N/A%,N/A%,N
,E7hM2qxC4edVYxnfLv3hpbjqP7Ps31QAW3EoW9qZg6Vf,0.00000,N/A,N/A%,N/A%,N
,NikkLAKj6awJkM5PgYEUXFVbyKZMeUWY5JpQtz7vpQf,0.00000,N/A,N/A%,N/A%,N
Solana Iservers,Fa9PYem469gkUco2uGArcJR6k5dBQqMeQcrxoRdkoZA9,0.00000,N/A,N/A%,N/A%,N
Kotofix 0%,44MUR8uuQZZvNBe9qGBud1EtgYBsUndpiYLAae6HYUc1,0.00000,N/A,N/A%,N/A%,N
A2Z Node,4R8fumBo51jmuaCpbh8KqmggCwmwcQ4RRAEbmGtLLv12,0.00000,N/A,N/A%,N/A%,N
,Gh64v29qbKHpc5v3Sb11T9owFwZp8yRjxc7c4UdiFino,0.00000,N/A,N/A%,N/A%,N
BONK - Powered by Jito,J1to4SUCREc6FBbf7gTBtq3QpXqh4Xu53Z9dp33oD3Cf,0.00000,N/A,N/A%,N/A%,N
DriveSol,Dex2AW5B9VDkkJ36wzuS5WB8CXHw8VhJwF4WT5no5B9H,0.00000,N/A,N/A%,N/A%,N
Urban Node,7uZnUJuAddyQJDwy1xujP5Uxfhy8m6MAdqSFpVSJ9Ls2,0.00000,N/A,N/A%,N/A%,N
